hjid,country_id,country_value,data_value,indicator_id,indicator_value,year_date,data__data_element_hjid
2760744,DK,Denmark,"",EG.GDP.PUSE.KO.PP.KD,GDP per unit of energy use (constant 2021 PPP $ per kg of oil equivalent),2024,
2530448,GB,United Kingdom,0.0509169689260856,TM.VAL.MRCH.RS.ZS,"Merchandise imports by the reporting economy, residual (% of total merchandise imports)",2003,
2356744,SE,Sweden,"",AG.LND.TOTL.RU.K2,Rural land area (sq. km),1986,
3000955,NO,Norway,1.4328176442236,SP.URB.GROW,Urban population growth (annual %),1998,
2857258,US,United States,61.229,SL.TLF.INTM.ZS,Labor force with intermediate education (% of total working-age population with intermediate education),2009,
2897483,NO,Norway,"",FR.INR.RINR,Real interest rate (%),1998,
2807206,FI,Finland,"",DT.NFL.UNWT.CD,"Net official flows from UN agencies, UNWTO (current US$)",1988,
2756241,US,United States,40220896746,DC.ODA.TOTL.KD,"Net ODA provided, total (constant 2023 US$)",2012,
2856291,US,United States,"",DC.DAC.NZLL.CD,"Net bilateral aid flows from DAC donors, New Zealand (current US$)",1988,
2458751,SE,Sweden,0.199456196798291,DC.ODA.TLDC.GN.ZS,Net ODA provided to the least developed countries (% of GNI),2020,
2587359,GB,United Kingdom,5.34440833333333,FR.INR.LEND,Lending interest rate (%),1999,
2734867,DK,Denmark,341094198000,NE.EXP.GNFS.CN,Exports of goods and services (current LCU),1992,
2733528,NO,Norway,"",SE.PRM.ENRL.FE.ZS,"Primary education, pupils (% female)",2018,
2344197,GB,United Kingdom,"",SE.PRM.PRS5.ZS,"Persistence to grade 5, total (% of cohort)",1986,
2719468,DK,Denmark,"",SH.FPL.SATM.ZS,Demand for family planning satisfied by modern methods (% of married women with demand for family planning),1969,
2542543,SE,Sweden,3.44151306931,BX.GSR.INSF.ZS,"Insurance and financial services (% of service exports, BoP)",1993,
2922899,FI,Finland,"",DT.NFL.SPRP.CD,"Net official flows from UN agencies, SPRP (current US$)",1975,
2482922,FI,Finland,"",SM.POP.OPIP.EO,Other people in need of international protection by country or territory of origin,1988,
2620571,GB,United Kingdom,"",SH.XPD.GHED.CH.ZS,Domestic general government health expenditure (% of current health expenditure),1987,
2863484,US,United States,"",SL.TLF.ADVN.MA.ZS,"Labor force with advanced education, male (% of male working-age population with advanced education)",1978,
2413108,SE,Sweden,11483500000,TX.VAL.MRCH.WL.CD,Merchandise exports by the reporting economy (current US$),1973,
2976033,GB,United Kingdom,2569401760704.28,NE.CON.TOTL.CD,Final consumption expenditure (current US$),2007,
2308807,SE,Sweden,8.54669302687517,SP.POP.2024.MA.5Y,"Population ages 20-24, male (% of male population)",1969,
2450124,SE,Sweden,"",SH_UHC_FH40_IMPOV,"Proportion of population facing impoverishing out-of-pocket health expenditure, based on the societal poverty line (%)",1969,
2960784,FI,Finland,"",SH.XPD.EHEX.PC.CD,External health expenditure per capita (current US$),2023,
2510497,US,United States,"",SP.M15.2024.FE.ZS,Women who were first married by age 15 (% of women ages 20-24),2014,
2504340,SE,Sweden,"",SG.TIM.UWRK.MA,"Proportion of time spent on unpaid domestic and care work, male (% of 24 hour day)",2006,
2338441,DK,Denmark,3873,IP.TMK.NRCT,"Trademark applications, nonresident, by count",2014,
2860485,US,United States,2578.05488947,SH.XPD.GHED.PC.CD,Domestic general government health expenditure per capita (current US$),2003,
3003496,NO,Norway,"",IC.BRE.LB.OS,B-READY: Labor: Overall Score,1971,
2452554,SE,Sweden,"",SH.PRV.SMOK.MA,"Prevalence of current tobacco use, males (% of male adults)",1970,
2603254,GB,United Kingdom,3.85,LP.LPI.ITRN.XQ,Logistics performance index: Ease of arranging competitively priced shipments (1=low to 5=high),2007,
2980782,GB,United Kingdom,"",DT.NFL.UNCV.CD,"Net official flows from UN agencies, UNCOVID (current US$)",1964,
2332982,NO,Norway,"",SH.STA.ANVC.ZS,Pregnant women receiving prenatal care (%),1975,
2695531,DK,Denmark,"",GC.TAX.IMPT.ZS,Customs and other import duties (% of tax revenue),1967,
2562351,SE,Sweden,66.183,SL.TLF.CACT.FE.NE.ZS,"Labor force participation rate, female (% of female population ages 15+) (national estimate)",1995,
2856260,US,United States,"",DC.DAC.NZLL.CD,"Net bilateral aid flows from DAC donors, New Zealand (current US$)",2019,
2846084,NO,Norway,"",SH.PRV.SMOK,Prevalence of current tobacco use (% of adults),1976,
2335276,SE,Sweden,2263210000000,NY.GNP.MKTP.CN.AD,GNI: linked series (current LCU),1999,
2894837,US,United States,"",IQ.CPA.PROT.XQ,CPIA social protection rating (1=low to 6=high),1973,
2367263,SE,Sweden,2880301,SP.POP.1564.FE.IN,"Population ages 15-64, female",2004,
2733320,DK,Denmark,"",NE.GDI.TOTL.CD,Gross capital formation (current US$),1965,
2432391,NO,Norway,"",EN.ATM.PM25.MC.M3,"PM2.5 air pollution, mean annual exposure (micrograms per cubic meter)",1988,
2802957,NO,Norway,93.63,AG.PRD.FOOD.XD,Food production index (2014-2016 = 100),1995,
2922157,FI,Finland,31674000000,GC.TAX.YPKG.CN,"Taxes on income, profits and capital gains (current LCU)",2023,
2792935,US,United States,9.14931208783817,SP.POP.1519.MA.5Y,"Population ages 15-19, male (% of male population)",1966,
2662064,NO,Norway,623,IP.IDS.RSCT,"Industrial design applications, resident, by count",2015,
2818508,GB,United Kingdom,"",PV.EST,Political Stability and Absence of Violence/Terrorism: Estimate,1978,
2444957,SE,Sweden,"",SN.ITK.SVFI.ZS,Prevalence of severe food insecurity in the population (%),2024,
2788893,US,United States,"",SH.DTH.COMM.ZS,"Cause of death, by communicable diseases and maternal, prenatal and nutrition conditions (% of total)",2001,
2372217,DK,Denmark,16.8089410511094,NY.ADJ.DKAP.GN.ZS,Adjusted savings: consumption of fixed capital (% of GNI),2020,
2677474,DK,Denmark,6366000000,ST.INT.TVLR.CD,"International tourism, receipts for travel items (current US$)",2011,
2508800,US,United States,80.2956251356731,TM.VAL.MANF.ZS.UN,Manufactures imports (% of merchandise imports),1998,
2983783,GB,United Kingdom,"",SL.EMP.1524.SP.MA.ZS,"Employment to population ratio, ages 15-24, male (%) (modeled ILO estimate)",1973,
2971492,GB,United Kingdom,"",DT.TDS.DPPF.XP.ZS,"Debt service (PPG and IMF only, % of exports of goods, services and primary income)",1968,
2337163,SE,Sweden,"",DT.NFL.UNWT.CD,"Net official flows from UN agencies, UNWTO (current US$)",1988,
2517883,US,United States,-18953000000,BN.GSR.GNFS.CD,"Net trade in goods and services (BoP, current US$)",1980,
3019206,NO,Norway,"",SH.ALC.PCAP.FE.LI,"Total alcohol consumption per capita, female (liters of pure alcohol, projected estimates, female 15+ years of age)",1975,
2615851,GB,United Kingdom,"",VA.PER.RNK,Voice and Accountability: Percentile Rank,2001,
2521118,SE,Sweden,2.96842767016136,SL.AGR.EMPL.MA.ZS,"Employment in agriculture, male (% of male employment) (modeled ILO estimate)",2011,
2430921,GB,United Kingdom,"",IQ.CPA.BREG.XQ,CPIA business regulatory environment rating (1=low to 6=high),1967,
2329443,SE,Sweden,21.5199,EN.GHG.CO2.IC.MT.CE.AR5,Carbon dioxide (CO2) emissions from Industrial Combustion (Energy) (Mt CO2e),1972,
2486364,DK,Denmark,9231245,AG.PRD.CREL.MT,Cereal production (metric tons),1991,
2881636,US,United States,6.6,SH.DYN.MORT,"Mortality rate, under-5 (per 1,000 live births)",2017,
2651814,NO,Norway,"",per_lm_alllm.cov_q5_tot,Coverage of unemployment benefits and ALMP in richest quintile (% of population),1988,
2611764,FI,Finland,"",IC.CUS.DURS.EX,Average time to clear exports through customs (days),1963,
2597239,FI,Finland,"",IE.PPI.ICTI.CD,Investment in ICT with private participation (current US$),1989,
2594121,FI,Finland,"",NV.AGR.TOTL.KD,"Agriculture, forestry, and fishing, value added (constant 2015 US$)",1961,
2986650,GB,United Kingdom,11.7,SI.DST.02ND.20,Income share held by second 20%,1995,
2731362,DK,Denmark,18.6809911360155,NV.MNF.FBTO.ZS.UN,"Food, beverages and tobacco (% of value added in manufacturing)",1999,
3009623,NO,Norway,"",DT.TDS.DPPG.GN.ZS,Public and publicly guaranteed debt service (% of GNI),2008,
2841835,US,United States,50.1660275385314,SP.POP.TOTL.MA.ZS,"Population, male (% of total population)",2016,
2441035,SE,Sweden,1.45204678362573,ER.H2O.FWTL.ZS,"Annual freshwater withdrawals, total (% of internal resources)",2022,
2880973,NO,Norway,96.2258960561452,EG.ELC.HYRO.ZS,Electricity production from hydroelectric sources (% of total),2016,
2587505,FI,Finland,13707000000,NE.EXP.GNFS.CN,Exports of goods and services (current LCU),1983,
2989150,GB,United Kingdom,"",SE.LPV.PRIM.SD.FE,Female primary school age children out-of-school (%),1994,
2738768,FI,Finland,47583000000,NE.GDI.FTOT.CN,Gross fixed capital formation (current LCU),2008,
2753063,NO,Norway,31,SH.DTH.1014,Number of deaths ages 10-14 years,2010,
2653611,GB,United Kingdom,"",SH.IMM.MEAS,"Immunization, measles (% of children ages 12-23 months)",1961,
2683236,FI,Finland,5.9954,EN.GHG.N2O.MT.CE.AR5,Nitrous oxide (N2O) emissions (total) excluding LULUCF (Mt CO2e),1990,
2359918,GB,United Kingdom,86.7724838256836,PV.PER.RNK.UPPER,"Political Stability and Absence of Violence/Terrorism: Percentile Rank, Upper Bound of 90% Confidence Interval",2002,
2785347,DK,Denmark,"",EN.CLC.DRSK.XQ,Disaster risk reduction progress score (1-5 scale; 5=best),1993,
2860472,US,United States,3700.15598321,SH.XPD.GHED.PC.CD,Domestic general government health expenditure per capita (current US$),2009,
2502582,SE,Sweden,2.32864999771118,SE.SEC.UNER.LO.MA.ZS,"Adolescents out of school, male (% of male lower secondary school age)",2007,
2606911,GB,United Kingdom,39782765,SP.POP.1564.TO,"Population ages 15-64, total",2005,
2660861,US,United States,110.83977564052,PX.REX.REER,Real effective exchange rate index (2010 = 100),2005,
2463923,SE,Sweden,"",RQ.PER.RNK,Regulatory Quality: Percentile Rank,1970,
2978091,GB,United Kingdom,"",DT.DOD.DSTC.ZS,Short-term debt (% of total external debt),1987,
3025350,NO,Norway,34.7832999228196,CM.MKT.LCAP.GD.ZS,Market capitalization of listed domestic companies (% of GDP),1996,
2683768,DK,Denmark,5.456979724,SH.STA.BRTW.ZS,Low-birthweight babies (% of births),2000,
2543839,DK,Denmark,66.438,SL.TLF.CACT.ZS,"Labor force participation rate, total (% of total population ages 15+) (modeled ILO estimate)",1993,
2865233,US,United States,4.23484784076075,SL.EMP.VULN.MA.ZS,"Vulnerable employment, male (% of male employment) (modeled ILO estimate)",2023,
2320332,FI,Finland,"",SL.SRV.0714.ZS,Child employment in services (% of economically active children ages 7-14),2014,
2777295,NO,Norway,9.68000030517578,SE.TER.CUAT.MS.ZS,"Educational attainment, at least Master's or equivalent, population 25+, total (%) (cumulative)",2014,
2833331,GB,United Kingdom,29.2109287810524,AG.LND.ARBL.ZS,Arable land (% of land area),1974,
2373542,SE,Sweden,9635701000,NY.GSR.NFCY.KN,Net primary income (Net income from abroad) (constant LCU),1975,
2673220,NO,Norway,"",FI.RES.TOTL.MO,Total reserves in months of imports,1972,
2475780,US,United States,582045000000,BX.GSR.NFSV.CD,"Service exports (BoP, current US$)",2010,
2667802,NO,Norway,"",NY.GNP.MKTP.KD,GNI (constant 2015 US$),1966,
2399676,SE,Sweden,14.1395374358693,GC.XPN.OTHR.ZS,Other expense (% of expense),2003,
2834800,US,United States,"",DT.NFL.IMFN.CD,"Net financial flows, IMF nonconcessional (NFL, current US$)",1993,
2884165,US,United States,3050000000,BX.PEF.TOTL.CD.WD,"Portfolio equity, net inflows (BoP, current US$)",1975,
2530579,FI,Finland,0.146923849749267,BX.GSR.INSF.ZS,"Insurance and financial services (% of service exports, BoP)",1988,
2439412,NO,Norway,"",SL.EMP.VULN.ZS,"Vulnerable employment, total (% of total employment) (modeled ILO estimate)",1976,
2515134,GB,United Kingdom,"",EG.FEC.RNEW.ZS,Renewable energy consumption (% of total final energy consumption),1963,
2969269,GB,United Kingdom,1295308892355.69,NY.GDP.FCST.CD,Gross value added at basic prices (GVA) (current US$),1996,
2359149,SE,Sweden,3.07873752712795,TX.VAL.FOOD.ZS.UN,Food exports (% of merchandise exports),1964,
2305885,SE,Sweden,50.0676709502952,SP.POP.TOTL.FE.ZS,"Population, female (% of total population)",1965,
2563185,FI,Finland,"",EG.FEC.RNEW.ZS,Renewable energy consumption (% of total final energy consumption),2023,
2547335,DK,Denmark,"",SL.SLF.0714.ZS,"Children in employment, self-employed (% of children in employment, ages 7-14)",2001,
2946323,NO,Norway,"",per_sa_allsa.cov_q4_tot,Coverage of social safety net programs in 4th quintile (% of population),2009,
2695896,DK,Denmark,138823000000,GC.TAX.GSRV.CN,Taxes on goods and services (current LCU),1993,
2711882,GB,United Kingdom,122750856328.734,NY.GDS.TOTL.CD,Gross domestic savings (current US$),1993,
2631953,GB,United Kingdom,69.591,SL.TLF.ACTI.1524.NE.ZS,"Labor force participation rate for ages 15-24, total (%) (national estimate)",1985,
2976284,GB,United Kingdom,-71703000000,GC.NLD.TOTL.CN,Net lending (+) / net borrowing (-) (current LCU),2017,
2532840,US,United States,14,SH.DYN.NCOM.ZS,"Mortality from CVD, cancer, diabetes or CRD between exact ages 30 and 70 (%)",2015,
2540021,GB,United Kingdom,"",per_sa_allsa.cov_q5_tot,Coverage of social safety net programs in richest quintile (% of population),1964,
2566313,US,United States,18668333210000,CM.MKT.LCAP.CD,Market capitalization of listed domestic companies (current US$),2012,
2753393,NO,Norway,62.1231169933481,TX.VAL.FUEL.ZS.UN,Fuel exports (% of merchandise exports),2018,
2719104,DK,Denmark,"",SH.DTH.2024,Number of deaths ages 20-24 years,1986,
2760086,FI,Finland,11.21,SH.ALC.PCAP.LI,"Total alcohol consumption per capita (liters of pure alcohol, projected estimates, 15+ years of age)",2007,
2607769,DK,Denmark,"",FX.OWN.TOTL.60.ZS,"Account ownership at a financial institution or with a mobile-money-service provider, richest 60% (% of population ages 15+)",1972,
2712277,GB,United Kingdom,"",SH.STA.AIRP.MA.P5,"Mortality rate attributed to household and ambient air pollution, age-standardized, male (per 100,000 male population)",1965,
2633495,DK,Denmark,14.5878,AG.LND.FRST.ZS,Forest area (% of land area),2008,
2357980,SE,Sweden,"",VA.PER.RNK,Voice and Accountability: Percentile Rank,1982,
2961045,FI,Finland,"",SH.STA.TRAF.P5,"Mortality caused by road traffic injury (per 100,000 population)",2022,
2776464,DK,Denmark,124.619468688965,SE.SEC.ENRR,"School enrollment, secondary (% gross)",2003,
2783302,DK,Denmark,35.4003327746803,NY.GNS.ICTR.ZS,Gross savings (% of GDP),2024,
2822988,NO,Norway,36.3875911947582,NE.IMP.GNFS.ZS,Imports of goods and services (% of GDP),1979,
2561429,US,United States,"",IC.BRE.MC.P3,B-READY: Market Competition Pillar 3: Implementation of Key Services Promoting Market Competition,1996,
3005045,NO,Norway,85.6354424145776,NY.GDP.DEFL.ZS,GDP deflator (base year varies by country),2010,
2748700,DK,Denmark,54639,SE.SEC.TCHR,"Secondary education, teachers",2019,
2581255,FI,Finland,"",SP.REG.BRTH.RU.ZS,"Completeness of birth registration, rural (%)",2010,
2332532,DK,Denmark,"",EG.ELC.RNWX.KH,"Electricity production from renewable sources, excluding hydroelectric (kWh)",1986,
2396005,GB,United Kingdom,3.123,SL.UEM.ADVN.FE.ZS,"Unemployment with advanced education, female (% of female labor force with advanced education)",2014,
2432123,SE,Sweden,"",GE.NO.SRC,Government Effectiveness: Number of Sources,1979,
2633432,FI,Finland,"",GF.XPD.BUDG.ZS,Primary government expenditures as a proportion of original approved budget (%),1986,
2719714,DK,Denmark,"",SH.MLR.NETS.ZS,Use of insecticide-treated bed nets (% of under-5 population),1983,
2598673,DK,Denmark,74,SP.DYN.LE00.FE.IN,"Life expectancy at birth, female (years)",1960,
2800710,US,United States,96.9587602940035,SH.STA.SMSS.UR.ZS,"People using safely managed sanitation services, urban (% of urban population)",2016,
2358661,FI,Finland,94,SH.IMM.MEAS,"Immunization, measles (% of children ages 12-23 months)",2017,
2936388,FI,Finland,"",SH.DYN.AIDS.ZS,"Prevalence of HIV, total (% of population ages 15-49)",1966,
2753004,US,United States,"",SE.PRM.UNER.ZS,Children out of school (% of primary school age),2002,
2448338,SE,Sweden,"",SH.XPD.EHEX.PP.CD,"External health expenditure per capita, PPP (current international $)",2009,
2836078,NO,Norway,"",SE.TER.ENRR,"School enrollment, tertiary (% gross)",1979,
2748485,FI,Finland,"",SH.XPD.PVTD.PP.CD,"Domestic private health expenditure per capita, PPP (current international $)",1969,
2878896,GB,United Kingdom,"",DT.ODA.ODAT.GI.ZS,Net ODA received (% of gross capital formation),1980,
2665717,DK,Denmark,"",LP.LPI.CUST.XQ,Logistics performance index: Efficiency of customs clearance process (1=low to 5=high),1973,
2681597,DK,Denmark,"",SP.MTR.1519.ZS,Teenage mothers (% of women ages 15-19 who have had children or are currently pregnant),1982,
2810676,FI,Finland,90.5126495361328,SE.XPD.CSEC.ZS,"Current education expenditure, secondary (% of total expenditure in secondary public institutions)",2011,
2488174,SE,Sweden,"",EG.USE.PCAP.KG.OE,Energy use (kg of oil equivalent per capita),1973,
2846412,NO,Norway,"",SE.SEC.CMPT.LO.MA.ZS,"Lower secondary completion rate, male (% of relevant age group)",1973,
2999383,GB,United Kingdom,728891832074.511,NY.GDP.MKTP.KN,GDP (constant LCU),1967,
2955023,FI,Finland,"",SE.SEC.CMPT.LO.FE.ZS,"Lower secondary completion rate, female (% of relevant age group)",1980,
2336783,FI,Finland,1081000000,MS.MIL.XPND.CN,Military expenditure (current LCU),1987,
2546331,FI,Finland,4.80873627374566,SP.POP.6569.FE.5Y,"Population ages 65-69, female (% of female population)",2004,
2715543,DK,Denmark,88.2731888683128,SL.EMP.WORK.MA.ZS,"Wage and salaried workers, male (% of male employment) (modeled ILO estimate)",1994,
2836224,NO,Norway,114558000000,NE.GDI.FTOT.CN,Gross fixed capital formation (current LCU),1982,
2930516,FI,Finland,"",SP.MTR.1519.ZS,Teenage mothers (% of women ages 15-19 who have had children or are currently pregnant),2021,
2974939,GB,United Kingdom,"",NV.AGR.TOTL.CN,"Agriculture, forestry, and fishing, value added (current LCU)",1963,
2442231,NO,Norway,"",BX.GRT.TECH.CD.WD,"Technical cooperation grants (BoP, current US$)",2007,
2992866,GB,United Kingdom,"",SE.PRM.CMPT.MA.ZS,"Primary completion rate, male (% of relevant age group)",1969,
2657995,NO,Norway,"",NY.GDP.MKTP.PP.CD,"GDP, PPP (current international $)",1986,
2583890,SE,Sweden,"",IC.BRE.BL.P3,B-READY: Business Location Pillar 3: Operational Efficiency of Establishing a Business Location,1960,
2972935,GB,United Kingdom,0.804538906734353,PA.NUS.ATLS,DEC alternative conversion factor (LCU per US$),2023,
2503871,DK,Denmark,0.516019999980927,SE.PRM.UNER.FE.ZS,"Children out of school, female (% of female primary school age)",2010,
2904532,US,United States,"",SE.PRM.REPT.FE.ZS,"Repeaters, primary, female (% of female enrollment)",1980,
2533833,US,United States,0.979969372363445,TM.VAL.MRCH.R5.ZS,Merchandise imports from low- and middle-income economies in South Asia (% of total merchandise imports),1987,
2862714,US,United States,"",DC.DAC.SWEL.CD,"Net bilateral aid flows from DAC donors, Sweden (current US$)",1961,
2604097,NO,Norway,75,SH.DTH.NMRT,Number of neonatal deaths,2021,
2774259,DK,Denmark,-2560897875.45869,BN.GSR.FCTY.CD,"Net primary income (BoP, current US$)",1985,
2827784,GB,United Kingdom,"",SH.PRG.ANEM,Prevalence of anemia among pregnant women (%),1977,
2693459,FI,Finland,"",SL.TLF.CACT.FM.NE.ZS,Ratio of female to male labor force participation rate (%) (national estimate),1974,
2306691,DK,Denmark,"",IC.FRM.FEMM.ZS,Firms with female top manager (% of firms),2024,
2813128,US,United States,144510086,SP.POP.1564.TO,"Population ages 15-64, total",1977,
2371261,SE,Sweden,83.109756097561,SP.DYN.LE00.IN,"Life expectancy at birth, total (years)",2019,
2978360,GB,United Kingdom,"",ST.INT.RCPT.CD,"International tourism, receipts (current US$)",1980,
2642567,NO,Norway,66.211,SL.EMP.TOTL.SP.MA.NE.ZS,"Employment to population ratio, 15+, male (%) (national estimate)",2024,
2956879,FI,Finland,"",IC.BRE.BI.P1,B-READY: Business Insolvency Pillar 1: Quality of Regulations for Judicial Insolvency Proceedings,1962,
2950604,FI,Finland,"",SH.STA.STNT.ME.MA.ZS,"Prevalence of stunting, height for age, male (modeled estimate, % of children under 5)",1965,
2559974,SE,Sweden,51.764,SL.TLF.ACTI.1524.MA.ZS,"Labor force participation rate for ages 15-24, male (%) (modeled ILO estimate)",2007,
2389711,GB,United Kingdom,9.20219024807236,NE.IMP.GNFS.KD.ZG,Imports of goods and services (annual % growth),1996,
2955864,FI,Finland,"",NY.ADJ.DFOR.GN.ZS,Adjusted savings: net forest depletion (% of GNI),1969,
3021076,NO,Norway,"",SH.XPD.GHED.GE.ZS,Domestic general government health expenditure (% of general government expenditure),1978,
3002972,NO,Norway,"",SE.PRE.ENRR.MA,"School enrollment, preprimary, male (% gross)",2007,
2940581,FI,Finland,"",SI.RMT.COST.OB.ZS,Average transaction cost of sending remittances from a specific country (%),1978,
2360562,SE,Sweden,6588100000,TM.VAL.MRCH.WL.CD,Merchandise imports by the reporting economy (current US$),1971,
2936335,FI,Finland,"",SH.DYN.AIDS.ZS,"Prevalence of HIV, total (% of population ages 15-49)",2019,
2913968,FI,Finland,94.95765,SE.SEC.NENR,"School enrollment, secondary (% net)",2003,
2776734,FI,Finland,192864729084.211,NY.GDY.TOTL.KN,Gross domestic income (constant LCU),2000,
2341699,SE,Sweden,98488119.2390256,NY.ADJ.DPEM.CD,Adjusted savings: particulate emission damage (current US$),2007,
2897542,US,United States,1.5282701253891,RL.EST,Rule of Law: Estimate,2005,
2870226,NO,Norway,"",IQ.SPI.PIL3,Statistical performance indicators (SPI): Pillar 3 data products score (scale 0-100),1989,
2847678,NO,Norway,"",per_sa_allsa.cov_pop_tot,Coverage of social safety net programs (% of population),2000,
2898284,US,United States,"",DT.TDS.DPPG.CD,"Debt service on external debt, public and publicly guaranteed (PPG) (TDS, current US$)",1983,
2611658,GB,United Kingdom,"",DC.DAC.SWEL.CD,"Net bilateral aid flows from DAC donors, Sweden (current US$)",2003,
2772673,DK,Denmark,"",SI.POV.UMIC,Poverty headcount ratio at $8.30 a day (2021 PPP) (% of population),1962,
2990509,GB,United Kingdom,"",EN.ATM.PM25.MC.T3.ZS,"PM2.5 pollution, population exposed to levels exceeding WHO Interim Target-3 value (% of total)",1973,
2873351,US,United States,"",DT.NFL.PCBO.CD,"Commercial banks and other lending (PPG + PNG) (NFL, current US$)",1981,
2353081,FI,Finland,34551.857019353,NY.ADJ.NNTY.PC.KD,Adjusted net national income per capita (constant 2015 US$),2009,
3023377,NO,Norway,"",IS.RRS.TOTL.KM,Rail lines (total route-km),1977,
2470153,SE,Sweden,577408,IS.AIR.DPRT,"Air transport, registered carrier departures worldwide",2018,
3003717,NO,Norway,"",IC.GOV.DURS.ZS,Time spent dealing with the requirements of government regulations (% of senior management time),2019,
2894359,US,United States,13048286993860.1,NY.GDP.MKTP.PP.KD,"GDP, PPP (constant 2021 international $)",1996,
2478084,DK,Denmark,"",SM.POP.RRWA.EA,Refugees under the mandate of the UNRWA by country or territory of asylum,2017,
2437823,NO,Norway,0.0107115059495646,NY.GDP.MINR.RT.ZS,Mineral rents (% of GDP),2007,
2827502,US,United States,11.7650163691842,NV.MNF.CHEM.ZS.UN,Chemicals (% of value added in manufacturing),1999,
2714503,US,United States,"",SH.STA.ODFC.RU.ZS,"People practicing open defecation, rural (% of rural population)",1984,
2752542,FI,Finland,"",SH.DTH.NCOM.ZS,"Cause of death, by non-communicable diseases (% of total)",2003,
2806695,NO,Norway,"",IC.FRM.FO.ZS,Firms with at least 10% foreign ownership,2018,
2432922,SE,Sweden,"",LP.LPI.TRAC.XQ,Logistics performance index: Ability to track and trace consignments (1=low to 5=high),2021,
2640923,FI,Finland,"",SH.XPD.CHEX.PP.CD,"Current health expenditure per capita, PPP (current international $)",1967,
2363420,DK,Denmark,0.7,SI.POV.UMIC.GP,Poverty gap at $8.30 a day (2021 PPP) (%),1992,
2302560,SE,Sweden,47.2769377134318,TM.VAL.OTHR.ZS.WT,"Computer, communications and other services (% of commercial service imports)",2004,
2596800,DK,Denmark,64.8274357826128,SP.POP.1564.MA.ZS,"Population ages 15-64, male (% of male population)",2019,
2649928,NO,Norway,1.04804682183204,GC.TAX.INTT.RV.ZS,Taxes on international trade (% of revenue),1976,
2366785,DK,Denmark,"",IQ.CPA.PRES.XQ,CPIA equity of public resource use rating (1=low to 6=high),1991,
2335105,FI,Finland,"",TM.VAL.INSF.ZS.WT,Insurance and financial services (% of commercial service imports),1974,
2941547,FI,Finland,"",SE.PRM.NINT.ZS,Net intake rate in grade 1 (% of official school-age population),2007,
2390688,US,United States,"",SE.PRM.NINT.FE.ZS,"Net intake rate in grade 1, female (% of official school-age population)",2024,
2777016,DK,Denmark,96.51105,SE.PRM.TENR,"Adjusted net enrollment rate, primary (% of primary school age children)",2008,
2576438,GB,United Kingdom,61.0416679698,TM.QTY.MRCH.XD.WD,Import volume index (2015 = 100),2000,
2969635,GB,United Kingdom,"",IC.BRE.DR.OS,B-READY: Dispute Resolution: Overall Score,2020,
2766411,DK,Denmark,0.988600015640259,SE.ENR.PRIM.FM.ZS,"School enrollment, primary (gross), gender parity index (GPI)",2014,
2996417,GB,United Kingdom,"",IC.FRM.EXS.ZS,Firms exporting directly at least 10% of sales (% of firms),1967,
2881143,US,United States,"",SH.STA.POIS.P5.FE,"Mortality rate attributed to unintentional poisoning, female (per 100,000 female population)",1978,
2807239,US,United States,1.27459323406219,GE.EST,Government Effectiveness: Estimate,2020,
2810284,GB,United Kingdom,"",IC.FRM.ENGM.ZS,Firms adopting energy management measures to reduce emissions (% of firms),1995,
2339222,SE,Sweden,304065756556.434,NY.GDP.MKTP.PP.CD,"GDP, PPP (current international $)",2004,
2967007,GB,United Kingdom,23.5876424891453,TX.VAL.TECH.MF.ZS,High-technology exports (% of manufactured exports),2013,
2631662,GB,United Kingdom,13.452,SL.UEM.NEET.MA.ME.ZS,"Share of youth not in education, employment or training, male (% of male youth population) (modeled ILO estimate)",2023,
