hjid,id,indicator_name,source_id,source_value,source_note,source_organization,topics_indicator_element_hjid,indicator__indicators_elemen_0
1293430,SE.CLO.15Y.LDSEV.M.PS.2006.3,"Learning Deprivation Severity;PISA 2006 for grade 15Y using MPL Level 2 for math, Third Quintile",12,Education Statistics,"","",1293431,
64987,DT.AMT.DLCD.CD.CB.AR.1218.US,"Gross Ext. Debt Pmt, Deposit-Taking Corp., exc. CB, More than 12 to 18, Currency and deposits, Principal, USD",22,Quarterly External Debt Statistics SDDS,"","",64988,
1291115,PI-21.2,(ii) Cash forecasting and monitoring,68,PEFA 2016,"","",1291116,
351489,FB.INC.BNKG.AC.SC.NC,292_Is there no cost for customers to open a savings/current account as per regulation in this country?_#VGTA_06,69,Global Financial Inclusion and Consumer Protection Survey,"","",351490,
1289262,per_sa_sp.bry_q2_preT_totmr,Beneficiary incidence in 2nd quintile (%)-Social Pensions (non-contributory) (preT) -male-recipient,29,The Atlas of Social Protection: Indicators of Resilience and Equity,"","",1289263,
479962,fin11f.8,"No account because of a lack of trust in bank or similar financial institutions, richest 60% (% age 15+)",28,Global Findex database,"","",479963,
56870,adj_any_dfcl_mobile_2534,Adjusted prevalence of persons aged 25 to 34 years with any degree of mobility difficulty (% of persons aged 25 to 34 years),92,Disability Data Hub (DDH),"","",56871,
1291719,PRJ.POP.1519.S1.MA,Wittgenstein Projection: Population age 15-19 in thousands by highest level of educational attainment. Incomplete Primary. Male,12,Education Statistics,"Total population in thousands in the specified age group that has pre-primary education or incomplete primary education as the highest level of educational attainment. Projections are based on collected census and survey data for the base year (around 2010) and the Medium Shared Socioeconomic Pathways (SSP2) projection model. The SSP2 is a middle-of-the-road scenario that combines medium fertility with medium mortality, medium migration, and the Global Education Trend (GET) education scenario. For more information and other projection models, consult the Wittgenstein Centre for Demography and Global Human Capital's website: http://www.oeaw.ac.at/vid/dataexplorer/",Wittgenstein Centre for Demography and Global Human Capital: http://www.oeaw.ac.at/vid/dataexplorer/,1291720,
1294030,SE.CLO.15Y.PRF.R.PS.2012.3,"Above Proficiency;PISA 2012 for grade 15Y using MPL Level 2 for reading, Third Quintile",12,Education Statistics,"","",1294031,
68815,DT.INT.DLTS.CD.MA.AR.1218.US,"Gross Ext. Debt Pmt, Central Bank, More than 12 to 18, Special drawing rights (allocations), Interest, USD",22,Quarterly External Debt Statistics SDDS,"","",68816,
1293768,SE.CLO.15Y.LDSEV.S.PS.2015.2,"Learning Deprivation Severity;PISA 2015 for grade 15Y using MPL Level 2 for science, Second Quintile",12,Education Statistics,"","",1293769,
1297104,SE.CLO.8.PRF.S.TMS.2007.4,"Above Proficiency;TIMSS 2007 for grade 8 using MPL Low (400 points) for science, Fourth Quintile",12,Education Statistics,"","",1297105,
65345,DT.AMT.PBND.CD,"PPG, bonds (AMT, current US$)",81, International Debt Statistics: DSSI,"Public and publicly guaranteed debt from bonds that are either publicly issued or privately placed. Principal repayments are actual amounts of principal (amortization) paid by the borrower in currency, goods, or services in the year specified. Data are in current U.S. dollars.","World Bank, International Debt Statistics.",65346,
64274,DP.DOD.DLOA.CR.NF.Z1,"Gross PSD, Nonfinancial Public Corp., All maturities, Other accounts payable, Nominal Value, % of GDP",20,Quarterly Public Sector Debt,"The source of non-seasonally adjusted Gross Domestic Product (GDP) data in national currency, at current prices, is the International Finance Statistics quarterly database of the IMF, annualized by the World Bank, unless otherwise specified.","",64275,
69056,DT.INT.PUBS.CD.03.YR.US,"Ext. Debt Service Pmt, Public Sector Ext. Debt, 3yrs, All instruments, Interest, USD",23,Quarterly External Debt Statistics GDDS,"","",69057,
1261730,LO.EGRA.CLSPM.ENG.2GRD,EGRA: Correct Letter Sounds Read Per Minute (Mean). English. 2nd Grade,12,Education Statistics,"Average number of letter sounds that students could read per minute. In this EGRA subtask, assessors present students with a sheet listing between 50 and 100 upper- and lowercase letters of the alphabet (in some languages, graphemes, or sets of letters and/or symbols representing a single sound, are presented). Students are asked to provide the sounds of all the letters that they can in one minute. Users are discouraged from using these data to make direct comparisons across countries or languages. Consult the EdData website and the specific country report for more information: www.eddataglobal.org.",Early Grade Reading Assessment (EGRA): https://www.eddataglobal.org/reading/,1261731,
893182,IC.BRE.P3.OE,B-READY: Pillar 3: Operational Efficiency,2,World Development Indicators,"B-READY assesses the economy’s business environment by focusing on the regulatory framework and the provision of related public services for firms and markets, as well as the operational efficiency with which they are combined in practice. B-READY’s three pillars—the Regulatory Framework, Public Services, and Operational Efficiency. Operational Efficiency comprises both the ease of compliance with the regulatory framework and the effective use of public services directly relevant to firms.","Business Ready (B-READY) project, World Bank (WB), uri: https://www.worldbank.org/en/businessready",893183,
57353,AG.SRF.TOTL.K2,Surface area (sq. km),2,World Development Indicators,"Surface area is a country's total area, including areas under inland bodies of water and some coastal waterways.","FAO electronic files and web site, Food and Agriculture Organization of the United Nations (FAO), publisher: Food and Agriculture Organization of the United Nations (FAO)",57354,
921819,IC.FRM.OBS.OBST1,Percent of firms choosing access to finance as their biggest obstacle,13,Enterprise Surveys,Percentage of establishments that consider access to finance to be the Biggest Obstacle,"World Bank, Enterprise Surveys (http://www.enterprisesurveys.org/).",921820,
1024071,IQ.WEF.PORT.XQ,"Quality of port infrastructure, WEF (1=extremely underdeveloped to 7=well developed and efficient by international standards)",57,WDI Database Archives,"The Quality of Port Infrastructure measures business executives' perception of their country's port facilities. Data are from the World Economic Forum's Executive Opinion Survey, conducted for 30 years in collaboration with 150 partner institutes. The 2009 round included more than 13,000 respondents from 133 countries. Sampling follows a dual stratification based on company size and the sector of activity. Data are collected online or through in-person interviews. Responses are aggregated using sector-weighted averaging. The data for the latest year are combined with the data for the previous year to create a two-year moving average. Scores range from 1 (port infrastructure considered extremely underdeveloped) to 7 (port infrastructure considered efficient by international standards). Respondents in landlocked countries were asked how accessible are port facilities (1 = extremely inaccessible; 7 = extremely accessible).","World Economic Forum, Global Competiveness Report.",1024072,
56180,8.3.8_GHA.LEAR.TEST.P6.MAT.ABOV.MIN,"National assessment for learning outcomes in Ghana, P6, Mathematics, students above minimal competency (%)",34,Global Partnership for Education,"Students with results above the minimal competency in the National Education Assessment (NEA) carried out in the specific subject and grade, using multiple choice items with 4 options, as reported by the Local Education Group (LEG). Country-specific definition and method are determined by the country. % of pupils achieving 35% of results or more in the test.","Data were collected from national and other publicly available sources, and validated by the Local Education Group (LEG) in each country. LEGs are typically led by the Ministry of Education and include development partners and other education stakeholders. Data were not processed or analyzed by the Global Partnership for Education. It is reported as it was presented in the original sources, or as it was communicated to us through the Coordinating Agency or Lead Donor of the LEG.",56181,
1291369,PRJ.ATT.2064.2.MF,Wittgenstein Projection: Percentage of the population age 20-64 by highest level of educational attainment. Lower Secondary. Total,12,Education Statistics,"Share of the population of the stated age group that has completed lower secondary or incomplete upper secondary education as the highest level of educational attainment. Projections are based on collected census and survey data for the base year (around 2010) and the Medium Shared Socioeconomic Pathways (SSP2) projection model. The SSP2 is a middle-of-the-road scenario that combines medium fertility with medium mortality, medium migration, and the Global Education Trend (GET) education scenario. For more information and other projection models, consult the Wittgenstein Centre for Demography and Global Human Capital's website: http://www.oeaw.ac.at/vid/dataexplorer/",Wittgenstein Centre for Demography and Global Human Capital: http://www.oeaw.ac.at/vid/dataexplorer/,1291370,
469479,fin11c.9,"No account because of a lack of necessary documentation, rural (% age 15+)",28,Global Findex database,"","",469480,
1277391,NY.GNP.PCAP.KD.ZG,GNI per capita growth (annual %),2,World Development Indicators,Gross national income is the total income earned by all residents within an economic territory during an accounting period. It is equal to gross domestic product plus earned income receivable from abroad minus earned income payable abroad. The core indicator has been divided by the general population to achieve a per capita estimate.This indicator denotes the percentage change over each previous year of the constant price (base year 2015) series in United States dollars.,"Country official statistics, National Statistical Organizations and/or Central Banks;
National Accounts data files, Organisation for Economic Co-operation and Development (OECD);
Staff estimates, World Bank (WB)",1277392,
729281,fin40a.1,"Government transfer or pension: take out all cash at once, women (% age 15+)",28,Global Findex database,"","",729282,
1283898,per_nprog.overlap_ep_preT_tot,"Population in extreme poor (<$2.15 a day) not receiving Social Protection (%, preT)",29,The Atlas of Social Protection: Indicators of Resilience and Equity,Percentage of population not receiving Social Protection programs,ASPIRE,1283899,
1027104,IS.ROD.PAVE.ZS,"Roads, paved (% of total roads)",11,Africa Development Indicators,"Paved roads are those surfaced with crushed stone (macadam) and hydrocarbon binder or bituminized agents, with concrete, or with cobblestones, as a percentage of all the country's roads, measured in length.","International Road Federation, World Road Statistics and electronic files, except where noted.",1027105,
1298114,SE.PRM.ILDR.6,(De Facto) Percent of teachers reporting that they were provided with feedback in that discussion,12,Education Statistics,"","World Bank, Global Education Policy Dashboard",1298115,
1279949,PER.BAS.SAL.SHARE,World Bank: Share of total salary expenditures for basic education (%),12,Education Statistics,"","",1279950,
60141,C2.7pb,Threshold value for direct contract awards of works clause,82,Global Public Procurement,"","",60142,
1261817,LO.EGRA.CLSPM.KAS.2GRD,EGRA: Correct Letter Sounds Read Per Minute (Mean). Kasem. 2nd Grade,12,Education Statistics,"Average number of letter sounds that students could read per minute. In this EGRA subtask, assessors present students with a sheet listing between 50 and 100 upper- and lowercase letters of the alphabet (in some languages, graphemes, or sets of letters and/or symbols representing a single sound, are presented). Students are asked to provide the sounds of all the letters that they can in one minute. Users are discouraged from using these data to make direct comparisons across countries or languages. Consult the EdData website and the specific country report for more information: www.eddataglobal.org.",Early Grade Reading Assessment (EGRA): https://www.eddataglobal.org/reading/,1261818,
1295990,SE.CLO.6.LDGAP.R.LLC.2006.M,"Learning Deprivation Gap;LLECES 2006 for grade 6 using MPL Level 3 for reading, Male",12,Education Statistics,"","",1295991,
695413,fin34b,Received wages: through a mobile phone  (% age 15+),28,Global Findex database,"","",695414,
1070461,JI.AGE.WORK.MA,"Average age of workers, aged 15-64, male",86,Global Jobs Indicators Database (JOIN),"","",1070462,
1296768,SE.CLO.8.LDGAP.S.TMS.2019.A,Learning Deprivation Gap;TIMSS 2019 for grade 8 using MPL Low (400 points) for science,12,Education Statistics,"","",1296769,
1291045,PI-14.1,(i) Macroeconomic forecasts,68,PEFA 2016,"","",1291046,
1268712,LO.PISA.REA.P50,PISA: Distribution of Reading Scores: 50th Percentile Score,12,Education Statistics,"The 50th percentile score is the score below which 50 percent of students scored. Data reflects country performance in the stated year according to PISA reports, but may not be comparable across years or countries. Consult the PISA website for more detailed information: http://www.oecd.org/pisa/",OECD Programme for International Student Assessment (PISA),1268713,
650135,fin24fam_VD.5,"Main source of emergency funds in 30 days: family or friends, possible and very difficult, primary education or less (% age 15+)",28,Global Findex database,"","",650136,
805594,FS.XPC.TDPT.CN,Time deposits (current LCU),11,Africa Development Indicators,Time deposits.  ,International Monetary Fund.,805595,
1295352,SE.CLO.5.LDGAP.R.PRL.2016.3,"Learning Deprivation Gap;PIRLS 2016 for grade 5 using MPL Low (400 points) for reading, Third Quintile",12,Education Statistics,"","",1295353,
1291869,prot_al_alot_dfcl_1529,Persons aged 15 to 29 years in households receiving social protection (% of persons aged 15 to 29 years with disability i.e. at least a lot of functional difficulty),92,Disability Data Hub (DDH),"","",1291870,
1279084,PER.ALL.MIN.AD,World Bank: Ministry of Education employees (% administration/non-teaching),12,Education Statistics,"","",1279085,
1229018,JI.TLF.35BL.TM.LE.ZS,"Underemployment, less than 35 hours per week, aged 15-64, primary education and below (% of employed population with low education in working age)",86,Global Jobs Indicators Database (JOIN),"","",1229019,
1286101,per_sa_cc.bry_q5_urb,Beneficiary incidence in 5th quintile (richest) (%) - Conditional Cash Transfers -urban,29,The Atlas of Social Protection: Indicators of Resilience and Equity,Percentage of program beneficiaries in a quintile relative to the total number of beneficiaries in the population,ASPIRE,1286102,
1293960,SE.CLO.15Y.PRF.M.PSD.2017.M,"Above Proficiency;PISA-D 2017 for grade 15Y using  for math, Male",12,Education Statistics,"","",1293961,
984484,IN.IS.RRS.PASG.KM.SUB,"Passenger-Kilometers Traffic (Suburban), in millions",41,Country Partnership Strategy for India (FY2013 - 17),"","",984485,
1292190,ROD.PROV.ASPH.KM,"Length of Province Road: Asphalt (in km) (BPS Data, Province only)",45,Indonesia Database for Policy and Economic Research,"",BADAN PUSAT STATISTIK - Statistics Indonesia,1292191,
23708,2.0.hoi.Read.pl_3.pub,"HOI: Reading Proficiency Level 3, Public schools",37,LAC Equity Lab,"The Human Opportunities Index (HOI) is an economic indicator that captures the degree of inequality of access to an essential service by different circumstance groups. This index takes into account the average access rate (the coverage) of a given opportunity (service) and the inequality of its distribution. The circumstances included in the HOI are the gender of the child, parents' education, region of school location, father's occupation, and a household wealth index based on assets.An increase in the index can be related either to an increase in the coverage or to a more equal distribution of that service.",LAC Equity Lab tabulations using PISA Data.,23709,
1269518,LO.TIMSS.MAT4.ADV.MA,TIMSS: Male 4th grade students reaching the advanced international benchmark of mathematics achievement (%),12,Education Statistics,"TIMSS: Male 4th grade students reaching the advanced international benchmark of mathematics achievement (%) is the share of male 4th grade students scoring at least 625 on the mathematics assessment. Students at this benchmark can apply their understanding and knowledge in a variety of relatively complex situations and explain their reasoning. They can solve a variety of multi-step word problems involving whole numbers including proportions. Students at this level show an increasing understanding of fractions and decimals. Students can apply geometric knowledge of a range of two- and three-dimensional shapes in a variety of situations. They can draw a conclusion from data in a table and justify their conclusion. Data reflects country performance in the stated year according to TIMSS reports, but may not be comparable across years or countries. Consult the TIMSS website for more detailed information: http://timss.bc.edu/",International Association for the Evaluation of Educational Achievement (IEA)'s Trends in International Mathematics and Science Study,1269519,
1271323,mnfw_some_dfcl_fem,Working individuals in manufacturing (% of female persons with some degree of functional difficulty),92,Disability Data Hub (DDH),"","",1271324,
1274688,NV.IND.TOTL.KN,"Industry (including construction), value added (constant LCU)",2,World Development Indicators,"Industry (including construction) corresponds to ISIC (Rev.4) divisions 05-43. It is comprised of mining, manufacturing, construction, electricity, water, and gas industries. Value added is the contribution to the economy by a producer or an industry or an institutional sector, which is estimated by the total value of output produced and deducting the total value of intermediate consumption of goods and services used to produce that output. This indicator is expressed in constant prices, meaning the series has been adjusted to account for price changes over time. The reference year for this adjustment varies by country. This series is expressed in local currency units.","Country official statistics, National Statistical Organizations and/or Central Banks;
National Accounts data files, Organisation for Economic Co-operation and Development (OECD);
Staff estimates, World Bank (WB)",1274689,
1298214,SE.PRM.INPT.1.U,(De Facto) Average number of classroom inputs in classrooms - Urban,12,Education Statistics,"","World Bank, Global Education Policy Dashboard",1298215,
1291837,PROT.MINOR.INV.EASE.SHARE.LGL.XD.010.DB1519,Protecting minority investors: Ease of shareholder suits index (0-10) (DB15-20 methodology),1,Doing Business,"The ease of shareholder suits index measures how likely plaintiffs are to access internal corporate evidence and recover legal expenses. It has six components: (i) whether shareholders owning 10% of the company’s share capital have the right to inspect the Buyer-Seller transaction documents before filing a suit. Alternatively, whether they can request that a government inspector investigate the Buyer-Seller transaction without filing a suit; (ii) what range of documents is available to the shareholder plaintiff from the defendant and witnesses during trial; (iii) whether the plaintiff can obtain cate­gories of relevant documents from the defendant without identifying each document specifically; (iv) whether the plaintiff can directly examine the defendant and witnesses during trial; (v) whether the standard of proof for civil suits is lower than that for criminal cases; and (vi) whether shareholder plaintiffs can recover their legal expenses from the company. The index is computed based on the methodology in the DB15-20 studies.","",1291838,
854984,HF.STA.INPT.ZS.Q3,Inpatient care use in last 12 months (% of population 18+): Q3,65,Health Equity and Financial Protection Indicators,Percentage of population age 18 and older using inpatient care in the last 12 months,"Health Equity and Financial Protection Indicators (HEFPI) database, World Bank",854985,
1267796,LO.PIAAC.TEC.MA.FAIL,PIAAC: Male adults by proficiency level in problem solving in technology-rich environments (%). Failed ICT Core Test,12,Education Statistics,"Percentage of male adults who had prior computer experience but failed the ICT core test, which assesses the basic ICT skills needed to take the computer-based assessment, such as the capacity to use a mouse or scroll through a web page. Therefore, they did not take part in the computer-based assessment, but took the paper-based version of the assessment, which does not include the problem solving in technology-rich environment domain. For more information, consult the OECD PIAAC website: http://www.oecd.org/site/piaac/",OECD Programme for the International Assessment of Adult Competencies (PIAAC),1267797,
1285684,per_sa_allsa.bry_q5_totfr,Beneficiary incidence in 5th quintile(richest)(%)-All Social Assistance Programs-female-recipient,29,The Atlas of Social Protection: Indicators of Resilience and Equity,"","",1285685,
708706,fin37.38.39d.3,"Received government transfer or pension: to a card, young (% ages 15-24)",28,Global Findex database,"","",708707,
65374,DT.AMT.PCBK.PS.CD,"PS, commercial banks (AMT, current US$)",81, International Debt Statistics: DSSI,"Public sector commercial bank loans from private banks and other private financial institutions. Principal repayments are actual amounts of principal (amortization) paid by the borrower in currency, goods, or services in the year specified. Data are in current U.S. dollars.","World Bank, International Debt Statistics.",65375,
69580,DT.NTR.PBND.CD,"PPG, bonds (NTR, current US$)",81, International Debt Statistics: DSSI,Public and publicly guaranteed debt from bonds that are either publicly issued or privately placed. Net transfers are net flows minus interest payments during the year; negative transfers show net transfers made by the borrower to the creditor during the year. Data are in current U.S. dollars.,"World Bank, International Debt Statistics.",69581,
1298662,SE.PRM.PTRA,Primary school pupil-teacher ratio,57,WDI Database Archives,"","",1298663,
831412,GFDD.AI.23,Mobile phone used to pay bills (% age 15+),32,Global Financial Development,The percentage of respondents who report using a mobile phone to pay bills in the past 12 months (% age 15+). ,"Global Financial Inclusion (Global Findex) Database, World Bank",831413,
848398,HF.DYN.MORT,"Mortality rate, under-5 (per 1,000)",65,Health Equity and Financial Protection Indicators,"Deaths of children before their 5th birthday per 1,000 live births. Sample: children born up to 5 years before the survey for full population mortality estimates, and up to 10 years before the survey for wealth quintile specific mortality estimates","Health Equity and Financial Protection Indicators (HEFPI) database, World Bank",848399,
1287288,per_sa_ik.ben_q2_rur,Benefits incidence in 2nd quintile (%) - In-Kind -rural,29,The Atlas of Social Protection: Indicators of Resilience and Equity,Percentage of benefits going to the second quintile  relative to the total benefits going to the population,ASPIRE,1287289,
736239,fin43b.12,"Received payments for agricultural products: through a mobile phone, in laborforce (% age 15+)",28,Global Findex database,"","",736240,
1294006,SE.CLO.15Y.PRF.R.PS.2009.1,"Above Proficiency;PISA 2009 for grade 15Y using MPL Level 2 for reading, First Quintile",12,Education Statistics,"","",1294007,
60605,CC.ENO.EAL,Emission Totals - Emissions (N2O) - Emissions on agricultural land,87,Country Climate and Development Report (CCDR),"The FAOSTAT domain Emissions Totals summarizes the greenhouse gas (GHG) emissions generated from agriculture and forest land. They consist of methane (CH4), nitrous oxide (N2O) and carbon dioxide (CO2) emissions from crop and livestock activities, forest management and include land use and land use change processes. Data are computed at Tier 1 of the IPCC Guidelines for National greenhouse gas (GHG) Inventories (IPCC, 1996; 1997; 2000; 2002; 2006; 2014). Estimates are available by country, with global coverage for the period 1961–2019 with projections for 2030 and 2050 for some categories of emissions or 1990–2019 for others. The database is updated annually.  The FAOSTAT domain Emissions Totals disseminates information estimates of CH4, N2O and CO2 emissions/removals and their aggregates in CO2eq in units of kilotonnes (kt, or 106 kg). The latter are computed by using the IPCC Fifth Assessment report global warming potentials, AR5 (IPCC, 2014).","FAO, FAOSTAT Climate Change, Emissions Totals, http://www.fao.org/faostat/en/#data/GT.",60606,
