hjid,id,indicator_name,source_id,source_value,source_note,source_organization,topics_indicator_element_hjid,indicator__indicators_elemen_0
1292314,SABER.GRVT.GOAL5.LVL2,"SABER: (Engaging the Private Sector, Government funded) Policy Goal 5 Lever 2: Appointment and deployment of teachers",12,Education Statistics,"Data Interpretation: 1=Latent; 2=Emerging; 3=Established; 4=Advanced. For additional information, visit the SABER: (website: http://saber.worldbank.org/index.cfm","Systems Approach for Better Education Results (SABER), World Bank",1292315,
832154,GFDD.DI.03,Nonbank financial institutions’ assets to GDP (%),32,Global Financial Development,"Claims on domestic real nonfinancial sector by other financial institutions as a share of GDP, calculated using the following deflation method: {(0.5)*[Ft/P_et + Ft-1/P_et-1]}/[GDPt/P_at]  where F is other financial institutions' claims, P_e is end-of period CPI, and P_a is average annual CPI. Raw data are from the electronic version of the IMF’s International Financial Statistics. Nonbank financial institutions assets (IFS lines 42, a-d, h, and s); GDP in local currency (IFS line 99B..ZF or, if not available, line 99B.CZF); end-of period CPI (IFS line 64M..ZF or, if not available, 64Q..ZF); and average annual CPI is calculated using the monthly CPI values (IFS line 64M..ZF).","International Financial Statistics (IFS), International Monetary Fund (IMF)",832155,
68855,DT.INT.DLTT.CD.GG.AR.69.US,"Gross Ext. Debt Pmt, General Government, More than 6 to 9, Trade credit and advances, Interest, USD",22,Quarterly External Debt Statistics SDDS,"","",68856,
63313,DC.DAC.AUTL.CD,"Net bilateral aid flows from DAC donors, Austria (current US$)",2,World Development Indicators,"Net bilateral aid flows from DAC donors are the net disbursements of official development assistance (ODA) or official aid from the members of the Development Assistance Committee (DAC). Net disbursements are gross disbursements of grants and loans minus repayments of principal on earlier loans. ODA consists of loans made on concessional terms (with a grant element of at least 25 percent, calculated at a rate of discount of 10 percent) and grants made to promote economic development and welfare in countries and territories in the DAC list of ODA recipients. Official aid refers to aid flows from official donors to countries and territories in part II of the DAC list of recipients: more advanced countries of Central and Eastern Europe, the countries of the former Soviet Union, and certain advanced developing countries and territories. Official aid is provided under terms and conditions similar to those for ODA. Part II of the DAC List was abolished in 2005. The collection of data on official aid and other resource flows to Part II countries ended with 2004 data. DAC members are Australia, Austria, Belgium, Canada, Czech Republic, Denmark, Finland, France, Germany, Greece, Hungary, Iceland, Ireland, Italy, Japan, Korea, Luxembourg, The Netherlands, New Zealand, Norway, Poland, Portugal, Slovak Republic, Slovienia, Spain, Sweden, Switzerland, United Kingdom, United States, and European Union Institutions. Regional aggregates include data for economies not specified elsewhere. World and income group totals include aid not allocated by country or region. Data are in current U.S. dollars.","Development Assistance Committee, Organisation for Economic Co-operation and Development (OECD), uri: https://stats.oecd.org/;
Geographical Distribution of Financial Flows to Developing Countries, Organisation for Economic Co-operation and Development (OECD), uri: https://stats.oecd.org/;
Development Co-operation Report, Organisation for Economic Co-operation and Development (OECD), uri: https://stats.oecd.org/;
International Development Statistics database, Organisation for Economic Co-operation and Development (OECD), uri: https://stats.oecd.org/",63314,
1290045,per_si_cp.adq_q2_urb,Adequacy of benefits in 2nd quintile (%) - Contributory Pensions -urban,29,The Atlas of Social Protection: Indicators of Resilience and Equity,Total transfer amount received by all beneficiaries in a population group as a share of the total welfare of beneficiaries in that group,ASPIRE,1290046,
423929,fdis_some_dfcl_all,Persons in food insecure households (% persons with some degree of functional difficulty),92,Disability Data Hub (DDH),"","",423930,
61091,cfuel_any_dfcl_3044,Persons aged 30 to 44 years with clean cooking fuel (% of persons aged 30 to 44 years with any degree of functional difficulty),92,Disability Data Hub (DDH),"","",61092,
1270235,LO.TIMSS.SCI8.HI.MA,TIMSS: Male 8th grade students reaching the high international benchmark of science achievement (%),12,Education Statistics,"TIMSS: Male 8th grade students reaching the high international benchmark of science achievement (%) is the share of male 8th grade students scoring at least 550 on the science assessment. Students at this benchmark can apply understanding of concepts from biology, chemistry, physics, and Earth science. Students can apply knowledge of the characteristics of groups of animals, life processes in humans, cells and their functions, genetic inheritance, ecosystems, and nutrition. Students show some knowledge and understanding of the composition and properties of matter and chemical reactions. They can apply basic knowledge of energy transformation and transfer, electrical circuits, properties of magnets, light, sound, and forces. They can apply knowledge of Earth’s physical features, processes, cycles, and history, and show some understanding of Earth’s resources and their use. Data reflects country performance in the stated year according to TIMSS reports, but may not be comparable across years or countries. Consult the TIMSS website for more detailed information: http://timss.bc.edu/",International Association for the Evaluation of Educational Achievement (IEA)'s Trends in International Mathematics and Science Study,1270236,
233012,EN.ANM.THRD.NO,"Animal species, threatened",11,Africa Development Indicators,"Animal species are mammals (excluding whales and porpoises) and birds (included within a country's breeding or wintering ranges). Threatened species are the number of species classified by the IUCN as endangered, vulnerable, rare, indeterminate, out of danger, or insufficiently known.","United Nations Environmental Program and the World Conservation Monitoring Centre, and International Union for Conservation of Nature, Red List of Threatened Species.",233013,
1298625,SE.PRM.PMAN.3.U,(De Facto) Average score for the extent to which principals master goal-setting in the long term - Urban,12,Education Statistics,"","World Bank, Global Education Policy Dashboard",1298626,
865026,HH.DHS.OOST.L.F,DHS: Typology of out-of-school children. Primary. Late entry. Female,12,Education Statistics,"Typology of out-of-school children. Primary. Late entry. Female is defined as the proportion of female out-of-school children who are currently out of school but are expected to enter the education system later than they should. It is calculated based on UNESCO's methodology as the proportion leftover from those estimated as never in school, expressed as a percent of the proportion out-of-school for children younger than the age with the highest attendance rate.",Demographic and Health Surveys (DHS),865027,
620314,fin22h.7,"Paid off all credit card balances in full by their due date, poorest 40% (% age 15+)",28,Global Findex database,"","",620315,
60069,C1.8,Gross national income per capita,82,Global Public Procurement,"","",60070,
1296020,SE.CLO.6.LDGAP.R.PRL.2011.3,"Learning Deprivation Gap;PIRLS 2011 for grade 6 using MPL Low (400 points) for reading, Third Quintile",12,Education Statistics,"","",1296021,
67410,DT.DOD.DSTM.CD.MA.AR.BE.US,"Gross Ext. Debt Pos., Central Bank, Short-term, Debt securities, Beginning of period, USD",22,Quarterly External Debt Statistics SDDS,"","",67411,
1285827,per_sa_cc.adq_q1_rur,Adequacy of benefits in 1st quintile (poorest) (%) - Conditional Cash Transfers -rural,29,The Atlas of Social Protection: Indicators of Resilience and Equity,Total transfer amount received by all beneficiaries in a population group as a share of the total welfare of beneficiaries in that group,ASPIRE,1285828,
414429,fdis_al_alot_dfcl_all,Persons in food insecure households (% persons with disability i.e. at least a lot of functional difficulty),92,Disability Data Hub (DDH),"","",414430,
1263307,LO.EGRA.NCWPM.GON.2GRD,EGRA: Correct Non-Words Read Per Minute (Mean). Gonja. 2nd Grade,12,Education Statistics,Average total number of invented/nonsense words correctly read per minute. The indicator measures students' ability to fluently decipher/decode randomly-presented “words” that follow linguistic rules but do not actually exist in the stated language. Skill in reading nonwords can be a purer measure of decoding than using real words because children cannot recognize the words by sight. Decoding is considered a self-teaching skill that enables children to read new and unfamiliar words independently. Users are discouraged from using these data to make direct comparisons across countries or languages. Consult the EdData website and the specific country report for more information: www.eddataglobal.org.,Early Grade Reading Assessment (EGRA): https://www.eddataglobal.org/reading/,1263308,
1291997,PRT.PDCL.IND8.ALLD.ZS,PDI-8 Bilateral aid that is untied (percent),11,Africa Development Indicators,Tied aid is aid provided on the condition that the recipient uses it to purchase goods and services from suppliers based in the donor country. The target for this indicator is to increase untied aid over time.  ,Organization for Economic Co-operation and Development (www.oecd.org/dac/effectiveness/monitoring).,1291998,
891044,hxpd_some_dfcl_urb,Household health expenditures (% of persons living in urban areas with some degree of functional difficulty),92,Disability Data Hub (DDH),"","",891045,
317765,FB.FCP.DISR.AS.CI,627_Does the alternative dispute resolution (ADR) entity require that consumers first submit their complaints to the relevant financial institution?_#VHME_00,69,Global Financial Inclusion and Consumer Protection Survey,"","",317766,
1281672,PER.SR.PPC,"World Bank: Pupils/Class, senior secondary",12,Education Statistics,"","",1281673,
678434,fin31a.2,"Made a utility payment: using a bank or similar financial institution account, men (% age 15+)",14,Gender Statistics,"The percentage of respondents who report personally making regular payments for water, electricity, or trash collection in the past year directly from a bank or similar financial institution account, men (% age 15+)",Global Findex Database,678435,
1293246,SE.CLO.15Y.LDGAP.R.PSD.2017.1,"Learning Deprivation Gap;PISA-D 2017 for grade 15Y using  for reading, First Quintile",12,Education Statistics,"","",1293247,
1280884,PER.PP.PS.PRM,"World Bank: Ratio of expenditures per student, pre-primary to primary",12,Education Statistics,"","",1280885,
1269812,LO.TIMSS.MAT8.LOW,TIMSS: Eighth grade students reaching the low international benchmark of mathematics achievement (%),12,Education Statistics,"TIMSS: Eighth grade students reaching the low international benchmark of mathematics achievement (%) is the share of 8th grade students scoring at least 400 on the mathematics assessment. Students at this benchmark have some knowledge of whole numbers and basic graphs. Data reflect country performance in the stated year according to TIMSS reports, but may not be comparable across years or countries. Consult the TIMSS website for more detailed information: http://timss.bc.edu/",International Association for the Evaluation of Educational Achievement (IEA)'s Trends in International Mathematics and Science Study,1269813,
1294772,SE.CLO.4.LDSEV.M.TMS.2015.3,"Learning Deprivation Severity;TIMSS 2015 for grade 4 using MPL Low (400 points) for math, Third Quintile",12,Education Statistics,"","",1294773,
1284287,per_pr_allpr_p0_urb,Poverty Headcount reduction (%) -  All Private Transfers - 1st quintile (poorest) -urban,29,The Atlas of Social Protection: Indicators of Resilience and Equity,Poverty headcount reduction due to Private Transfers programs as % of pre-transfer poverty headcount,ASPIRE,1284288,
186656,eatn_al_alot_dfcl_3044,Persons aged 30 to 44 years who have ever attended school (% of persons aged 30 to 44 years with disability i.e. at least a lot of functional difficulty),92,Disability Data Hub (DDH),"","",186657,
521895,fin13e.1,"Asked for mobile money PIN or password, women (% age 15+)",28,Global Findex database,"","",521896,
1292088,RESLV.ISV.COPR.03.XD.DB1519,Resolving insolvency: Commencement of proceedings index (0-3) (DB15-20 methodology),1,Doing Business,The commencement of proceedings index has three components: (i) whether debtors can initiate both liquidation and reorganization proceedings; (ii) whether creditors can initiate both liquidation and reorganization proceedings; and (iii) what standard is used for commence­ment of insolvency proceedings.,"",1292089,
669987,fin25e4a.1,"Reason for cash payment for in-store purchases : merchant only accepts cash , women (% age 15+)",28,Global Findex database,"","",669988,
699945,fin34d.4,"Received wages: to a card, older (% age 25+)",28,Global Findex database,"","",699946,
1293446,SE.CLO.15Y.LDSEV.M.PS.2009.1,"Learning Deprivation Severity;PISA 2009 for grade 15Y using MPL Level 2 for math, First Quintile",12,Education Statistics,"","",1293447,
1262804,LO.EGRA.LSTN.0.ENG.3GRD,EGRA: Listening Comprehension - Share of students with a zero score (%). English. 3rd Grade,12,Education Statistics,"Share of students scoring zero percent on the listening comprehension assessment. The listening comprehension subtask examines students' ability to respond correctly to questions about a brief passage read aloud to the student by the assessor in order to understand students’ ability to comprehend orally without having to overcome issues of decoding. Part of comprehension is understanding the meanings of the words, thus if students do not have enough vocabulary in the language, they will not be able to comprehend. Consult the EdData website and the specific country report for more information: www.eddataglobal.org.",Early Grade Reading Assessment (EGRA): https://www.eddataglobal.org/reading/,1262805,
1292821,saso_al_alot_dfcl_4564,Assets owned by individual's household (% of persons aged 45 to 64 years with disability i.e. at least a lot of functional difficulty),92,Disability Data Hub (DDH),"","",1292822,
1282782,per_lm_ac.bry_q1_totfr,Beneficiary incidence in 1st quintile (poorest) (%)-Active Labor Market Programs -female-recipient,29,The Atlas of Social Protection: Indicators of Resilience and Equity,"","",1282783,
885275,htin_nosome_dfcl_fem,Female persons with health insurance (% of female persons with none or some degree of functional difficulty),92,Disability Data Hub (DDH),"","",885276,
62174,con28m.2,"Buys data package monthly, men (% age 15+)",14,Gender Statistics,"The percentage of respondents who report that they buy a monthly data package to use the internet, men (% age 15+)",Global Findex Database,62175,
129992,DT.TDS.DLCD.CD.OT.AR.1824.US,"Gross Ext. Debt Pmt, Other Sectors, More than 18 to 24, Currency and deposits, Prin. and Int., USD",22,Quarterly External Debt Statistics SDDS,"","",129993,
1290932,per_sionl.overlap_pop_rur,Population only receiving All Social Insurance (%) -rural,29,The Atlas of Social Protection: Indicators of Resilience and Equity,Percentage of population only receiving All Social Insurance programs (includes direct and indirect beneficiaries),ASPIRE,1290933,
544434,fin14c.7,"Reason for not having a mobile money account: don't have the necessary documentation, poorest 40% (% age 15+)",28,Global Findex database,"","",544435,
63278,DAK.ENVR.CR,Total Specific Allocation Grant for Environment (in IDR Billion),45,Indonesia Database for Policy and Economic Research,"The Specific Allocation Grant (DAK) is a fund sourced from revenue in the Central Budget (APBN) allocated to a certain region with the aim of funding special activities of the region in accordance with national priorities. The DAK allocation has a formula component that takes into account the fiscal gap and has a 10 percent matching requirement. The DAK is earmarked for capital spending and cannot be used for research, training, administration, or official travel.","Ministry of Finance, Ministry of Finance Regulation",63279,
105943,DT.TDS.DECT.CD.RM.US,"Gross Ext. Debt Pos., All Sectors, One year or less, All instruments, Prin. and Int., USD",22,Quarterly External Debt Statistics SDDS,"","",105944,
1294794,SE.CLO.4.LDSEV.M.TMS.2019.4,"Learning Deprivation Severity;TIMSS 2019 for grade 4 using MPL Low (400 points) for math, Fourth Quintile",12,Education Statistics,"","",1294795,
1292116,REV.DAK.CR,Total Special Allocation Grant/DAK (in IDR),45,Indonesia Database for Policy and Economic Research,"The Specific Allocation Grant (DAK) is a fund sourced from revenue in the Central Budget (APBN) allocated to a certain region with the aim of funding special activities of the region in accordance with national priorities. The DAK allocation has a formula component that takes into account the fiscal gap and has a 10 percent matching requirement. The DAK is earmarked for capital spending and cannot be used for research, training, administration, or official travel.","Ministry of Finance, SIKD (Information System for Sub-National Budget) and LKPP (Central Government Financial Report)",1292117,
1289237,per_sa_sp.bry_q1_preT_tot,Beneficiary incidence in 1st quintile (poorest) (%) - Social Pensions (preT),29,The Atlas of Social Protection: Indicators of Resilience and Equity,Percentage of program beneficiaries in a quintile relative to the total number of beneficiaries in the population,ASPIRE,1289238,
1295162,SE.CLO.4.PRF.S.TMS.2011.M,"Above Proficiency;TIMSS 2011 for grade 4 using MPL Low (400 points) for science, Male",12,Education Statistics,"","",1295163,
1061336,JI.AGE.MPYR.RU,"Average age of employers, aged 15-64, rural",86,Global Jobs Indicators Database (JOIN),"","",1061337,
1274342,NV.AGR.TOTL.KD.87,"Agriculture, value added (constant 1987 US$)",57,WDI Database Archives,"","",1274343,
1296864,SE.CLO.8.LDSEV.M.TMS.2019.4,"Learning Deprivation Severity;TIMSS 2019 for grade 8 using MPL Low (400 points) for math, Fourth Quintile",12,Education Statistics,"","",1296865,
65899,DT.DOD.DECT.CD.CB.AR.US,"Gross Ext. Debt Pos., Deposit-Taking Corp., exc. CB, All maturities, All instruments, USD",22,Quarterly External Debt Statistics SDDS,"","",65900,
732002,fin42,"Received payments for the sale of agricultural products, livestock, or crops  (% age 15+)",14,Gender Statistics,"The percentage of respondents who report personally receiving payments from any source for the sale of agricultural products, crops, produce, or livestock in the past year, (% age 15+)",Global Findex Database,732003,
1298306,SE.PRM.LCAP.4,(De Facto) Average executive funcion score for 1st Graders,12,Education Statistics,"","World Bank, Global Education Policy Dashboard",1298307,
67715,DT.DOD.PCPR.US,"Publicly Guar. Private Sector Ext. Debt Pos., Paris Club member creditors, All maturities, All instruments, USD",23,Quarterly External Debt Statistics GDDS,"","",67716,
61508,con11.3,"SIM number registered in own name, young (% ages 15-24)",28,Global Findex database,"","",61509,
58743,BAR.TER.CMPT.5559.FE.ZS,Barro-Lee: Percentage of female population age 55-59 with tertiary schooling. Completed Tertiary,12,Education Statistics,Percentage of female population age 55-59 with tertiary schooling. Completed Tertiary,Robert J. Barro and Jong-Wha Lee: http://www.barrolee.com/,58744,
58612,BAR.SEC.SCHL.5054.FE,"Barro-Lee: Average years of secondary schooling, age 50-54, female",12,Education Statistics,"Average years of secondary schooling, 50-54, female is the average years of secondary education completed among females age 50-54.",Robert J. Barro and Jong-Wha Lee: http://www.barrolee.com/,58613,
1280968,PER.PRM.EFF.TCHRSUPPLY,World Bank: Cost Burden of Teacher Oversupply (% of total education expenditures),12,Education Statistics,"","",1280969,
1237827,JI.TLF.TOTL.HE,"Total labor force in the sample, aged 15-64, above primary education",86,Global Jobs Indicators Database (JOIN),"","",1237828,
56566,ad_hsng_any_dfcl_mobile_all,Persons with adequate housing (% of persons with any degree of mobility difficulty),92,Disability Data Hub (DDH),"","",56567,
61224,cmpu_any_dfcl_cogn_all,Persons using a computer (% of persons with  any degree of cognitive difficulty),92,Disability Data Hub (DDH),"","",61225,
62994,con5a.5,"Phone used was a smartphone, primary education or less (% age 15+)",28,Global Findex database,"","",62995,
61698,con16.12,"Can send a text message on a mobile phone, in laborforce (% age 15+)",28,Global Findex database,"","",61699,
61374,CoHD_lns_PPP,"Cost of legumes, nuts and seeds in PPP dollars",93,FPN Datahub Archive,"","",61375,
1297218,SE.CLO.9.LDGAP.M.TMS.2015.1,"Learning Deprivation Gap;TIMSS 2015 for grade 9 using MPL Low (400 points) for math, First Quintile",12,Education Statistics,"","",1297219,
62050,con26m.s,"Monthly internet use (% internet users, age 15+)",28,Global Findex database,"","",62051,
1296462,SE.CLO.6.PRF.R.PRL.2011.3,"Above Proficiency;PIRLS 2011 for grade 6 using MPL Low (400 points) for reading, Third Quintile",12,Education Statistics,"","",1296463,
60483,CC.ECH.AFO,Emission Totals - Emissions (CH4) - AFOLU,87,Country Climate and Development Report (CCDR),"The FAOSTAT domain Emissions Totals summarizes the greenhouse gas (GHG) emissions generated from agriculture and forest land. They consist of methane (CH4), nitrous oxide (N2O) and carbon dioxide (CO2) emissions from crop and livestock activities, forest management and include land use and land use change processes. Data are computed at Tier 1 of the IPCC Guidelines for National greenhouse gas (GHG) Inventories (IPCC, 1996; 1997; 2000; 2002; 2006; 2014). Estimates are available by country, with global coverage for the period 1961–2019 with projections for 2030 and 2050 for some categories of emissions or 1990–2019 for others. The database is updated annually.  The FAOSTAT domain Emissions Totals disseminates information estimates of CH4, N2O and CO2 emissions/removals and their aggregates in CO2eq in units of kilotonnes (kt, or 106 kg). The latter are computed by using the IPCC Fifth Assessment report global warming potentials, AR5 (IPCC, 2014).","FAO, FAOSTAT Climate Change, Emissions Totals, http://www.fao.org/faostat/en/#data/GT.",60484,
699951,fin34d.7,"Received wages: to a card, poorest 40% (% age 15+)",28,Global Findex database,"","",699952,
1273155,NE.GDI.IMPT.CR,GDP expenditure on imports (in IDR Million),45,Indonesia Database for Policy and Economic Research,Import is a trade of goods and services required by citizens of a country from citizens of other country in exchange for foreign currency. Import creates outflux of foreign currency.,BADAN PUSAT STATISTIK - Statistics Indonesia,1273156,
60732,CC.GAS.PPBC.CO,Gas pipeline capacity by project status (barrels of oil equivalent per day) - Construction,87,Country Climate and Development Report (CCDR),"Gas pipeline capacity (barrels of oil equivalent per day), by capacity, is generated from the Global Fossil Infrastructure Tracker (GFIT). The GFIT is an information resource on fossil fuel infrastructure projects and their development. Currently, the GFIT includes all global LNG import terminals and export terminals, and all global oil and gas transmission pipelines over a pre-determined size threshold. The Tracker organizes information in both map and table format. The interactive map format allows users to geographically visualize pipeline routes and terminal locations, while the table format allows users to access additional data points on each project. Both the map and table provide menu-based data filtering options as well as links to further information in project-specific wiki pages housed on GEM.wiki. GFIT was accessed in July 2021 to generate this data.","Global Fossil Infrastructure Tracker, Global Energy Monitor. Available at: https://globalenergymonitor.org/projects/global-fossil-infrastructure-tracker/",60733,
909712,IC.FRM.CRIM.ZS,Losses due to theft and vandalism (% of annual sales for affected firms),57,WDI Database Archives,"Average losses as a result of theft, robbery, vandalism or arson that occurred on the establishment’s premises calculated as a percentage of annual sales. The value represents the average losses for all firms which reported losses (please see indicator IC.FRM.THEV.ZS).","Enterprise Surveys, World Bank (WB), uri: http://www.enterprisesurveys.org/",909713,
