hjid,id,indicator_name,source_id,source_value,source_note,source_organization,topics_indicator_element_hjid,indicator__indicators_elemen_0
58800,BAR.TER.ICMP.3034.ZS,Barro-Lee: Percentage of population age 30-34 with tertiary schooling. Total (Incomplete and Completed Tertiary),12,Education Statistics,Percentage of population age 30-34 with tertiary schooling. Total (Incomplete and Completed Tertiary),Robert J. Barro and Jong-Wha Lee: http://www.barrolee.com/,58801,
66625,DT.DOD.DLTS.CD.GG.PX.US,"Gross Ext. Debt Pos., General Government, Long-term, Special drawing rights (allocations), Other price chg, USD",22,Quarterly External Debt Statistics SDDS,"","",66626,
1288979,per_sa_sp.adq_q1_urb,Adequacy of benefits in 1st quintile (poorest) (%) - Social Pensions -urban,29,The Atlas of Social Protection: Indicators of Resilience and Equity,Total transfer amount received by all beneficiaries in a population group as a share of the total welfare of beneficiaries in that group,ASPIRE,1288980,
1264564,LO.EGRA.READ.GA.ADV.2GRD,EGRA: Reading Comprehension - Share of students scoring at least 80 percent (%). Ga. 2nd Grade,12,Education Statistics,Share of students who scored 80 percent or higher on the reading comprehension assessment. The reading comprehension subtask follows the oral reading fluency subtask; students are required to respond to literal and inferential questions about the oral reading fluency subtask text they have just read. The questions are read aloud to the student by the assessor. Users are discouraged from using these data to make direct comparisons across countries or languages. Consult the EdData website and the specific country report for more information: www.eddataglobal.org.,Early Grade Reading Assessment (EGRA): https://www.eddataglobal.org/reading/,1264565,
900865,IC.DCP.BQC.XD.015.DB1619,Dealing with construction permits: Building quality control index (0-15) (DB16-20 methodology),1,Doing Business,"The building quality control index is the sum of the following six indices: quality of building regulations, quality control before construction, quality control during construction, quality control after construction, liability and insurance regimes and professional certifications. The component indicator is computed based on the methodology in the DB16-20 studies.","",900866,
1291745,PRJ.POP.2024.4.MF,Wittgenstein Projection: Population age 20-24 in thousands by highest level of educational attainment. Post Secondary. Total,12,Education Statistics,"Total population in thousands in the specified age group that has completed post-secondary or tertiary education as the highest level of educational attainment. Projections are based on collected census and survey data for the base year (around 2010) and the Medium Shared Socioeconomic Pathways (SSP2) projection model. The SSP2 is a middle-of-the-road scenario that combines medium fertility with medium mortality, medium migration, and the Global Education Trend (GET) education scenario. For more information and other projection models, consult the Wittgenstein Centre for Demography and Global Human Capital's website: http://www.oeaw.ac.at/vid/dataexplorer/",Wittgenstein Centre for Demography and Global Human Capital: http://www.oeaw.ac.at/vid/dataexplorer/,1291746,
1273766,netu_any_dfcl_cogn_all,Persons using the Internet (% of persons with any degree of cognitive difficulty),92,Disability Data Hub (DDH),"","",1273767,
69453,DT.NFL.UNWT.CD,"Net official flows from UN agencies, UNWTO (current US$)",2,World Development Indicators,"Net official flows from UN agencies are the net disbursements of total official flows from the UN agencies. Total official flows are the sum of Official Development Assistance (ODA) or official aid and Other Official Flows (OOF) and represent the total disbursements by the official sector at large to the recipient country. Net disbursements are gross disbursements of grants and loans minus repayments of principal on earlier loans. ODA consists of loans made on concessional terms (with a grant element of at least 25 percent, calculated at a rate of discount of 10 percent) and grants made to promote economic development and welfare in countries and territories in the DAC list of ODA recipients. Official aid refers to aid flows from official donors to countries and territories in part II of the DAC list of recipients: more advanced countries of Central and Eastern Europe, the countries of the former Soviet Union, and certain advanced developing countries and territories. Official aid is provided under terms and conditions similar to those for ODA. Part II of the DAC List was abolished in 2005. The collection of data on official aid and other resource flows to Part II countries ended with 2004 data. OOF are transactions by the official sector whose main objective is other than development-motivated, or, if development-motivated, whose grant element is below the 25 per cent threshold which would make them eligible to be recorded as ODA. The main classes of transactions included here are official export credits, official sector equity and portfolio investment, and debt reorganization undertaken by the official sector at nonconcessional terms (irrespective of the nature or the identity of the original creditor). UN agencies are United Nations includes the United Nations Children’s Fund (UNICEF), United Nations Relief and Works Agency for Palestine Refugees in the Near East (UNRWA), World Food Programme (WFP), International Fund for Agricultural Development (IFAD), United Nations Development Programme(UNDP), United Nations Population Fund (UNFPA), United Nations Refugee Agency (UNHCR), Joint United Nations Programme on HIV/AIDS (UNAIDS), United Nations Regular Programme for Technical Assistance (UNTA), United Nations Peacebuilding Fund (UNPBF), International Atomic Energy Agency (IAEA), World Health Organization (WHO), United Nations Economic Commission for Europe (UNECE), Food and Agriculture Organization of the United Nations (FAO), International Labour Organization (ILO), United Nations Environment Programme (UNEP), World Tourism Organization (UNWTO) and United Nations Institute for Disarmament Research (UNIDIR). Data are in current U.S. dollars.","Development Assistance Committee, Organisation for Economic Co-operation and Development (OECD), uri: https://stats.oecd.org/;
Geographical Distribution of Financial Flows to Developing Countries, Organisation for Economic Co-operation and Development (OECD), uri: https://stats.oecd.org/;
Development Co-operation Report, Organisation for Economic Co-operation and Development (OECD), uri: https://stats.oecd.org/;
International Development Statistics database, Organisation for Economic Co-operation and Development (OECD), uri: https://stats.oecd.org/",69454,
58079,BAR.PRM.CMPT.6569.FE.ZS,Barro-Lee: Percentage of female population age 65-69 with primary schooling. Completed Primary,12,Education Statistics,Percentage of female population age 65-69 with primary schooling. Completed Primary,Robert J. Barro and Jong-Wha Lee: http://www.barrolee.com/,58080,
67669,DT.DOD.OLLT.CD.PU.AR.US,"Gross Ext. Debt Pos., Public Sector Ext. Debt, Long-term, Other debt liabilities, USD",22,Quarterly External Debt Statistics SDDS,"","",67670,
1294946,SE.CLO.4.LDSEV.S.TMS.2015.U,"Learning Deprivation Severity;TIMSS 2015 for grade 4 using MPL Low (400 points) for science, Urban",12,Education Statistics,"","",1294947,
431676,fh1.fh2.3,"Sent or received domestic remittances, young (% ages 15-24)",28,Global Findex database,"","",431677,
58390,BAR.SEC.CMPT.1519.ZS,Barro-Lee: Percentage of population age 15-19 with secondary schooling. Completed Secondary,12,Education Statistics,Percentage of population age 15-19 with secondary schooling. Completed Secondary,Robert J. Barro and Jong-Wha Lee: http://www.barrolee.com/,58391,
1285442,per_sa_allsa.avt_q2_totmr,Average per capita transfer held by 2nd quintile - All Social Assistance Programs -male-recipient,29,The Atlas of Social Protection: Indicators of Resilience and Equity,"","",1285443,
55245,5.1.7_ETH.TOTA.AID.GIZ,"International aid disbursed to total education, GIZ/BMZ to Ethiopia (USD million) ",34,Global Partnership for Education,"International concessional aid disbursed by the reporting development partner to the total education sector in the specific developing country. Targets indicate scheduled or projected aid. Accounted aid includes activities, projects, technical cooperation and sector and budget support (20%), as it was reported by the donor to the Global Partnership for Education.","The 2011 Monitoring Exercise on Aid Effectiveness in the Education Sector was produced by the Global Partnership for Education in parallel to the OECD’s 2011 Survey on Monitoring the Paris Declaration. Through this exercise participating donors reported on the international aid allocated and projected to specific developing countries. Data were later validated and/or updated when preparing the GPE Results Report in 2012. Most of the figures were reported in 2011 and in USD. When it was not the case, currencies were converted to USD. Data are relative to a calendar year, unless it is specified otherwise in the country notes. For further details in this 2012 Monitoring Exercise, please refer to the following web site: http://www.globalpartnership.org/our-work/areas-of-focus/aid-effectiveness/2011-monitoring-exercise-on-aid-effectiveness-2/",55246,
58089,BAR.PRM.CMPT.75UP.ZS,Barro-Lee: Percentage of population age 75+ with primary schooling. Completed Primary,12,Education Statistics,Percentage of population age 75+ with primary schooling. Completed Primary,Robert J. Barro and Jong-Wha Lee: http://www.barrolee.com/,58090,
1288446,per_sa_pw_p1_urb,Poverty Gap reduction (%) -  Public Works - 1st quintile (poorest) -urban,29,The Atlas of Social Protection: Indicators of Resilience and Equity,Poverty gap reduction due to Public Works programs as % of pre-transfer poverty gap,ASPIRE,1288447,
1289270,per_sa_sp.bry_q2_totfr,Beneficiary incidence in 2nd quintile (%) - Social Pensions (non-contributory) -female-recipient,29,The Atlas of Social Protection: Indicators of Resilience and Equity,"","",1289271,
1295994,SE.CLO.6.LDGAP.R.LLC.2006.U,"Learning Deprivation Gap;LLECES 2006 for grade 6 using MPL Level 3 for reading, Urban",12,Education Statistics,"","",1295995,
56944,adj_some_dfcl_4554,Adjusted prevalence of persons aged 45 to 54 years with some degree of functional difficulty (% of persons aged 45 to 54 years),92,Disability Data Hub (DDH),"","",56945,
1299332,SE.TER.ENRR.FE,"School enrollment, tertiary, female (% gross)",2,World Development Indicators,"Gross enrollment ratio is the ratio of total enrollment, regardless of age, to the population of the age group that officially corresponds to the level of education shown. Tertiary education, whether or not to an advanced research qualification, normally requires, as a minimum condition of admission, the successful completion of education at the secondary level.","Data API, UN Educational, Scientific and Cultural Organization (UNESCO), uri: https://databrowser.uis.unesco.org/resources, note: The data are obtained through the UIS API.  Detailed documentation is available at: https://api.uis.unesco.org/api/public/documentation/, publisher: UNESCO Institute for Statistics (UIS), type: Bulk file (csv), date accessed: 2025-09-22, date published: 2025-09",1299333,
644436,fin24c.6,"Experienced a natural disaster or severe weather event, secondary education or more (% age 15+)",28,Global Findex database,"","",644437,
943124,IC.WEF.LLCD.FE,Number of female directors,14,Gender Statistics,Number of female directors is the number of female individuals who conduct the affairs of newly registered limited liability companies in the calendar year.,"World Bank's Entrepreneurship Survey and database (https://www.worldbank.org/en/programs/entrepreneurship). Downloaded on November 29, 2023.",943125,
65303,DT.AMT.MLAT.PRVG.CD,"PRVG, multilateral (AMT, current US$)",81, International Debt Statistics: DSSI,"Private sector guaranteed by Public Sector  include loans and credits from the World Bank, regional development banks, and other multilateral and intergovernmental agencies. Excluded are loans from funds administered by an international organization on behalf of a single donor government; these are classified as loans from governments. Principal repayments are actual amounts of principal (amortization) paid by the borrower in currency, goods, or services in the year specified. Data are in current U.S. dollars.","World Bank, International Debt Statistics.",65304,
1283563,per_lm_pa.avt_pop_totmr,Average per capita transfer - Passive Labor Market Programs -male-recipient of programs,29,The Atlas of Social Protection: Indicators of Resilience and Equity,"","",1283564,
1109832,JI.EMP.FABU.UR.ZS,"Employment in the financial and business services sector, aged 15-64, urban (% of urban employed population in working age)",86,Global Jobs Indicators Database (JOIN),"","",1109833,
1299281,SE.TER.CUAT.DO.FE.ZS,"Educational attainment, Doctoral or equivalent, population 25+, female (%) (cumulative)",2,World Development Indicators,The percentage of population ages 25 and over that attained or completed Doctoral or equivalent.,"Data API, UN Educational, Scientific and Cultural Organization (UNESCO), uri: https://databrowser.uis.unesco.org/resources, note: The data are obtained through the UIS API.  Detailed documentation is available at: https://api.uis.unesco.org/api/public/documentation/, publisher: UNESCO Institute for Statistics (UIS), type: Bulk file (csv), date accessed: 2025-09-22, date published: 2025-09",1299282,
1298086,SE.PRM.ILDR.3.F,(De Facto) Percent of teachers reporting that the classroom observation happened recently - Female,12,Education Statistics,"","World Bank, Global Education Policy Dashboard",1298087,
1288343,per_sa_pw.cov_pop_rur,Coverage (%) - Public Works -rural,29,The Atlas of Social Protection: Indicators of Resilience and Equity,Percentage of population participating in Public Works programs (includes direct and indirect beneficiaries),ASPIRE,1288344,
1279782,PER.BAS.PPC,"World Bank: Pupils/Class, basic education",12,Education Statistics,"","",1279783,
1283777,per_lm_pa.bry_q5_rur,Beneficiary incidence in 5th quintile (richest) (%) - Passive Labor Market -rural,29,The Atlas of Social Protection: Indicators of Resilience and Equity,Percentage of program beneficiaries in a quintile relative to the total number of beneficiaries in the population,ASPIRE,1283778,
1201474,JI.POP.2564.UR.ZS,"Population aged 25-64, urban (% of urban population)",86,Global Jobs Indicators Database (JOIN),"","",1201475,
1297920,SE.PRM.CMPL.FE.ZS,"Gross graduation ratio, primary, female (%)",14,Gender Statistics,Primary completion rate is the percentage of students completing the last year of primary school. The rate based on completers is calculated by taking the total number of completers in the last grade of primary school divided by the total number of children of official graduation age.,UNESCO Institute for Statistics (http://uis.unesco.org/),1297921,
883252,htin_any_dfcl_all,Persons with health insurance (% of persons with any degree of functional difficulty),92,Disability Data Hub (DDH),"","",883253,
1290121,per_si_cp.avt_q3_preT_tot,Average per capita transfer held by 3rd quintile - Contributory Pensions (preT),29,The Atlas of Social Protection: Indicators of Resilience and Equity,"Average transfer amount of  Contributory Pensions programs among program beneficiaries (per capita, daily $ppp)",ASPIRE,1290122,
1293222,SE.CLO.15Y.LDGAP.R.PS.2015.R,"Learning Deprivation Gap;PISA 2015 for grade 15Y using MPL Level 2 for reading, Rural",12,Education Statistics,"","",1293223,
1262653,LO.EGRA.LSTN.0.AMH.2GRD,EGRA: Listening Comprehension - Share of students with a zero score (%). Amharic. 2nd Grade,12,Education Statistics,"Share of students scoring zero percent on the listening comprehension assessment. The listening comprehension subtask examines students' ability to respond correctly to questions about a brief passage read aloud to the student by the assessor in order to understand students’ ability to comprehend orally without having to overcome issues of decoding. Part of comprehension is understanding the meanings of the words, thus if students do not have enough vocabulary in the language, they will not be able to comprehend. Consult the EdData website and the specific country report for more information: www.eddataglobal.org.",Early Grade Reading Assessment (EGRA): https://www.eddataglobal.org/reading/,1262654,
825579,GC.REV.GOTR.CN,Grants and other revenue (current LCU),2,World Development Indicators,"Grants are transfers receivable by government units, from other resident or nonresident government units or international organizations, that do not meet the defi nition of a tax, subsidy, or social contribution. Other revenue is all revenue receivable excluding taxes, social contributions, and grants. This category of revenue includes property income, sales of goods and services, and miscellaneous other types of revenue. This indicator is expressed in current prices, meaning no adjustment has been made to account for price changes over time. This series is expressed in local currency units.","Government Finance Statistics Yearbook and data files, International Monetary Fund (IMF)",825580,
1296480,SE.CLO.6.PRF.R.PSC.2014.2,"Above Proficiency;PASEC 2014 for grade 6 using MPL 4 for reading, Second Quintile",12,Education Statistics,"","",1296481,
1220933,JI.SRV.WAGE.HE.ZS,"Wage employment in services, aged 15-64, above primary education (% of workers with high education in the service sector)",86,Global Jobs Indicators Database (JOIN),"","",1220934,
1277526,NY.GNS.ICTR.ZS,Gross savings (% of GDP),2,World Development Indicators,"Savings is an amount that represent the part of disposable income (adjusted for the


change in pension entitlements) that is not spent on final consumption. Gross savings are calculated as gross national income less total consumption, plus net transfers. This indicator is expressed as a percentage of Gross Domestic Product (GDP) which is the total income earned through the production of goods and services in an economic territory during an accounting period.","Country official statistics, National Statistical Organizations and/or Central Banks;
National Accounts data files, Organisation for Economic Co-operation and Development (OECD);
Staff estimates, World Bank (WB)",1277527,
63016,con5b.2,"Phone used was a basic text phone, men (% age 15+)",28,Global Findex database,"","",63017,
58501,BAR.SEC.ICMP.3034.FE.ZS,Barro-Lee: Percentage of female population age 30-34 with secondary schooling. Total (Incomplete and Completed Secondary),12,Education Statistics,Percentage of female population age 30-34 with secondary schooling. Total (Incomplete and Completed Secondary),Robert J. Barro and Jong-Wha Lee: http://www.barrolee.com/,58502,
605396,fin22c.9,"Borrowed from a savings club, rural (% age 15+)",28,Global Findex database,"","",605397,
1286849,per_sa_fw.ben_q1_preT_tot,Benefits incidence in 1st quintile (poorest) (%) - Subsidies (preT),29,The Atlas of Social Protection: Indicators of Resilience and Equity,Percentage of benefits going to the 1st quintile (poorest)  relative to the total benefits going to the population,ASPIRE,1286850,
1287877,per_sa_os.cov_pop_totm,Coverage (%) - Other Social Assistance -male-beneficiary,29,The Atlas of Social Protection: Indicators of Resilience and Equity,"","",1287878,
1290327,per_si_cp.cov_pop_totm,Coverage (%) - Contributory Pensions -male-beneficiary,29,The Atlas of Social Protection: Indicators of Resilience and Equity,"","",1290328,
57753,avlc_al_alot_dfcl_urb,Women subjected to violence in the last 12 months (% of ever-partnered women living in urban areas with disability i.e. at least a lot of functional difficulty),92,Disability Data Hub (DDH),"","",57754,
1295340,SE.CLO.5.LDGAP.R.PRL.2011.F,"Learning Deprivation Gap;PIRLS 2011 for grade 5 using MPL Low (400 points) for reading, Female",12,Education Statistics,"","",1295341,
60766,CC.GHG.EMSE.MC,Total GHG emissions by sector (Mt CO2 eq) - Manufacturing/Construction,87,Country Climate and Development Report (CCDR),"Manufacturing and construction sector greenhouse gas emissions are generated from the World Resource Institute's Climate Watch. Climate Watch Historical Emission data contains sector-level greenhouse gas (GHG) emissions data for 194 countries and the European Union (EU) for the period 1990-2018, including emissions of the six major GHGs from most major sources and sinks. Non-CO2 emissions are expressed in CO2 equivalents using 100-year global warming potential values from IPCC Fourth Assessment Report. Climate Watch Historical GHG Emissions data (previously published through CAIT Climate Data Explorer) are derived from several sources. Any use of the Land-Use Change and Forestry or Agriculture indicator should be cited as FAO 2020, FAOSTAT Emissions Database. Any use of CO2 emissions from fuel combustion data should be cited as CO2 Emissions from Fuel Combustion, OECD/IEA, 2020.","Climate Watch. 2020. Washington, DC: World Resources Institute. Available online at: https://www.climatewatchdata.org.",60767,
1271148,mnfw_any_dfcl_mobile_all,Working individuals in manufacturing (% of persons with any degree of mobility difficulty),92,Disability Data Hub (DDH),"","",1271149,
59714,BN.CAB.FUND.CD,"Current Acc. Bal. after Off. Transf. (US$, BoP)",57,WDI Database Archives,"","",59715,
1294884,SE.CLO.4.LDSEV.R.PRL.2016.R,"Learning Deprivation Severity;PIRLS 2016 for grade 4 using MPL Low (400 points) for reading, Rural",12,Education Statistics,"","",1294885,
1281346,PER.SOR.DIST.JR,World Bank: Share of total education expenditures disbursed by subnational levels of government for junior secondary education (%),12,Education Statistics,"","",1281347,
1293500,SE.CLO.15Y.LDSEV.M.PS.2015.M,"Learning Deprivation Severity;PISA 2015 for grade 15Y using MPL Level 2 for math, Male",12,Education Statistics,"","",1293501,
996909,IN.POV.MIGRNTS.5TO9YEARS.NUM,"Migrants, Total: 5 to 9 years  residence (Number)",41,Country Partnership Strategy for India (FY2013 - 17),"","",996911,
1270154,LO.TIMSS.SCI8.ADV.FE,TIMSS: Female 8th grade students reaching the advanced international benchmark of science achievement (%),12,Education Statistics,"TIMSS: Female 8th grade students reaching the advanced international benchmark of science achievement (%) is the share of female 8th grade students scoring at least 625 on the science assessment. Students at this benchmark can communicate understanding of concepts related to biology, chemistry, physics, and Earth science in a variety of contexts. Students can classify animals into taxonomic groups. They can apply knowledge of cell structures and their functions. Students show some understanding of diversity, adaptation, and natural selection. They also recognize the interdependence of populations of organisms in an ecosystem. Students demonstrate knowledge of the composition of matter and the periodic table of the elements. Students use physical properties of matter to sort, classify, and compare substances and materials. They also recognize evidence that a chemical reaction has occurred. Students communicate understanding of particle spacing and motion in different physical states. Students apply knowledge of energy transfer and electrical circuits, can relate the properties of light and sound to common phenomena, and demonstrate understanding of forces in everyday contexts. Students communicate understanding of Earth’s structure, physical features, and processes. They demonstrate knowledge of the Earth’s resources and their conservation. Data reflects country performance in the stated year according to TIMSS reports, but may not be comparable across years or countries. Consult the TIMSS website for more detailed information: http://timss.bc.edu/",International Association for the Evaluation of Educational Achievement (IEA)'s Trends in International Mathematics and Science Study,1270155,
63172,CRPFM-12.1,Climate related information in performance plans,91,PEFA_CRPFM,"","",63173,
1229022,JI.TLF.35BL.TM.OL.ZS,"Underemployment, less than 35 hours per week, aged 25-64 (% of employed population aged 25-64)",86,Global Jobs Indicators Database (JOIN),"","",1229023,
53146,5.1.2_TJK.TOTA.AID.AGAK," International aid disbursed to total education, Aga Khan to Tajikistan (USD million) ",34,Global Partnership for Education,"International concessional aid disbursed by the reporting development partner to the total education sector in the specific developing country. Targets indicate scheduled or projected aid. Accounted aid includes activities, projects, technical cooperation and sector and budget support (20%), as it was reported by the donor to the Global Partnership for Education.","The 2011 Monitoring Exercise on Aid Effectiveness in the Education Sector was produced by the Global Partnership for Education in parallel to the OECD’s 2011 Survey on Monitoring the Paris Declaration. Through this exercise participating donors reported on the international aid allocated and projected to specific developing countries. Data were later validated and/or updated when preparing the GPE Results Report in 2012. Most of the figures were reported in 2011 and in USD. When it was not the case, currencies were converted to USD. Data are relative to a calendar year, unless it is specified otherwise in the country notes. For further details in this 2012 Monitoring Exercise, please refer to the following web site: http://www.globalpartnership.org/our-work/areas-of-focus/aid-effectiveness/2011-monitoring-exercise-on-aid-effectiveness-2/",53147,
