hjid,id,indicator_name,source_id,source_value,source_note,source_organization,topics_indicator_element_hjid,indicator__indicators_elemen_0
1860344,HH.DHS.NAR.23.U,DHS: Net attendance rate. Secondary. Urban,12,Education Statistics,Net attendance rate. Secondary. Urban is the proportion of urban children of official secondary school age who are attending secondary school.,Demographic and Health Surveys (DHS),1860345,
2091045,JI.EMP.INDU.LE.ZS,"Employment in the industrial sector, aged 15-64, primary education and below (% of employed population with low education in working age)",86,Global Jobs Indicators Database (JOIN),"","",2091046,
3090713,prot_al_alot_dfcl_3044,Persons aged 30 to 44 years in households receiving social protection (% of persons aged 30 to 44 years with disability i.e. at least a lot of functional difficulty),92,Disability Data Hub (DDH),"","",3090714,
3113321,SE.CLO.5.PRF.M.TMS.2015.A,Above Proficiency;TIMSS 2015 for grade 5 using MPL Low (400 points) for math,12,Education Statistics,"","",3113322,
3041624,SE.CLO.4.LDGAP.R.PRL.2011.5,"Learning Deprivation Gap;PIRLS 2011 for grade 4 using MPL Low (400 points) for reading, Fifth Quintile",12,Education Statistics,"","",3041625,
2270574,NY.GDP.MKTP.PP.CD,"GDP, PPP (current international $)",2,World Development Indicators,"This indicator provides values for gross domestic product (GDP) expressed in current international dollars, converted by purchasing power parities (PPPs). PPPs account for the different price levels across countries and thus PPP-based comparisons of economic output are more appropriate for comparing the output of economies and the average material well-being of their inhabitants than exchange-rate based comparisons.  

Gross domestic product is the total income earned through the production of goods and services in an economic territory during an accounting period. It can be measured in three different ways: using either the expenditure approach, the income approach, or the production approach. This series has been linked to produce a consistent time series to counteract breaks in series over time due to changes in base years, source data and methodologies. Thus, it may not be comparable with other national accounts series in the database for historical years. This indicator is expressed in current prices, meaning no adjustment has been made to account for price changes over time. The PPP conversion factor is a currency conversion factor and a spatial price deflator. PPPs convert different currencies to a common currency and, in the process of conversion, equalize their purchasing power by eliminating the differences in price levels between countries, thereby allowing volume or output comparisons of GDP and its expenditure components.","International Comparison Program (ICP), World Bank (WB), uri: https://www.worldbank.org/en/programs/icp/data, note: This information is for ICP’s PPPs utilized in WDI, publisher: International Comparison Program (ICP), date accessed: May 30, 2024, date published: May 30, 2024;
The Eurostat PPP Programme, Eurostat (ESTAT), uri: https://ec.europa.eu/eurostat/databrowser/explore/all/all_themes, publisher: Eurostat, date accessed: Periodical update;
The OECD PPP Programme, Organisation for Economic Co-operation and Development (OECD), uri: https://data-https://data-explorer.oecd.org/, publisher: OECD, date accessed: Periodical update;
Staff estimates, World Bank (WB);
National Accounts data files, Organisation for Economic Co-operation and Development (OECD);
World Economic Outlook database, International Monetary Fund (IMF)",2270575,
1296569,FB.FCP.DISR.AS.IC.HL,645_Are mortgage or housing loans among the top-three products complained about to the alternative dispute resolution (ADR) entity?_#VHOA_02,69,Global Financial Inclusion and Consumer Protection Survey,"","",1296570,
3048190,SE.CLO.6.LDGAP.R.SAC.2000.1,"Learning Deprivation Gap;SACMEQ 2000 for grade 6 using MPL Level 5 for reading, First Quintile",12,Education Statistics,"","",3048191,
3072033,per_sa_fw_p1_rur,Poverty Gap reduction (%) -  Subsidies -1st quintile (poorest) -rural,29,The Atlas of Social Protection: Indicators of Resilience and Equity,Poverty gap reduction due to Fee waivers and targeted subsidies programs as % of pre-transfer poverty gap,ASPIRE,3072034,
782438,DP.DOD.DSTC.CR.NF.CD,"Gross PSD, Nonfinancial Public Corp., Short-term, All instruments, Nominal Value, US$",20,Quarterly Public Sector Debt,"","",782439,
3039657,SE.CLO.15Y.PRF.S.PS.2015.3,"Above Proficiency;PISA 2015 for grade 15Y using MPL Level 2 for science, Third Quintile",12,Education Statistics,"","",3039658,
1721105,fplm_any_dfcl_comm_all,Women with family planning needs met (% of women with any degree of communication difficulty),92,Disability Data Hub (DDH),"","",1721106,
750158,DP.DOD.DLOA.CR.L1.FC,"Gross PSD, Financial Public Corp., Long-term, With payment due in one year or less, Other accounts payable, Nominal Value, National Currency",20,Quarterly Public Sector Debt,"","",750159,
2124458,JI.ENR.0616.HE.ZS,"Enrollment rate, aged 6-16, above primary education (% of population with high education aged 6-16)",86,Global Jobs Indicators Database (JOIN),"","",2124459,
59187,110112,110112:Meat (Class),71,International Comparison Program (ICP) 2005,"","",59188,
3082660,per_si_allsi.cov_pop_rur,Coverage (%) - All Social Insurance -rural,29,The Atlas of Social Protection: Indicators of Resilience and Equity,Percentage of population participating in Social Insurance programs (includes direct and indirect beneficiaries),ASPIRE,3082661,
905195,DT.DOD.DLCD.CD.OT.AR.NE.US,"Net Ext. Debt Position, Other Sectors, Long-term, Currency and deposits, USD",22,Quarterly External Debt Statistics SDDS,"","",905196,
3096180,SE.CLO.15Y.LDGAP.R.PS.2006.F,"Learning Deprivation Gap;PISA 2006 for grade 15Y using MPL Level 2 for reading, Female",12,Education Statistics,"","",3096181,
881398,DT.DOD.DECT.CD.TD.NV.US,"Gross Ext. Debt Pos., All Sectors, All maturities, Debt Securities, Nominal Value, USD",22,Quarterly External Debt Statistics SDDS,"","",881399,
3130032,SE.CLO.8.LDSEV.S.TMS.2003.1,"Learning Deprivation Severity;TIMSS 2003 for grade 8 using MPL Low (400 points) for science, First Quintile",12,Education Statistics,"","",3130033,
1040450,DT.INR.DECT.00.03.MO.SA.US,"Ext. Debt Service Pmt, Interest receipts on SDR holdings, 0 to 3 mo., All instruments, USD",23,Quarterly External Debt Statistics GDDS,"","",1040451,
484227,CC.ENO.MLP,Emission Totals - Emissions (N2O) - Manure left on Pasture,87,Country Climate and Development Report (CCDR),"The FAOSTAT domain Emissions Totals summarizes the greenhouse gas (GHG) emissions generated from agriculture and forest land. They consist of methane (CH4), nitrous oxide (N2O) and carbon dioxide (CO2) emissions from crop and livestock activities, forest management and include land use and land use change processes. Data are computed at Tier 1 of the IPCC Guidelines for National greenhouse gas (GHG) Inventories (IPCC, 1996; 1997; 2000; 2002; 2006; 2014). Estimates are available by country, with global coverage for the period 1961–2019 with projections for 2030 and 2050 for some categories of emissions or 1990–2019 for others. The database is updated annually.  The FAOSTAT domain Emissions Totals disseminates information estimates of CH4, N2O and CO2 emissions/removals and their aggregates in CO2eq in units of kilotonnes (kt, or 106 kg). The latter are computed by using the IPCC Fifth Assessment report global warming potentials, AR5 (IPCC, 2014).","FAO, FAOSTAT Climate Change, Emissions Totals, http://www.fao.org/faostat/en/#data/GT.",484228,
2721486,per_sa_os.bry_q4_preT_tot,Beneficiary incidence in 4th quintile (%) - Other Social Assistance (preT),29,The Atlas of Social Protection: Indicators of Resilience and Equity,Percentage of program beneficiaries in a quintile relative to the total number of beneficiaries in the population,ASPIRE,2721487,
2669755,per_sa_ik.avt_q5_preT_totmr,Avg. per capita transfer held by 5th quintile(richest)-In-Kind and Food Transf.(preT)-male-recipient,29,The Atlas of Social Protection: Indicators of Resilience and Equity,"","",2669756,
3096629,SE.CLO.15Y.LDGAP.R.PSD.2017.R,"Learning Deprivation Gap;PISA-D 2017 for grade 15Y using  for reading, Rural",12,Education Statistics,"","",3096630,
2249738,LO.LLECE.SCI6.P25,LLECE: Distribution of 6th Grade Science Scores: 25th Percentile Score,12,Education Statistics,The 25th percentile score is the score below which 25 percent of students scored. Scores were calculated on a scale with a mean of 500 and a standard deviation of 100 points. Data reflects country performance in the stated year according to LLECE reports. Consult the LLECE website for more detailed information: http://www.llece.org/,Latin American Laboratory for Assessment of the Quality of Education (LLECE),2249739,
2278294,PER.SOR.HH.SEC,"World Bank: Household spending per student, secondary (in USD or local currency)",12,Education Statistics,"","",2278295,
3058454,SE.PRM.LHTH.DF,(De Facto) Policy Lever (Learners) - Health,12,Education Statistics,"","World Bank, Global Education Policy Dashboard",3058455,
3078412,per_sa_sf.bry_q1_preT_totmr,Beneficiary incidence in 1st quintile (poorest) (%) - School Feeding Programs (preT) -male-recipient,29,The Atlas of Social Protection: Indicators of Resilience and Equity,"","",3078413,
2100099,JI.EMP.OSRV.YG.ZS,"Employment in the other services sector, aged 15-24 (% of employed population aged 15-24)",86,Global Jobs Indicators Database (JOIN),"","",2100100,
3073361,per_sa_ik.bry_q4_preT_totmr,Beneficiary incidence in 4th quintile (%) - In-Kind and Food Transfers (preT) -male-recipient,29,The Atlas of Social Protection: Indicators of Resilience and Equity,"","",3073362,
1653562,fin43b.4,"Received payments for agricultural products: through a mobile phone, older (% age 25+)",28,Global Findex database,"","",1653563,
855598,DT.DIS.PROP.PS.CD,"PS, other private creditors (DIS, current US$)",81, International Debt Statistics: DSSI,"Public sector other private credits from manufacturers, exporters, and other suppliers of goods, and bank credits covered by a guarantee of an export credit agency. Disbursements are drawings by the borrower on loan commitments during the year specified. Data are in current U.S. dollars.","World Bank, International Debt Statistics.",855599,
2711390,per_sa_os.avt_q4_preT_totfr,Average per capita transfer held by 4th quintile - Other Social Assistance (preT) -female-recipient,29,The Atlas of Social Protection: Indicators of Resilience and Equity,"","",2711391,
3030292,Q.1C0.1C0.D.9B.MOA.SDHO.1.ALL.MV.SDR.IFI,25_SDR holdings,54,Joint External Debt Hub,Holdings of SDRs are international reserve assets created by the IMF to supplement existing reserves. They are valued on the basis of a basket of currencies of four key international currencies and can be used in a wide variety of transactions and operations among official holders. SDRs are allocated to Fund members that are participants in the Fund’s Operations Division for SDRs and Administered Accounts in proportion to their quotas. Data  are sourced from IMF records.,IMF,3030293,
3101612,SE.CLO.2.LDGAP.R.PSC.2019.M,"Learning Deprivation Gap;PASEC 2019 for grade 2 using MPL 4 for reading, Male",12,Education Statistics,"","",3101613,
3087158,PI-18.1,(i) Scope of budget scrutiny,68,PEFA 2016,"","",3087159,
3085151,per_si_ss.avt_q3_preT_totmr,Avg per capita transfer held by 3rd quintile-Contributory Ben. other than Pensions(preT)-male-recip,29,The Atlas of Social Protection: Indicators of Resilience and Equity,"","",3085152,
3062643,SF.CMN.MNLN.TH,"Telephone mainlines (per 1,000 people)",57,WDI Database Archives,"","",3062644,
2823693,per_sa_sp.cov_q5_tot,Coverage in 5th quintile (richest) (%) - Social Pensions,29,The Atlas of Social Protection: Indicators of Resilience and Equity,Percentage of population participating in Social Pensions programs (includes direct and indirect beneficiaries),ASPIRE,2823694,
1874804,HH.DHS.YRS.15UP.GIN,DHS: Gini coefficient of average years of schooling. Age 15+,12,Education Statistics,Gini coefficient of average years of schooling. Age 15+ measures the degree of inequality in years of schooling in a society. It is calculated similarly to the Gini coefficient of income or wealth. Results range from 0 to 100 with 0 indicating perfect equality and 100 indicating perfect inequality.,Demographic and Health Surveys (DHS),1874805,
1163861,DT.TDS.DECT.CD.MA.24P.US,"Ext. Debt Service Pmt, Central Bank, More than 2yrs, All instruments, Prin. and Int., USD",22,Quarterly External Debt Statistics SDDS,"","",1163862,
617221,con2e.12,"No mobile phone due to family or community disapproval, in laborforce (% age 15+)",28,Global Findex database,"","",617222,
3091418,Q.1C0.1C0.D.9B.MOA.SDHO.1.ALL.MV.SDR.IFI,25_SDR holdings,54,Joint External Debt Hub,Holdings of SDRs are international reserve assets created by the IMF to supplement existing reserves. They are valued on the basis of a basket of currencies of four key international currencies and can be used in a wide variety of transactions and operations among official holders. SDRs are allocated to Fund members that are participants in the Fund’s Operations Division for SDRs and Administered Accounts in proportion to their quotas. Data  are sourced from IMF records.,IMF,3091419,
891309,DT.DOD.DIIE.CD.IL.PX.US,"Gross Ext. Debt Pos., DI: Intercom Lending, All maturities, Debt liab. of dir. investors to DI ent., Other price chg, USD",22,Quarterly External Debt Statistics SDDS,"","",891310,
3092688,SABER.GRVT.GOAL6.LVL4,"SABER: (Engaging the Private Sector, Government funded) Policy Goal 6 Lever 4: Inspection",12,Education Statistics,"Data Interpretation: 1=Latent; 2=Emerging; 3=Established; 4=Advanced. For additional information, visit the SABER: (website: http://saber.worldbank.org/index.cfm","Systems Approach for Better Education Results (SABER), World Bank",3092689,
1893371,hh_cel_al_alot_dfcl_1529,Persons aged 15 to 29 years in households with a mobility phone (% of persons aged 15 to 29 years with disability i.e. at least a lot of functional difficulty),92,Disability Data Hub (DDH),"","",1893372,
3046669,SE.CLO.5.PRF.M.TMS.2019.3,"Above Proficiency;TIMSS 2019 for grade 5 using MPL Low (400 points) for math, Third Quintile",12,Education Statistics,"","",3046670,
1269335,EN.GHG.N2O.IP.MT.CE.AR5,Nitrous oxide (N2O) emissions from Industrial Processes (Mt CO2e),2,World Development Indicators,"A measure of annual emissions of nitrous oxide (N2O), one of the six Kyoto greenhouse gases (GHG), from industrial processes including IPCC 2006 codes 2.A.1 Cement production, 2.A.2 Lime production, 2.A.3 Glass Production, 2.A.4 Other Process Uses of Carbonates, 2.B Chemical Industry, 2.C Metal Industry, 2.D Non-Energy Products from Fuels and Solvent Use, 2.E Electronics Industry, 2.F Product Uses as Substitutes for Ozone Depleting Substances, 2.G Other Product Manufacture and Use and 5.A Indirect N2O emissions from the atmospheric deposition of nitrogen in NOx and NH3). The measure is standardized to carbon dioxide equivalent values using the Global Warming Potential (GWP) factors of IPCC's 5th Assessment Report (AR5).","EDGAR (Emissions Database for Global Atmospheric Research) Community GHG Database, Joint Research Centre (JRC) - European Commission, uri: https://edgar.jrc.ec.europa.eu/dataset_ghg2024, publisher: JRC European Commission, date published: 2024;
International Energy Agency (IEA), uri: https://edgar.jrc.ec.europa.eu/dataset_ghg2024, publisher: JRC European Commission, date published: 2024",1269336,
3049115,SE.CLO.6.LDSEV.R.PSC.2019.M,"Learning Deprivation Severity;PASEC 2019 for grade 6 using MPL 4 for reading, Male",12,Education Statistics,"","",3049116,
1874869,HH.DHS.YRS.15UP.GIN.R,DHS: Gini coefficient of average years of schooling. Age 15+. Rural,12,Education Statistics,Gini coefficient of average years of schooling. Age 15+. Rural measures the degree of inequality in years of schooling in a society. It is calculated similarly to the Gini coefficient of income or wealth. Results range from 0 to 100 with 0 indicating perfect equality and 100 indicating perfect inequality.,Demographic and Health Surveys (DHS),1874870,
657775,con3a.2,"Main reason for no phone: Not enough money, men (% age 15+)",28,Global Findex database,"","",657776,
3033645,saso_any_dfcl_65up,Assets owned by individual's household (% of persons aged 65 or older with any degree of functional difficulty),92,Disability Data Hub (DDH),"","",3033646,
588009,con26d.7,"Daily internet use, poorest 40% (% age 15+)",28,Global Findex database,"","",588010,
1011296,DT.DOD.PUBS.CD.AR.US,"Gross Ext. Debt Pos., Public Sector Ext. Debt, All maturities, Arrears, USD",23,Quarterly External Debt Statistics GDDS,"","",1011297,
149962,5.2.8_ETH.BAS.AID.GPE,"International aid disbursed to basic education, GPE Catalytic Fund to Ethiopia (USD million) ",34,Global Partnership for Education,"International concessional aid disbursed by the reporting development partner to the basic education sector in the specific developing country. Targets indicate scheduled or projected aid. Accounted aid includes activities, projects, technical cooperation and sector and budget support (20%), as it was reported by the donor to the Global Partnership for Education.","The 2011 Monitoring Exercise on Aid Effectiveness in the Education Sector was produced by the Global Partnership for Education in parallel to the OECD’s 2011 Survey on Monitoring the Paris Declaration. Through this exercise participating donors reported on the international aid allocated and projected to specific developing countries. Data were later validated and/or updated when preparing the GPE Results Report in 2012. Most of the figures were reported in 2011 and in USD. When it was not the case, currencies were converted to USD. Data are relative to a calendar year, unless it is specified otherwise in the country notes. For further details in this 2012 Monitoring Exercise, please refer to the following web site: http://www.globalpartnership.org/our-work/areas-of-focus/aid-effectiveness/2011-monitoring-exercise-on-aid-effectiveness-2/",149963,
2766047,per_sa_pw.bry_q4_totmr,Beneficiary incidence in 4th quintile (%) - Public Works -male-recipient of programs,29,The Atlas of Social Protection: Indicators of Resilience and Equity,"","",2766048,
2271221,NY.GNP.PCAP.KN,GNI per capita (constant LCU),2,World Development Indicators,"Gross national income is the total income earned by all residents within an economic territory during an accounting period. It is equal to gross domestic product plus earned income receivable from abroad minus earned income payable abroad. The core indicator has been divided by the general population to achieve a per capita estimate.This indicator is expressed in constant prices, meaning the series has been adjusted to account for price changes over time. The reference year for this adjustment varies by country. This series is expressed in local currency units.","Country official statistics, National Statistical Organizations and/or Central Banks;
National Accounts data files, Organisation for Economic Co-operation and Development (OECD);
Staff estimates, World Bank (WB)",2271222,
2804876,per_sa_sp.bry_q3_preT_tot,Beneficiary incidence in 3rd quintile (%) - Social Pensions (preT),29,The Atlas of Social Protection: Indicators of Resilience and Equity,Percentage of program beneficiaries in a quintile relative to the total number of beneficiaries in the population,ASPIRE,2804877,
3131422,SE.CLO.8.PRF.M.TMS.2007.4,"Above Proficiency;TIMSS 2007 for grade 8 using MPL Low (400 points) for math, Fourth Quintile",12,Education Statistics,"","",3131423,
3072973,per_sa_ik.ben_q3_urb,Benefits incidence in 3rd quintile (%) - In-Kind -urban,29,The Atlas of Social Protection: Indicators of Resilience and Equity,Percentage of benefits going to the third quintile  relative to the total benefits going to the population,ASPIRE,3072974,
1935656,IC.CRD.PUBL.P3,"Public credit registry coverage (borrowers per 1,000 adults)",57,WDI Database Archives,"","",1935657,
2075393,JI.EMP.1564.OL.ZS,"Employment rate, aged 25-64 (% of labor force aged 25-64)",86,Global Jobs Indicators Database (JOIN),"","",2075394,
2274218,PER.ETH.PTR.MIN,"World Bank: Pupil/Teacher Ratio in minority ethnic group schools, primary",12,Education Statistics,"","",2274219,
2288492,per_pr_allpr.bry_q3_preT_totmr,Beneficiary incidence in 3rd quintile (%) - All Private Transfers (preT) -male-recipient,29,The Atlas of Social Protection: Indicators of Resilience and Equity,"","",2288493,
1041891,DT.INR.DECT.CD.SA.1218.US,"Ext. Debt Service Pmt, Interest receipts on SDR holdings, More than 12 to 18, USD",22,Quarterly External Debt Statistics SDDS,"","",1041892,
1922561,IC.BRE.IT.P2,B-READY: International Trade Pillar 2: Quality of Public Services for the Facilitation of International Trade,2,World Development Indicators,"B-READY focuses on ten topics that are organized following the life cycle of the firm and its participation in the market while opening, operating (or expanding), and closing (or reorganizing) a business. The International Trade topic measures different aspects of international trade—trade in goods, trade in services, and digital trade—across three different dimensions, or pillars. The second pillar assesses digital and physical infrastructure concerning international trade and the quality of border management, thus assessing de facto provision of public services for international trade facilitation.","Business Ready (B-READY) project, World Bank (WB), uri: https://www.worldbank.org/en/businessready",1922562,
3085252,per_si_ss.avt_q4_totmr,Average per capita transfer held by 4th quintile-Contributory Ben. other than Pensions-male-recip,29,The Atlas of Social Protection: Indicators of Resilience and Equity,"","",3085253,
775961,DP.DOD.DSLO.CR.CG.Z1,"Gross PSD, Central Gov., Short-term, Loans, Nominal Value, % of GDP",20,Quarterly Public Sector Debt,"The source of non-seasonally adjusted Gross Domestic Product (GDP) data in national currency, at current prices, is the International Finance Statistics quarterly database of the IMF, annualized by the World Bank, unless otherwise specified.","",775962,
2856183,per_si_allsi.ben_ep_tot,Benefits incidence in extreme poor (<$2.15 a day) (%) - All Social Insurance,29,The Atlas of Social Protection: Indicators of Resilience and Equity,Percentage of benefits going to the extreme poor (those below $125 a day)  relative to the total benefits going to the population,ASPIRE,2856184,
3015629,per_sionl.overlap_ep_tot,Population in extreme poor (<$2.15 a day) only receiving All Social Insurance (%),29,The Atlas of Social Protection: Indicators of Resilience and Equity,Percentage of population only receiving All Social Insurance programs (includes direct and indirect beneficiaries),ASPIRE,3015630,
3057739,SE.PRM.ISTD.4,(De Facto) Do you know if there is a national connectivity program?,12,Education Statistics,"","World Bank, Global Education Policy Dashboard",3057740,
3034101,SD.ESR.PERF.XQ,Economic and Social Rights Performance Score,75,"Environment, Social and Governance (ESG) Data","","",3034102,
3029662,prot_any_dfcl_selfcare_all,Persons in households receiving social protection (% of persons with any degree of selfcare difficulty),92,Disability Data Hub (DDH),"","",3029663,
866575,DT.DOD.DECT.CD.FC.CB.JY.US,"Gross Ext. F. Curr Debt Pos., Deposit-Taking Corp., exc. CB, All maturities, All instruments, Yen, USD",22,Quarterly External Debt Statistics SDDS,"","",866576,
1298204,FB.FCP.DISR.AS.SE,615_Is the alternative dispute resolution (ADR) entity a statutory entity?_#VHMA_00,69,Global Financial Inclusion and Consumer Protection Survey,"","",1298205,
2281449,per_allsp.bry_q1_totfr,Beneficiary incidence in 1st quintile(poorest)(%)-All Social Protection and Labor -female-recipient,29,The Atlas of Social Protection: Indicators of Resilience and Equity,"","",2281450,
685417,DAK.GOVT.CR,Total Specific Allocation Grant for Government Sector (in IDR Billion),45,Indonesia Database for Policy and Economic Research,"The Specific Allocation Grant (DAK) is a fund sourced from revenue in the Central Budget (APBN) allocated to a certain region with the aim of funding special activities of the region in accordance with national priorities. The DAK allocation has a formula component that takes into account the fiscal gap and has a 10 percent matching requirement. The DAK is earmarked for capital spending and cannot be used for research, training, administration, or official travel.","Ministry of Finance, Ministry of Finance Regulation",685418,
3120932,SE.CLO.6.LDSEV.S.TMS.2011.U,"Learning Deprivation Severity;TIMSS 2011 for grade 6 using MPL Low (400 points) for science, Urban",12,Education Statistics,"","",3120933,
1954748,IC.FRM.FIN.FIN14,Percent of firms with a bank loan/line of credit,13,Enterprise Surveys,Percentage of firms with bank loans or line of credit.,"World Bank, Enterprise Surveys (http://www.enterprisesurveys.org/).",1954749,
858618,DT.DOD.BLAT.PRVG.CD,"PRVG, bilateral (DOD, current US$)",81, International Debt Statistics: DSSI,"Private sector guaranteed by public sector bilateral debt includes loans from governments and their agencies (including central banks), loans from autonomous bodies, and direct loans from official export credit agencies. Data are in current U.S. dollars.","World Bank, International Debt Statistics.",858619,
2279600,PER.TER.HH.TEXT,World Bank: Household spending per student on textbooks for tertiary education (USD or local currency),12,Education Statistics,"","",2279601,
