embedded_id_indicator_id,embedded_id_country_id,indicator_name,source_id,source_value,source_note,source_organization,start_year,end_year,data_point,topics
EN.ATM.PM25.MC.T3.ZS,GB,"PM2.5 pollution, population exposed to levels exceeding WHO Interim Target-3 value (% of total)",2,World Development Indicators,Percent of population exposed to ambient concentrations of PM2.5 that exceed the World Health Organization (WHO) Interim Target 3 (IT-3) is defined as the portion of a country’s population living in places where mean annual concentrations of PM2.5 are greater than 15 micrograms per cubic meter. The Air Quality Guideline (AQG) of 10 micrograms per cubic meter is recommended by the WHO as the lower end of the range of concentrations over which adverse health effects due to PM2.5 exposure have been observed.,"Global Burden of Disease Study 2017 (GBD 2017), Institute for Health Metrics and Evaluation (IHME), uri: https://ghdx.healthdata.org/gbd-2017, publisher: Institute for Health Metrics and Evaluation (IHME), date published: 202112",1990,2017,12,Environment
SE.PRM.NENR.FE,US,"School enrollment, primary, female (% net)",2,World Development Indicators,"Net enrollment rate is the ratio of children of official school age who are enrolled in school to the population of the corresponding official school age. Primary education provides children with basic reading, writing, and mathematics skills along with an elementary understanding of such subjects as history, geography, natural science, social science, art, and music.","UNESCO Institute for Statistics (UIS), UN Educational, Scientific and Cultural Organization (UNESCO), uri: http://uis.unesco.org/, publisher: UNESCO Institute for Statistics (UIS)",2005,2017,9,Education;Gender
SE.TER.ENRR.FE,DK,"School enrollment, tertiary, female (% gross)",2,World Development Indicators,"Gross enrollment ratio is the ratio of total enrollment, regardless of age, to the population of the age group that officially corresponds to the level of education shown. Tertiary education, whether or not to an advanced research qualification, normally requires, as a minimum condition of admission, the successful completion of education at the secondary level.","Data API, UN Educational, Scientific and Cultural Organization (UNESCO), uri: https://databrowser.uis.unesco.org/resources, note: The data are obtained through the UIS API.  Detailed documentation is available at: https://api.uis.unesco.org/api/public/documentation/, publisher: UNESCO Institute for Statistics (UIS), type: Bulk file (csv), date accessed: 2025-09-22, date published: 2025-09",2000,2023,24,Education;Gender
LP.EXP.DURS.MD,FI,"Lead time to export, median case (days)",2,World Development Indicators,Lead time to export is the median time (the value for 50 percent of shipments) from shipment point to port of loading. Data are from the Logistics Performance Index survey. Respondents provided separate values for the best case (10 percent of shipments) and the median case (50 percent of shipments). The data are exponentiated averages of the logarithm of single value responses and of midpoint values of range responses for the median case.,"Logistic Performance Index Surveys, World Bank (WB), uri: https://lpi.worldbank.org/, note: Summary results are published in Arvis and others' Connecting to Compete: Trade Logistics in the Global Economy, The Logistics Performance Index and Its Indicators report.;
Turku School of Economics, uri: https://lpi.worldbank.org/, note: Summary results are published in Arvis and others' Connecting to Compete: Trade Logistics in the Global Economy, The Logistics Performance Index and Its Indicators report.",2007,2018,6,Private Sector;Trade
SE.SEC.TCAQ.LO.ZS,US,Trained teachers in lower secondary education (% of total teachers),2,World Development Indicators,Trained teachers in lower secondary education are the percentage of lower secondary school teachers who have received the minimum organized teacher training (pre-service or in-service) required for teaching in a given country.,"Data API, UN Educational, Scientific and Cultural Organization (UNESCO), uri: https://databrowser.uis.unesco.org/resources, note: The data are obtained through the UIS API.  Detailed documentation is available at: https://api.uis.unesco.org/api/public/documentation/, publisher: UNESCO Institute for Statistics (UIS), type: Bulk file, date accessed: 2025-09-22, date published: 2025-09",2014,2023,10,Education
NY.GNP.MKTP.KN,US,GNI (constant LCU),2,World Development Indicators,"Gross national income is the total income earned by all residents within an economic territory during an accounting period. It is equal to gross domestic product plus earned income receivable from abroad minus earned income payable abroad. This indicator is expressed in constant prices, meaning the series has been adjusted to account for price changes over time. The reference year for this adjustment varies by country. This series is expressed in local currency units.","Country official statistics, National Statistical Organizations and/or Central Banks;
National Accounts data files, Organisation for Economic Co-operation and Development (OECD);
Staff estimates, World Bank (WB)",1970,2023,54,Economy & Growth
FM.AST.CGOV.ZG.M3,GB,Claims on central government (annual growth as % of broad money),2,World Development Indicators,"Claims on central government include loans to central government institutions net of deposits. Broad money is the sum of all liquid financial instruments held by money-holding sectors that are widely accepted in an economy as a medium of exchange, plus those that can be converted into a medium of exchange at short notice at, or close to, their full nominal value. This indicator represents the annual percentage growth in the ratio of claims to broad money.","International Financial Statistics database, International Monetary Fund (IMF)",1961,2024,64,Financial Sector
NV.MNF.CHEM.ZS.UN,FI,Chemicals (% of value added in manufacturing),2,World Development Indicators,"Manufacturing of chemicals and chemical prodcuts includes industries classified in ISIC (Rev. 3) division 24. Value added is the contribution to the economy by a producer or an industry or an institutional sector, which is estimated by the total value of output produced and deducting the total value of intermediate consumption of goods and services used to produce that output. This indicator is expressed as a percentage of value added in manufacturing which is the contribution to the economy by the manufacturing sector (ISIC Rev. 3 major division D).","International Yearbook of Industrial Statistics, UN Industrial Development Organization (UNIDO)",1963,2021,58,Economy & Growth
EG.ELC.ACCS.ZS,FI,Access to electricity (% of population),2,World Development Indicators,"Access to electricity is the percentage of population with access to electricity. Electrification data are collected from industry, national surveys and international sources.","SDG 7.1.1 Electrification Dataset, World Bank (WB), uri: https://trackingsdg7.esmap.org/downloads, note: Data is downloaded from ESMAP website. Data is released when a new Tracking SDG7 report is released., publisher: World Bank (WB), date accessed: 2024-05-16, date published: 2023",1990,2023,34,Climate Change;Energy & Mining;Environment
NY.ADJ.SVNG.GN.ZS,DK,"Adjusted net savings, including particulate emission damage (% of GNI)",2,World Development Indicators,"Adjusted net savings are equal to net national savings plus education expenditure and minus energy depletion, mineral depletion, net forest depletion, and carbon dioxide and particulate emissions damage. This indicator is expressed as a percentage of Gross National Income (GNI) which is the total income earned by all residents within an economic territory during an accounting period. It is equal to gross domestic product plus earned income receivable from abroad minus earned income payable abroad.","Staff estimates, World Bank (WB);
The Changing Wealth of Nations: Measuring Sustainable Development in the New Millennium, World Bank (WB)",1990,2021,32,Economy & Growth;Environment
NY.GDP.FCST.CD,SE,Gross value added at basic prices (GVA) (current US$),2,World Development Indicators,"Gross value added at basic prices reflects the price of products receivable by the producer exclusive of taxes payable on products and inclusive of subsidies receivable on products, less intermediate consumption valued at purchasers' prices. This indicator is expressed in current prices, meaning no adjustment has been made to account for price changes over time. This indicator is expressed in United States dollars.","Country official statistics, National Statistical Organizations and/or Central Banks;
National Accounts data files, Organisation for Economic Co-operation and Development (OECD);
Staff estimates, World Bank (WB)",1970,2024,55,Economy & Growth
EN.GHG.CO2.RT.GDP.PP.KD,SE,Carbon intensity of GDP (kg CO2e per 2021 PPP $ of GDP),2,World Development Indicators,"Annual emissions of carbon dioxide (CO2), one of the six Kyoto greenhouse gases (GHG), from the agriculture, energy, waste, and industrial sectors, excluding LULUCF divided by the GDP in 2021 PPP $.","EDGAR (Emissions Database for Global Atmospheric Research) Community GHG Database, Joint Research Centre (JRC) - European Commission, uri: https://edgar.jrc.ec.europa.eu/dataset_ghg2024, publisher: JRC European Commission, date published: 2024;
International Energy Agency (IEA), uri: https://edgar.jrc.ec.europa.eu/dataset_ghg2024, publisher: JRC European Commission, date published: 2024",1990,2024,35,Environment
SE.SEC.ENRL.GC.FE.ZS,DK,"Secondary education, general pupils (% female)",2,World Development Indicators,"Secondary general pupils are the number of secondary students enrolled in general education programs, including teacher training.","Stat Bulk Data Download Service, UN Educational, Scientific and Cultural Organization (UNESCO), uri: https://uis.unesco.org/bdds, publisher: UNESCO Institute for Statistics (UIS)",1971,2017,43,Education;Gender
BX.TRF.CURR.CD,US,"Secondary income receipts (BoP, current US$)",2,World Development Indicators,"Secondary income refers to transfers recorded in the balance of payments whenever an economy provides or receives goods, services, income, or financial items without a quid pro quo. All transfers not considered to be capital are current. This indicator is expressed in current prices, meaning no adjustment has been made to account for price changes over time. This indicator is expressed in United States dollars.","Balance of Payments Statistics Yearbook and data files, International Monetary Fund (IMF)",1970,2024,55,Economy & Growth
NV.MNF.CHEM.ZS.UN,NO,Chemicals (% of value added in manufacturing),2,World Development Indicators,"Manufacturing of chemicals and chemical prodcuts includes industries classified in ISIC (Rev. 3) division 24. Value added is the contribution to the economy by a producer or an industry or an institutional sector, which is estimated by the total value of output produced and deducting the total value of intermediate consumption of goods and services used to produce that output. This indicator is expressed as a percentage of value added in manufacturing which is the contribution to the economy by the manufacturing sector (ISIC Rev. 3 major division D).","International Yearbook of Industrial Statistics, UN Industrial Development Organization (UNIDO)",1963,2020,55,Economy & Growth
SE.SEC.CUAT.LO.MA.ZS,NO,"Educational attainment, at least completed lower secondary, population 25+, male (%) (cumulative)",2,World Development Indicators,The percentage of population ages 25 and over that attained or completed lower secondary education.,"Data API, UN Educational, Scientific and Cultural Organization (UNESCO), uri: https://databrowser.uis.unesco.org/resources, note: The data are obtained through the UIS API.  Detailed documentation is available at: https://api.uis.unesco.org/api/public/documentation/, publisher: UNESCO Institute for Statistics (UIS), type: Bulk file (csv), date accessed: 2025-09-22, date published: 2025-09",2004,2023,19,Education;Gender
NE.CON.GOVT.ZS,NO,General government final consumption expenditure (% of GDP),2,World Development Indicators,"Final consumption expenditure is expenditure on goods and services by resident institutional units for the direct satisfaction of human needs or wants, whether individual or collective. General government FCE includes all government current expenditures for purchases of goods and services (including compensation of employees), and most expenditures on national defense and security, but excludes government military expenditures that are part of government capital formation. This indicator is expressed as a percentage of Gross Domestic Product (GDP) which is the total income earned through the production of goods and services in an economic territory during an accounting period.","Country official statistics, National Statistical Organizations and/or Central Banks;
National Accounts data files, Organisation for Economic Co-operation and Development (OECD);
Staff estimates, World Bank (WB)",1970,2023,54,Economy & Growth
NV.IND.TOTL.KD,SE,"Industry (including construction), value added (constant 2015 US$)",2,World Development Indicators,"Industry (including construction) corresponds to ISIC (Rev.4) divisions 05-43. It is comprised of mining, manufacturing, construction, electricity, water, and gas industries. Value added is the contribution to the economy by a producer or an industry or an institutional sector, which is estimated by the total value of output produced and deducting the total value of intermediate consumption of goods and services used to produce that output. This indicator is expressed in constant prices, meaning the series has been adjusted to account for price changes over time. The reference year for this adjustment is 2015. This indicator is expressed in United States dollars.","Country official statistics, National Statistical Organizations and/or Central Banks;
National Accounts data files, Organisation for Economic Co-operation and Development (OECD);
Staff estimates, World Bank (WB)",1980,2024,45,Economy & Growth
NY.GDP.PCAP.KD,SE,GDP per capita (constant 2015 US$),2,World Development Indicators,"Gross domestic product is the total income earned through the production of goods and services in an economic territory during an accounting period. It can be measured in three different ways: using either the expenditure approach, the income approach, or the production approach. The core indicator has been divided by the general population to achieve a per capita estimate.This indicator is expressed in constant prices, meaning the series has been adjusted to account for price changes over time. The reference year for this adjustment is 2015. This indicator is expressed in United States dollars.","Country official statistics, National Statistical Organizations and/or Central Banks;
National Accounts data files, Organisation for Economic Co-operation and Development (OECD);
Staff estimates, World Bank (WB)",1960,2024,65,Economy & Growth
GC.AST.TOTL.CN,GB,Net acquisition of financial assets (current LCU),2,World Development Indicators,"Net acquisition of government financial assets includes domestic and foreign financial claims, SDRs, and gold bullion held by monetary authorities as a reserve asset. The net acquisition of financial assets should be offset by the net incurrence of liabilities. This indicator is expressed in current prices, meaning no adjustment has been made to account for price changes over time. This series is expressed in local currency units.","Government Finance Statistics Yearbook and data files, International Monetary Fund (IMF)",1990,2024,35,Public Sector
IS.RRS.TOTL.KM,SE,Rail lines (total route-km),2,World Development Indicators,"The total length of rail line in the country operated for passenger transport, goods transport, or both.","Railisa Database, International Union of Railways (UIC), uri: https://uic-stats.uic.org/",1995,2021,27,Infrastructure
NE.EXP.GNFS.KN,US,Exports of goods and services (constant LCU),2,World Development Indicators,"Exports of goods includes changes in the economic ownership of goods from residents of the compiling economy to non-residents, irrespective of physical movement of goods across national borders. Exports of services includes services provided by residents to non-residents. This indicator is expressed in constant prices, meaning the series has been adjusted to account for price changes over time. The reference year for this adjustment varies by country. This series is expressed in local currency units.","Country official statistics, National Statistical Organizations and/or Central Banks;
National Accounts data files, Organisation for Economic Co-operation and Development (OECD);
Staff estimates, World Bank (WB)",1970,2024,55,Economy & Growth
NV.SRV.EMPL.KD,NO,"Services, value added per worker (constant 2015 US$)",2,World Development Indicators,"Services industries correspond to ISIC (Rev. 4) divisions 45-99 and includes wholesale and retail trade, repair of motor vehicles, hotels and retaurants, transport, storage and communication, financial intermediation, real estate, renting and business activities, public administration and defence, compulsory social security, education, health and social work, other community, social and personal service activities, private households with employed persons, and extra-territorial organizations and bodies. Value added is the contribution to the economy by a producer or an industry or an institutional sector, which is estimated by the total value of output produced and deducting the total value of intermediate consumption of goods and services used to produce that output. The core indicator has been divided by the number of workers in the economy to derive a measure of labor productivity. This indicator is expressed in constant prices, meaning the series has been adjusted to account for price changes over time. The reference year for this adjustment is 2015. This indicator is expressed in United States dollars.","World Development Indicators database, World Bank (WB);
ILOSTAT database, International Labour Organization (ILO)",1991,2023,33,Economy & Growth
NY.GDP.FCST.KD,US,Gross value added at basic prices (GVA) (constant 2015 US$),2,World Development Indicators,"Gross value added at basic prices reflects the price of products receivable by the producer exclusive of taxes payable on products and inclusive of subsidies receivable on products, less intermediate consumption valued at purchasers' prices. This indicator is expressed in constant prices, meaning the series has been adjusted to account for price changes over time. The reference year for this adjustment is 2015. This indicator is expressed in United States dollars.","Country official statistics, National Statistical Organizations and/or Central Banks;
National Accounts data files, Organisation for Economic Co-operation and Development (OECD);
Staff estimates, World Bank (WB)",2015,2015,1,Economy & Growth
NE.CON.PRVT.KD,GB,Households and NPISHs Final consumption expenditure (constant 2015 US$),2,World Development Indicators,"This field includes expenditure on goods and services by the Household and NPISH sector for the direct satisfaction of human needs or wants, whether individual or collective. This indicator is expressed in constant prices, meaning the series has been adjusted to account for price changes over time. The reference year for this adjustment is 2015. This indicator is expressed in United States dollars.","Country official statistics, National Statistical Organizations and/or Central Banks;
National Accounts data files, Organisation for Economic Co-operation and Development (OECD);
Staff estimates, World Bank (WB)",1970,2023,54,Economy & Growth
BN.GSR.FCTY.CD,NO,"Net primary income (BoP, current US$)",2,World Development Indicators,"Net primary income includes the net labor income and net property and entrepreneurial income components of the SNA. Labor income covers compensation of employees paid to nonresident workers. Property and entrepreneurial income covers investment income from the ownership of foreign financial claims (interest, dividends, rent, etc.) and nonfinancial property income (patents, copyrights, etc.). This indicator is expressed in current prices, meaning no adjustment has been made to account for price changes over time. This indicator is expressed in United States dollars.","Balance of Payments Statistics Yearbook and data files, International Monetary Fund (IMF)",1975,2024,50,Economy & Growth
BX.GSR.CMCP.ZS,NO,"Communications, computer, etc. (% of service exports, BoP)",2,World Development Indicators,"Communications, computer, information, and other services cover international telecommunications; computer data; news-related service transactions between residents and nonresidents; construction services; royalties and license fees; miscellaneous business, professional, and technical services; personal, cultural, and recreational services; manufacturing services on physical inputs owned by others; and maintenance and repair services and government services not included elsewhere. This indicator is expressed as a percentage of service exports which are services provided by residents to non-residents.","Balance of Payments Statistics Yearbook and data files, International Monetary Fund (IMF)",1975,2024,45,Economy & Growth;Trade
NY.GDP.FCST.CN,SE,Gross value added at basic prices (GVA) (current LCU),2,World Development Indicators,"Gross value added at basic prices reflects the price of products receivable by the producer exclusive of taxes payable on products and inclusive of subsidies receivable on products, less intermediate consumption valued at purchasers' prices. This indicator is expressed in current prices, meaning no adjustment has been made to account for price changes over time. This series is expressed in local currency units.","Country official statistics, National Statistical Organizations and/or Central Banks;
National Accounts data files, Organisation for Economic Co-operation and Development (OECD);
Staff estimates, World Bank (WB)",1970,2024,55,Economy & Growth
EN.GHG.CO2.ZG.AR5,SE,Carbon dioxide (CO2) emissions (total) excluding LULUCF (% change from 1990),2,World Development Indicators,"Change of emissions (as %) of current year with respect to emissions in baseline year 1990 emissions of carbon dioxide (CO2), one of the six Kyoto greenhouse gases (GHG), from the agriculture, energy, waste, and industrial sectors, excluding LULUCF.. The measure is standardized to carbon dioxide equivalent values using the Global Warming Potential (GWP) factors of IPCC's 5th Assessment Report (AR5). Negative values indicate that the emission level for that year is lower than the emissions level in 1990.","EDGAR (Emissions Database for Global Atmospheric Research) Community GHG Database, Joint Research Centre (JRC) - European Commission, uri: https://edgar.jrc.ec.europa.eu/dataset_ghg2024, publisher: JRC European Commission, date published: 2024;
International Energy Agency (IEA), uri: https://edgar.jrc.ec.europa.eu/dataset_ghg2024, publisher: JRC European Commission, date published: 2024",1991,2024,34,Environment
RQ.NO.SRC,NO,Regulatory Quality: Number of Sources,2,World Development Indicators,"The Worldwide Governance Indicators (WGI) are a research dataset summarizing the views on the quality of governance provided by a large number of enterprise, citizen and expert survey respondents in industrial and developing countries. Governance consists of the traditions and institutions by which authority in a country is exercised. This includes the process by which governments are selected, monitored and replaced; the capacity of the government to effectively formulate and implement sound policies; and the respect of citizens and the state for the institutions that govern economic and social interactions among them.

Number of sources indicates the number of underlying data sources on which the aggregate estimate is based.

The WGI are based on a large number of different data sources, capturing the views and experiences of survey respondents and experts in the public and private sectors, as well as various NGOs. These data sources include: (a) surveys of households and firms (e.g. Afrobarometer surveys, Gallup World Poll, and Global Competitiveness Report survey), (b) NGOs (e.g. Global Integrity, Freedom House, Reporters Without Borders), (c) commercial business information providers (e.g. Economist Intelligence Unit, S&P Global, Political Risk Services), and (d) public sector organizations (e.g. CPIA assessments of World Bank and regional development banks). 

Regulatory Quality captures perceptions of the ability of the government to formulate and implement sound policies and regulations that permit and promote private sector development.","Worldwide Governance Indicators, World Bank (WB), uri: www.govindicators.org, note: The Worldwide Governance Indicators (WGI) are a product of the staff of the World Bank with external contributions.",1996,2023,50,Public Sector
SE.TER.CUAT.DO.MA.ZS,SE,"Educational attainment, Doctoral or equivalent, population 25+, male (%) (cumulative)",2,World Development Indicators,The percentage of population ages 25 and over that attained or completed Doctoral or equivalent.,"Data API, UN Educational, Scientific and Cultural Organization (UNESCO), uri: https://databrowser.uis.unesco.org/resources, note: The data are obtained through the UIS API.  Detailed documentation is available at: https://api.uis.unesco.org/api/public/documentation/, publisher: UNESCO Institute for Statistics (UIS), type: Bulk file (csv), date accessed: 2025-09-22, date published: 2025-09",2013,2023,11,Education;Gender
