id,title,sub_title,status,org,hangar_id,label,made_public_date,number_value,document_status_url_xml
GY0326,Alkolås för rattfylleri,"",hämtad_2,N,2372510,26,2010-10-25,26,https://data.riksdagen.se/dokument/GY0326/text
GP0376,Teracom AB - garanti och omstrukturering,"",hämtad_2,N,2355432,76,2001-12-03,76,https://data.riksdagen.se/dokument/GP0376/text
GU0368,"Tullkontroll av kontanta medel, m.m.","",hämtad_2,FI,2286550,68,2007-04-02,68,https://data.riksdagen.se/dokument/GU0368/text
H50326,Skjutvapen och explosiva varor - skärpta straff för de grova brotten,"",Klar,Justitiedepartementet,4775192,26,2017-10-11,26,https://data.riksdagen.se/dokument/H50326/text
H003162,Kommunalt mottagande av ensamkommande barn,"",hämtad_2,Ju,2861311,162,2013-06-04,162,https://data.riksdagen.se/dokument/H003162/text
GV031d14,"Budgetpropositionen för 2008 Utgiftsområde 9 Hälsovård, sjukvård och social omsorg ","",hämtad,"",2450908,1,2012-07-04,1,https://data.riksdagen.se/dokument/GV031d14/text
H30324,Gränsöverskridande informationsutbyte om trafiksäkerhetsrelaterade brott - genomförande av det nya CBE-direktivet,"",Klar,Justitiedepartementet,4388725,24,2015-10-06,24,https://data.riksdagen.se/dokument/H30324/text
GW03111,Personnummer och samordningsnummer,"",hämtad_2,FI,2284296,111,2009-01-01,111,https://data.riksdagen.se/dokument/GW03111/text
GP03167,"Ändringar i konkurrenslagen för effektivare kartellbekämpning, m.m.","",hämtad_2,N,2307939,167,2002-03-19,167,https://data.riksdagen.se/dokument/GP03167/text
GR0345,Stärkt konsumentskydd vid småhusbyggande,"",hämtad_2,JU,2288902,45,2004-03-16,45,https://data.riksdagen.se/dokument/GR0345/text
HC03108,Lagändringar till följd av ändringar i EU:s formskyddsförordning,"",Klar,Justitiedepartementet,5237915,108,2025-02-25,108,https://data.riksdagen.se/dokument/HC03108/text
GS0358,Ändringar i skogsvårdslagen,"",hämtad_2,N,2285170,58,2004-12-17,58,https://data.riksdagen.se/dokument/GS0358/text
H30381,Åtgärder mot missbruk av svenska pass,"",Klar,Justitiedepartementet,4430674,81,2016-01-12,81,https://data.riksdagen.se/dokument/H30381/text
HC03154,Partipolitiska lotterier,"",Klar,Finansdepartementet,5242112,154,2025-04-08,154,https://data.riksdagen.se/dokument/HC03154/text
H1033,Läsa för livet,"",hämtad_2,Ku,2878820,3,2013-09-26,3,https://data.riksdagen.se/dokument/H1033/text
GT0381,Redogörelse för verksamheten inom Europarådets ministerkommitté m.m. under 2005,"",hämtad_2,UD,2291510,81,2006-03-15,81,https://data.riksdagen.se/dokument/GT0381/text
H3031d10,"Budgetproposition 2016 Utgiftsområde 9: Hälsovård, sjukvård och social omsorg","",Klar,Finansdepartementet,4380726,1,2015-09-21,1,https://data.riksdagen.se/dokument/H3031d10/text
HC03165,Stärkt skydd för demokratin och domstolarnas oberoende,"",Klar,Justitiedepartementet,5244295,165,2025-04-28,165,https://data.riksdagen.se/dokument/HC03165/text
GW0397d2,Åtgärder för jobb och omställning,"",hämtad_2,FI,2451359,97,2009-01-01,97,https://data.riksdagen.se/dokument/GW0397d2/text
H503289,Riksrevisionens rapport om återkrav av bostadsbidrag,"",Hänvisad,Socialdepartementet,4993763,289,2018-08-28,289,https://data.riksdagen.se/dokument/H503289/text
GP03164,Socialförsäkringsförmåner vid institutionsvistelse på statens bekostnad,"",hämtad_2,S,2288899,164,2002-03-20,164,https://data.riksdagen.se/dokument/GP03164/text
GP0373,"Riksrevisionen - ändringar i regeringsformen Prop. 2001/02:73
","","",Justitiedepartementet,2225561,73,2001-12-06,73,https://data.riksdagen.se/dokument/GP0373/text
GO0332,Säkerhetskontroll i domstol Prop. 2000/01:32,"",digitaliserad,Justitiedepartementet,2286129,32,2001-01-01,32,https://data.riksdagen.se/dokument/GO0332/text
GT03154,Förnybar el med gröna certifikat,"",hämtad_2,M  t.o.m. 1 jan-07,2228613,154,2006-03-22,154,https://data.riksdagen.se/dokument/GT03154/text
H70326,Ändringar i lagstiftningen om sociala trygghetsförmåner efter det att Förenade kungariket har lämnat Europeiska unionen,"",Klar,Socialdepartementet,5043764,26,2019-10-15,26,https://data.riksdagen.se/dokument/H70326/text
GT03139,Nationell IT-strategi för vård och omsorg,"",hämtad_2,S,2312665,139,2006-03-20,139,https://data.riksdagen.se/dokument/GT03139/text
H00374,Förfalsknings- och sanningsbrotten,"",hämtad_2,Ju,2839656,74,2013-02-27,74,https://data.riksdagen.se/dokument/H00374/text
H30338,Anläggningsbesked för biodrivmedel,"",Klar,Miljö- och energidepartementet,4394029,38,2015-10-22,38,https://data.riksdagen.se/dokument/H30338/text
H40349,Förstärkt konkurrens på lika villkor i kontantbranschen,"",Klar,Finansdepartementet,4609953,49,2016-11-29,49,https://data.riksdagen.se/dokument/H40349/text
GW03117,Sammansättningsreglerna för Högsta domstolen och Regeringsrätten,"",hämtad_2,JU,2230205,117,2009-02-18,117,https://data.riksdagen.se/dokument/GW03117/text
GQ0356,Redovisning av könsfördelningen i företagsledningar,"",hämtad_2,JU,2284355,56,2003-03-12,56,https://data.riksdagen.se/dokument/GQ0356/text
H703110,Operativt militärt stöd mellan Sverige och Finland,"",Klar,Försvarsdepartementet,5057656,110,2020-03-11,110,https://data.riksdagen.se/dokument/H703110/text
GU031d33,Budgetpropositionen för 2007 Bilaga 3 Fördelningspolitisk redogörelse,"",hämtad,"",2451143,1,2012-07-04,1,https://data.riksdagen.se/dokument/GU031d33/text
GY0347,"En samlad strategi för alkohol-, narkotika-, dopnings- och tobakspolitiken","",hämtad_2,S,2423451,47,2011-01-10,47,https://data.riksdagen.se/dokument/GY0347/text
GZ03146,Skyddsåtgärder för trafikuppgifter lagrade för brottsbekämpande ändamål,"",hämtad_2,Ju,2788747,146,2012-05-09,146,https://data.riksdagen.se/dokument/GZ03146/text
GN0389,Lag om konsumentskydd vid distansavtal och hemförsäljningsavtal ,"",digitaliserad,Justitiedepartementet,2226948,89,2000-01-01,89,https://data.riksdagen.se/dokument/GN0389/text
HD036,En tydlig beslutsordning för deltagande i Natos samlade verksamhet för avskräckning och försvar,"",Klar,Försvarsdepartementet,5251739,6,2025-09-11,6,https://data.riksdagen.se/dokument/HD036/text
GS031d13,Budgetpropositionen för 2005 UTGIFTSOMRÅDE 12 ,Ekonomisk trygghet för familjer och barn,hämtad_2,FI,2450868,1,2012-04-13,1,https://data.riksdagen.se/dokument/GS031d13/text
GW031d23,Budgetpropositionen för 2009,UTGIFTSOMRÅDE 22:  Kommunikationer ,hämtad_2,FI,2451261,1,2008-09-22,1,https://data.riksdagen.se/dokument/GW031d23/text
GT035,Lantmäteriverksamheten,"",hämtad_2,M  t.o.m. 1 jan-07,2288006,5,2005-09-29,5,https://data.riksdagen.se/dokument/GT035/text
GZ031d18,Budgetpropositionen för 2012 Utgiftsområde 6,UO 06 Försvar och samhällets krisberedskap ,hämtad_2,FI,2728509,1,2011-09-20,1,https://data.riksdagen.se/dokument/GZ031d18/text
GW03224,Meddelande om kommande förslag om ändringar i rätten till avdrag i inkomstslaget näringsverksamhet för kapitalförluster på andelar i handelsbolag,"",hämtad_2,FI,2222411,224,2009-06-17,224,https://data.riksdagen.se/dokument/GW03224/text
GP0378,Europa-Medelhavsavtal mellan Europeiska gemenskaperna och deras medlemsstater och Egypten,"",hämtad_2,UD,2356406,78,2002-01-22,78,https://data.riksdagen.se/dokument/GP0378/text
H5039,Skolstart vid sex års ålder,"",Klar,Utbildningsdepartementet,4765024,9,2017-09-18,9,https://data.riksdagen.se/dokument/H5039/text
H0031d11,Budgetproposition för 2013 Utgiftsområde 1 Rikets styrelse ,"",hämtad,"",2804954,1,2012-09-20,1,https://data.riksdagen.se/dokument/H0031d11/text
H30365,Utlänningsdatalag,"",Klar,Justitiedepartementet,4418930,65,2015-12-07,65,https://data.riksdagen.se/dokument/H30365/text
H50384,Riksrevisionens rapport om karriärstegsreformen och lärarlönelyftet,"",Hänvisad,Utbildningsdepartementet,4786537,84,2018-01-23,84,https://data.riksdagen.se/dokument/H50384/text
H20377,Genomförande av brottsofferdirektivet,"",Klar,Justitiedepartementet,3576408,77,2015-03-16,77,https://data.riksdagen.se/dokument/H20377/text
H00366,Svenskt deltagande i Europeiska unionens marina insats (Operation Atalanta),"",hämtad_2,UD,2835030,66,2013-02-08,66,https://data.riksdagen.se/dokument/H00366/text
HD031d29,Budgetpropositionen för 2026 - Utgiftsområde 27 Avgiften till Europeiska unionen,"","","",5252811,1,,1,https://data.riksdagen.se/dokument/HD031d29/text
