embedded_id_indicator_id,embedded_id_country_id,indicator_name,source_id,source_value,source_note,source_organization,start_year,end_year,data_point,topics
RQ.STD.ERR,SE,Regulatory Quality: Standard Error,2,World Development Indicators,"The Worldwide Governance Indicators (WGI) are a research dataset summarizing the views on the quality of governance provided by a large number of enterprise, citizen and expert survey respondents in industrial and developing countries. Governance consists of the traditions and institutions by which authority in a country is exercised. This includes the process by which governments are selected, monitored and replaced; the capacity of the government to effectively formulate and implement sound policies; and the respect of citizens and the state for the institutions that govern economic and social interactions among them.

Standard error indicates the precision of the estimate of governance.  Larger values of the standard error indicate less precise estimates.  

A 90 percent confidence interval for the governance estimate is given by the estimate +/- 1.64 times the standard error.

Regulatory Quality captures perceptions of the ability of the government to formulate and implement sound policies and regulations that permit and promote private sector development.","Worldwide Governance Indicators, World Bank (WB), uri: www.govindicators.org, note: The Worldwide Governance Indicators (WGI) are a product of the staff of the World Bank with external contributions.",1996,2023,50,Public Sector
BX.GSR.INSF.ZS,FI,"Insurance and financial services (% of service exports, BoP)",2,World Development Indicators,"Insurance and financial services cover various types of insurance provided to nonresidents by resident insurance enterprises and vice versa, and financial intermediary and auxiliary services (except those of insurance enterprises and pension funds) exchanged between residents and nonresidents. This indicator is expressed as a percentage of service exports which are services provided by residents to non-residents.","Balance of Payments Statistics Yearbook and data files, International Monetary Fund (IMF)",1975,2024,50,Economy & Growth;Private Sector;Trade
EG.ELC.RNWX.KH,DK,"Electricity production from renewable sources, excluding hydroelectric (kWh)",2,World Development Indicators,"Electricity production from renewable sources in kilowatt-hour (kWh), excluding hydroelectric, includes geothermal, solar, tides, wind, biomass, and biofuels.","IEA Energy Statistics Data Browser, International Energy Agency (IEA), uri: https://www.iea.org/data-and-statistics/data-tools/energy-statistics-data-browser, publisher: International Energy Agency (IEA), date accessed: 2025-03-25",1990,2021,32,Climate Change;Energy & Mining;Environment
GC.XPN.COMP.ZS,SE,Compensation of employees (% of expense),2,World Development Indicators,"Compensation of employees is defined as the total remuneration, in cash or in kind, payable by an enterprise to an employee in return for work done by the latter during the accounting period. This indicator is expressed as percentage of total expenses which is any decrease in net worth resulting from a transaction.","Government Finance Statistics Yearbook and data files, International Monetary Fund (IMF)",1972,2022,51,Public Sector
EN.CLC.DRSK.XQ,SE,Disaster risk reduction progress score (1-5 scale; 5=best),2,World Development Indicators,"Disaster risk reduction progress score is an average of self-assessment scores, ranging from 1 to 5, submitted by countries under Priority 1 of the Hyogo Framework National Progress Reports. The Hyogo Framework is a global blueprint for disaster risk reduction efforts that was adopted by 168 countries in 2005. Assessments of ""Priority 1"" include four indicators that reflect the degree to which countries have prioritized disaster risk reduction and the strengthening of relevant institutions.","2009-2011 Progress Reports, UN Office for Disaster Risk Reduction (UNDRR), uri: http://www.preventionweb.net/english/hyogo",2011,2011,1,Climate Change;Environment
IP.IDS.RSCT,NO,"Industrial design applications, resident, by count",2,World Development Indicators,"Industrial design applications are applications to register an industrial design with a national or regional Intellectual Property (IP) offices and designations received by relevant offices through the Hague System.  A resident application refers to an application filed with the IP office of, or acting for, the state or jurisdiction in which the first named applicant in the application is resident. Design count is used to render application data for industrial applications across offices comparable, as some offices follow a single-class/single-design filing system while other have a multiple class/design filing system.","Statistics Database, World Intellectual Property Organization (WIPO), uri: www.wipo.int/ipstats/, note: The International Bureau of WIPO assumes no responsibility with respect to the transformation of these data.",2014,2021,8,Infrastructure
ER.H2O.FWAG.ZS,DK,"Annual freshwater withdrawals, agriculture (% of total freshwater withdrawal)",2,World Development Indicators,"Annual freshwater withdrawals refer to total water withdrawals, not counting evaporation losses from storage basins. Withdrawals also include water from desalination plants in countries where they are a significant source. Withdrawals can exceed 100 percent of total renewable resources where extraction from nonrenewable aquifers or desalination plants is considerable or where there is significant water reuse. Withdrawals for agriculture are total withdrawals for irrigation and livestock production. Data are for the most recent year available for 1987-2002.","AQUASTAT - FAO's Global Information System on Water and Agriculture, Food and Agriculture Organization of the United Nations (FAO), uri: https://data.apps.fao.org/aquastat/, publisher: Food and Agriculture Organization of the United Nations (FAO), date accessed: 20240529",1970,2022,53,Agriculture & Rural Development;Environment;Infrastructure
SE.SEC.TCHR,NO,"Secondary education, teachers",2,World Development Indicators,"Secondary education, teachers refers to the total number of teachers at secondary level, including full-time and part-time teachers.","Data API, UN Educational, Scientific and Cultural Organization (UNESCO), uri: https://databrowser.uis.unesco.org/resources, note: The data are obtained through the UIS API.  Detailed documentation is available at: https://api.uis.unesco.org/api/public/documentation/, publisher: UNESCO Institute for Statistics (UIS), type: Bulk file (csv), date accessed: 2025-09-22, date published: 2025-09",1971,2023,13,Education
RL.PER.RNK.LOWER,NO,"Rule of Law: Percentile Rank, Lower Bound of 90% Confidence Interval",2,World Development Indicators,"The Worldwide Governance Indicators (WGI) are a research dataset summarizing the views on the quality of governance provided by a large number of enterprise, citizen and expert survey respondents in industrial and developing countries. Governance consists of the traditions and institutions by which authority in a country is exercised. This includes the process by which governments are selected, monitored and replaced; the capacity of the government to effectively formulate and implement sound policies; and the respect of citizens and the state for the institutions that govern economic and social interactions among them.

Rule of Law captures perceptions of the extent to which agents have confidence in and abide by the rules of society, and in particular the quality of contract enforcement, property rights, the police, and the courts, as well as the likelihood of crime and violence. 

Percentile rank indicates the country's rank among all countries covered by the aggregate indicator, with 0 corresponding to lowest rank, and 100 to highest rank.  Percentile ranks have been adjusted to correct for changes over time in the composition of the countries covered by the WGI.  

Percentile Rank Lower refers to lower bound of 90 percent confidence interval for governance, expressed in percentile rank terms.","Worldwide Governance Indicators, World Bank (WB), uri: www.govindicators.org, note: The Worldwide Governance Indicators (WGI) are a product of the staff of the World Bank with external contributions.",1996,2023,50,Public Sector
NY.ADJ.NNTY.PC.CD,FI,Adjusted net national income per capita (current US$),2,World Development Indicators,"Adjusted net national income is GNI minus consumption of fixed capital and natural resources depletion. This indicator is expressed in current prices, meaning no adjustment has been made to account for price changes over time.  This indicator is expressed in United States dollars.","Staff estimates, World Bank (WB);
The Changing Wealth of Nations: Measuring Sustainable Development in the New Millennium, World Bank (WB)",1970,2021,52,Economy & Growth
SE.PRM.ENRR.MA,US,"School enrollment, primary, male (% gross)",2,World Development Indicators,"Gross enrollment ratio is the ratio of total enrollment, regardless of age, to the population of the age group that officially corresponds to the level of education shown. Primary education provides children with basic reading, writing, and mathematics skills along with an elementary understanding of such subjects as history, geography, natural science, social science, art, and music.","Data API, UN Educational, Scientific and Cultural Organization (UNESCO), uri: https://databrowser.uis.unesco.org/resources, note: The data are obtained through the UIS API.  Detailed documentation is available at: https://api.uis.unesco.org/api/public/documentation/, publisher: UNESCO Institute for Statistics (UIS), type: Bulk file (csv), date accessed: 2025-09-22, date published: 2025-09",2005,2022,11,Education;Gender
BX.GSR.INSF.ZS,SE,"Insurance and financial services (% of service exports, BoP)",2,World Development Indicators,"Insurance and financial services cover various types of insurance provided to nonresidents by resident insurance enterprises and vice versa, and financial intermediary and auxiliary services (except those of insurance enterprises and pension funds) exchanged between residents and nonresidents. This indicator is expressed as a percentage of service exports which are services provided by residents to non-residents.","Balance of Payments Statistics Yearbook and data files, International Monetary Fund (IMF)",1970,2024,55,Economy & Growth;Private Sector;Trade
NY.ADJ.DCO2.CD,US,Adjusted savings: carbon dioxide damage (current US$),2,World Development Indicators,"Cost of damage due to carbon dioxide emissions from fossil fuel use and the manufacture of cement, estimated to be US$40 per ton of CO2 (the unit damage in 2017 US dollars for CO2 emitted in 2020) times the number of tons of CO2 emitted. This indicator is expressed in current prices, meaning no adjustment has been made to account for price changes over time.  This indicator is expressed in United States dollars.","Staff estimates, World Bank (WB);
The Changing Wealth of Nations: Measuring Sustainable Development in the New Millennium, World Bank (WB)",1990,2021,32,Economy & Growth;Environment
FD.AST.PRVT.GD.ZS,GB,Domestic credit to private sector by banks (% of GDP),2,World Development Indicators,"Domestic credit to private sector by banks refers to financial resources provided to the private sector by other depository corporations (deposit taking corporations except central banks), such as through loans, purchases of nonequity securities, and trade credits and other accounts receivable, that establish a claim for repayment. For some countries these claims include credit to public enterprises. This indicator is expressed as a percentage of Gross Domestic Product (GDP) which is the total income earned through the production of goods and services in an economic territory during an accounting period.","International Financial Statistics database, International Monetary Fund (IMF);
World Development Indicators Database, World Bank (WB);
National Accounts data files, Organisation for Economic Co-operation and Development (OECD)",1960,2024,65,Financial Sector
SE.SEC.PRIV.ZS,SE,"School enrollment, secondary, private (% of total secondary)",2,World Development Indicators,"Private enrollment refers to pupils or students enrolled in institutions that are not operated by a public authority but controlled and managed, whether for profit or not, by a private body such as a nongovernmental organization, religious body, special interest group, foundation or business enterprise.","Data API, UN Educational, Scientific and Cultural Organization (UNESCO), uri: https://databrowser.uis.unesco.org/resources, note: The data are obtained through the UIS API.  Detailed documentation is available at: https://api.uis.unesco.org/api/public/documentation/, publisher: UNESCO Institute for Statistics (UIS), date accessed: 2025-09-22, date published: 2025-09",1999,2023,24,Education
IP.IDS.RSCT,SE,"Industrial design applications, resident, by count",2,World Development Indicators,"Industrial design applications are applications to register an industrial design with a national or regional Intellectual Property (IP) offices and designations received by relevant offices through the Hague System.  A resident application refers to an application filed with the IP office of, or acting for, the state or jurisdiction in which the first named applicant in the application is resident. Design count is used to render application data for industrial applications across offices comparable, as some offices follow a single-class/single-design filing system while other have a multiple class/design filing system.","Statistics Database, World Intellectual Property Organization (WIPO), uri: www.wipo.int/ipstats/, note: The International Bureau of WIPO assumes no responsibility with respect to the transformation of these data.",2009,2021,13,Infrastructure
SE.SEC.ENRL.VO,SE,"Secondary education, vocational pupils",2,World Development Indicators,"Secondary vocational pupils are the number of secondary students enrolled in technical and vocational education programs, including teacher training.","Stat Bulk Data Download Service, UN Educational, Scientific and Cultural Organization (UNESCO), uri: https://uis.unesco.org/bdds, publisher: UNESCO Institute for Statistics (UIS)",1971,2017,42,Education
NY.TRF.NCTR.CD,GB,Net secondary income (Net current transfers from abroad) (current US$),2,World Development Indicators,"Net secondary income (from abroad) comprises transfers of income between residents of the reporting country and the rest of the world that carry no provisions for repayment. Net secondary income is equal to the unrequited transfers of income from nonresidents to residents minus the unrequited transfers from residents to nonresidents. This indicator is expressed in current prices, meaning no adjustment has been made to account for price changes over time. This indicator is expressed in United States dollars.","Country official statistics, National Statistical Organizations and/or Central Banks;
National Accounts data files, Organisation for Economic Co-operation and Development (OECD);
Staff estimates, World Bank (WB)",1970,2024,55,Economy & Growth
EN.GHG.CO2.PI.MT.CE.AR5,FI,Carbon dioxide (CO2) emissions from Power Industry (Energy) (Mt CO2e),2,World Development Indicators,"A measure of annual emissions of carbon dioxide (CO2), one of the six Kyoto greenhouse gases (GHG), from electricity and heat generation (subsector of the energy sector) including IPCC 2006 code 1.A.1.a. The measure is standardized to carbon dioxide equivalent values using the Global Warming Potential (GWP) factors of IPCC's 5th Assessment Report (AR5).","EDGAR (Emissions Database for Global Atmospheric Research) Community GHG Database, Joint Research Centre (JRC) - European Commission, uri: https://edgar.jrc.ec.europa.eu/dataset_ghg2024, publisher: JRC European Commission, date published: 2024;
International Energy Agency (IEA), uri: https://edgar.jrc.ec.europa.eu/dataset_ghg2024, publisher: JRC European Commission, date published: 2024",1970,2024,55,Environment
BX.GSR.CCIS.ZS,DK,"ICT service exports (% of service exports, BoP)",2,World Development Indicators,Information and communication technology service exports include computer and communications services (telecommunications and postal and courier services) and information services (computer data and news-related service transactions).,"Balance of Payments Statistics Yearbook and data files, International Monetary Fund (IMF)",2005,2024,20,Economy & Growth;Infrastructure;Trade
NY.GNP.MKTP.CN,US,GNI (current LCU),2,World Development Indicators,"Gross national income is the total income earned by all residents within an economic territory during an accounting period. It is equal to gross domestic product plus earned income receivable from abroad minus earned income payable abroad. This indicator is expressed in current prices, meaning no adjustment has been made to account for price changes over time. This series is expressed in local currency units.","Country official statistics, National Statistical Organizations and/or Central Banks;
National Accounts data files, Organisation for Economic Co-operation and Development (OECD);
Staff estimates, World Bank (WB)",1960,2024,65,Economy & Growth
NV.IND.MANF.KD,FI,"Manufacturing, value added (constant 2015 US$)",2,World Development Indicators,"Manufacturing includes industries classified in ISIC (Rev. 3) major division C and is defined as the physical or chemical tranformation of materials or components into new products. Value added is the contribution to the economy by a producer or an industry or an institutional sector, which is estimated by the total value of output produced and deducting the total value of intermediate consumption of goods and services used to produce that output. This indicator is expressed in constant prices, meaning the series has been adjusted to account for price changes over time. The reference year for this adjustment is 2015. This indicator is expressed in United States dollars.","Country official statistics, National Statistical Organizations and/or Central Banks;
National Accounts data files, Organisation for Economic Co-operation and Development (OECD);
Staff estimates, World Bank (WB)",1975,2024,50,Economy & Growth
PV.EST,NO,Political Stability and Absence of Violence/Terrorism: Estimate,2,World Development Indicators,"The Worldwide Governance Indicators (WGI) are a research dataset summarizing the views on the quality of governance provided by a large number of enterprise, citizen and expert survey respondents in industrial and developing countries. Governance consists of the traditions and institutions by which authority in a country is exercised. This includes the process by which governments are selected, monitored and replaced; the capacity of the government to effectively formulate and implement sound policies; and the respect of citizens and the state for the institutions that govern economic and social interactions among them. The WGI measures six dimensions of governance: Voice and Accountability, Political Stability and Absence of Violence/Terrorism, Government Effectiveness, Regulatory Quality, Rule of Law, and Control of Corruption. 

Political Stability and Absence of Violence/Terrorism measures perceptions of the likelihood of political instability and/or politically-motivated violence, including terrorism. 

Estimate gives the country's score on the aggregate indicator, in units of a standard normal distribution, i.e. ranging from approximately -2.5 to 2.5.","Worldwide Governance Indicators, World Bank (WB), uri: www.govindicators.org",1996,2023,50,Public Sector
IC.TAX.GIFT.ZS,US,Firms expected to give gifts in meetings with tax officials (% of firms),2,World Development Indicators,Percentage of firms expected to give gifts or informal payments during meetings with tax officials.,"Enterprise Surveys, World Bank (WB), uri: https://www.enterprisesurveys.org/en/data",2024,2024,1,Private Sector
SE.SEC.PROG.FE.ZS,SE,"Progression to secondary school, female (%)",2,World Development Indicators,Progression to secondary school refers to the number of new entrants to the first grade of secondary school in a given year as a percentage of the number of students enrolled in the final grade of primary school in the previous year (minus the number of repeaters from the last grade of primary education in the given year).,"Stat Bulk Data Download Service, UN Educational, Scientific and Cultural Organization (UNESCO), uri: https://uis.unesco.org/bdds, publisher: UNESCO Institute for Statistics (UIS)",1999,2016,16,Education;Gender
EN.GHG.TOT.ZG.AR5,GB,Total greenhouse gas emissions excluding LULUCF (% change from 1990),2,World Development Indicators,"Change of emissions (as %) of current year with respect to emissions in baseline year 1990 emissions of the six greenhouse gases (GHG) covered by the Kyoto Protocol (carbon dioxide (CO2), methane (CH4), nitrous oxide (N2O), hydrofluorocarbons (HFCs), perfluorocarbons (PFCs), and sulphurhexafluoride (SF6)) from the energy, industry, waste, and agriculture sectors, standardized to carbon dioxide equivalent values. This measure excludes GHG fluxes caused by Land Use Change Land Use and Forestry (LULUCF), as these fluxes have larger uncertainties. The measure is standardized to carbon dioxide equivalent values using the Global Warming Potential (GWP) factors of IPCC's 5th Assessment Report (AR5) to combine different GHGs. Negative values indicate that the emission level for that year is lower than the emissions level in 1990.","EDGAR (Emissions Database for Global Atmospheric Research) Community GHG Database, Joint Research Centre (JRC) - European Commission, uri: https://edgar.jrc.ec.europa.eu/dataset_ghg2024, publisher: JRC European Commission, date published: 2024;
International Energy Agency (IEA), uri: https://edgar.jrc.ec.europa.eu/dataset_ghg2024, publisher: JRC European Commission, date published: 2024",1991,2024,34,Environment
EN.GHG.N2O.ZG.AR5,GB,Nitrous oxide (N2O) emissions (total) excluding LULUCF (% change from 1990),2,World Development Indicators,"Change of emissions (as %) of current year with respect to emissions in baseline year 1990 emissions of nitrous oxide (N2O), one of the six Kyoto greenhouse gases (GHG), from the agriculture, energy, waste, and industrial sectors, excluding LULUCF.. The measure is standardized to carbon dioxide equivalent values using the Global Warming Potential (GWP) factors of IPCC's 5th Assessment Report (AR5). Negative values indicate that the emission level for that year is lower than the emissions level in 1990.","EDGAR (Emissions Database for Global Atmospheric Research) Community GHG Database, Joint Research Centre (JRC) - European Commission, uri: https://edgar.jrc.ec.europa.eu/dataset_ghg2024, publisher: JRC European Commission, date published: 2024;
EDGAR (Emissions Database for Global Atmospheric Research) Community GHG Database, International Energy Agency (IEA), uri: https://edgar.jrc.ec.europa.eu/dataset_ghg2024, publisher: JRC European Commission, date published: 2024",1991,2024,34,Environment
IT.CEL.SETS.P2,NO,Mobile cellular subscriptions (per 100 people),2,World Development Indicators,"Mobile cellular telephone subscriptions are subscriptions to a public mobile telephone service that provide access to the PSTN using cellular technology. The indicator includes (and is split into) the number of postpaid subscriptions, and the number of active prepaid accounts (i.e. that have been used during the last three months). The indicator applies to all mobile cellular subscriptions that offer voice communications. It excludes subscriptions via data cards or USB modems, subscriptions to public mobile data services, private trunked mobile radio, telepoint, radio paging and telemetry services.","World Telecommunication/ICT Indicators Database, International Telecommunication Union (ITU)",1981,2022,42,Infrastructure
GC.TAX.TOTL.CN,FI,Tax revenue (current LCU),2,World Development Indicators,"Taxes are compulsory, unrequited payments, in cash or in kind, made by institutional


units to government units. This indicator is expressed in current prices, meaning no adjustment has been made to account for price changes over time. This series is expressed in local currency units.","Government Finance Statistics Yearbook and data files, International Monetary Fund (IMF)",1972,2023,52,Public Sector
NE.CON.PRVT.PC.KD.ZG,GB,Households and NPISHs Final consumption expenditure per capita growth (annual %),2,World Development Indicators,"This field includes expenditure on goods and services by the Household and NPISH sector for the direct satisfaction of human needs or wants, whether individual or collective. The core indicator has been divided by the general population to achieve a per capita estimate.This indicator denotes the percentage change over each previous year of the constant price (base year 2015) series in United States dollars.","Country official statistics, National Statistical Organizations and/or Central Banks;
National Accounts data files, Organisation for Economic Co-operation and Development (OECD);
Staff estimates, World Bank (WB)",1971,2023,53,Economy & Growth
