embedded_id_indicator_id,embedded_id_country_id,indicator_name,source_id,source_value,source_note,source_organization,start_year,end_year,data_point,topics
FM.AST.PRVT.GD.ZS,FI,Monetary Sector credit to private sector (% GDP),2,World Development Indicators,"Domestic credit to private sector refers to financial resources provided to the private sector, such as through loans, purchases of nonequity securities, and trade credits and other accounts receivable, that establish a claim for repayment. For some countries these claims include credit to public enterprises. This indicator is expressed as a percentage of Gross Domestic Product (GDP) which is the total income earned through the production of goods and services in an economic territory during an accounting period.","International Financial Statistics database, International Monetary Fund (IMF);
World Development Indicators Database, World Bank (WB);
National Accounts data files, Organisation for Economic Co-operation and Development (OECD)",2001,2024,24,Financial Sector
NY.GDP.FCST.KN,FI,Gross value added at basic prices (GVA) (constant LCU),2,World Development Indicators,"Gross value added at basic prices reflects the price of products receivable by the producer exclusive of taxes payable on products and inclusive of subsidies receivable on products, less intermediate consumption valued at purchasers' prices. This indicator is expressed in constant prices, meaning the series has been adjusted to account for price changes over time. The reference year for this adjustment varies by country. This series is expressed in local currency units.","Country official statistics, National Statistical Organizations and/or Central Banks;
National Accounts data files, Organisation for Economic Co-operation and Development (OECD);
Staff estimates, World Bank (WB)",1970,2024,55,Economy & Growth
SE.TER.ENRR.MA,NO,"School enrollment, tertiary, male (% gross)",2,World Development Indicators,"Gross enrollment ratio is the ratio of total enrollment, regardless of age, to the population of the age group that officially corresponds to the level of education shown. Tertiary education, whether or not to an advanced research qualification, normally requires, as a minimum condition of admission, the successful completion of education at the secondary level.","Data API, UN Educational, Scientific and Cultural Organization (UNESCO), uri: https://databrowser.uis.unesco.org/resources, note: The data are obtained through the UIS API.  Detailed documentation is available at: https://api.uis.unesco.org/api/public/documentation/, publisher: UNESCO Institute for Statistics (UIS), type: Bulk file (csv), date accessed: 2025-09-22, date published: 2025-09",2000,2023,24,Education;Gender
NV.AGR.TOTL.KD.ZG,GB,"Agriculture, forestry, and fishing, value added (annual % growth)",2,World Development Indicators,"Agriculture, forestry, and fishing corresponds to ISIC (Rev. 4) divisions 01-03 and includes the exploitation of vegetal and animal natural resources, comprising the activities of growing of crops, raising and breeding of animals, harvesting of timber and other plants, animals or animal products from a farm or their natural habitats.Value added is the contribution to the economy by a producer or an industry or an institutional sector, which is estimated by the total value of output produced and deducting the total value of intermediate consumption of goods and services used to produce that output. This indicator denotes the percentage change over each previous year of the constant price (base year 2015) series in United States dollars.","Country official statistics, National Statistical Organizations and/or Central Banks;
National Accounts data files, Organisation for Economic Co-operation and Development (OECD);
Staff estimates, World Bank (WB)",1991,2024,34,Economy & Growth
SE.PRM.NINT.FE.ZS,SE,"Net intake rate in grade 1, female (% of official school-age population)",2,World Development Indicators,"Net intake rate in grade 1 is the number of new entrants in the first grade of primary education who are of official primary school entrance age, expressed as a percentage of the population of the corresponding age.","Stat Bulk Data Download Service, UN Educational, Scientific and Cultural Organization (UNESCO), uri: https://uis.unesco.org/bdds, publisher: UNESCO Institute for Statistics (UIS)",2002,2015,12,Education;Gender
NE.CON.PRVT.PC.KD.ZG,SE,Households and NPISHs Final consumption expenditure per capita growth (annual %),2,World Development Indicators,"This field includes expenditure on goods and services by the Household and NPISH sector for the direct satisfaction of human needs or wants, whether individual or collective. The core indicator has been divided by the general population to achieve a per capita estimate.This indicator denotes the percentage change over each previous year of the constant price (base year 2015) series in United States dollars.","Country official statistics, National Statistical Organizations and/or Central Banks;
National Accounts data files, Organisation for Economic Co-operation and Development (OECD);
Staff estimates, World Bank (WB)",1961,2023,63,Economy & Growth
AG.PRD.CROP.XD,FI,Crop production index (2014-2016 = 100),2,World Development Indicators,"Crop production index shows agricultural production for each year relative to the base period 2014-2016. It includes all crops except fodder crops. Regional and income group aggregates for the FAO's production indexes are calculated from the underlying values in international dollars, normalized to the base period 2014-2016.","FAO electronic files and web site, Food and Agriculture Organization of the United Nations (FAO), publisher: Food and Agriculture Organization of the United Nations (FAO)",1961,2022,62,Agriculture & Rural Development
EG.GDP.PUSE.KO.PP.KD,SE,GDP per unit of energy use (constant 2021 PPP $ per kg of oil equivalent),2,World Development Indicators,GDP per unit of energy use is the PPP GDP per kilogram of oil equivalent of energy use. PPP GDP is gross domestic product converted to 2021 constant international dollars using purchasing power parity rates. An international dollar has the same purchasing power over GDP as a U.S. dollar has in the United States.,"IEA Energy Statistics Data Browser, International Energy Agency (IEA), uri: https://www.iea.org/data-and-statistics/data-tools/energy-statistics-data-browser, publisher: International Energy Agency (IEA), date accessed: 2025-03-25",1990,2023,34,Energy & Mining
AG.LND.AGRI.ZS,FI,Agricultural land (% of land area),2,World Development Indicators,"Agricultural land refers to the share of land area that is arable, under permanent crops, and under permanent pastures. Arable land includes land defined by the FAO as land under temporary crops (double-cropped areas are counted once), temporary meadows for mowing or for pasture, land under market or kitchen gardens, and land temporarily fallow. Land abandoned as a result of shifting cultivation is excluded. Land under permanent crops is land cultivated with crops that occupy the land for long periods and need not be replanted after each harvest, such as cocoa, coffee, and rubber. This category includes land under flowering shrubs, fruit trees, nut trees, and vines, but excludes land under trees grown for wood or timber. Permanent pasture is land used for five or more years for forage, including natural and cultivated crops.","FAO electronic files and web site, Food and Agriculture Organization of the United Nations (FAO), publisher: Food and Agriculture Organization of the United Nations (FAO)",1961,2023,63,Agriculture & Rural Development;Climate Change;Environment
IP.JRN.ARTC.SC,US,Scientific and technical journal articles,2,World Development Indicators,"Article counts refer to publications from a selection of conference proceedings and peer-reviewed journals from Scopus in science and engineering fields, according to the National Center for Science and Engineering Statistics Taxonomy of Disciplines.","Science and Engineering Indicators, National Science Foundation (NSF), uri: https://ncses.nsf.gov/indicators",1996,2022,27,Science & Technology
NY.TAX.NIND.CN,FI,Taxes less subsidies on products (current LCU),2,World Development Indicators,"Taxes less subsidies on production includes taxes payable less subsidies receivable on goods or services produced as outputs including other taxes or subsidies on production such as those payable on the labour, machinery, buildings or other assets used in production. This indicator is expressed in current prices, meaning no adjustment has been made to account for price changes over time. This series is expressed in local currency units.","Country official statistics, National Statistical Organizations and/or Central Banks;
National Accounts data files, Organisation for Economic Co-operation and Development (OECD);
Staff estimates, World Bank (WB)",1970,2024,55,Economy & Growth
AG.LND.TOTL.RU.K2,NO,Rural land area (sq. km),2,World Development Indicators,"Rural land area in square kilometers, derived from urban extent grids which distinguish urban and rural areas based on a combination of population counts (persons), settlement points, and the presence of Nighttime Lights. Areas are defined as urban where contiguous lighted cells from the Nighttime Lights or approximated urban extents based on buffered settlement points for which the total population is greater than 5,000 persons.","Low Elevation Coastal Zone (LECZ) Urban-Rural Population and Land Area Estimates, Version 2, Center For International Earth Science Information Network (CIESIN) - Columbia University, uri: https://www.earthdata.nasa.gov/data/catalog/sedac-ciesin-sedac-lecz-urplaev2-2.00, publisher: NASA Socioeconomic Data and Applications Center (SEDAC), date published: 2013",1990,2015,3,Agriculture & Rural Development;Environment
IS.AIR.DPRT,GB,"Air transport, registered carrier departures worldwide",2,World Development Indicators,Registered carrier departures worldwide are domestic takeoffs and takeoffs abroad of air carriers registered in the country.,"Civil Aviation Statistics of the World, International Civil Aviation Organization (ICAO), uri: https://data.icao.int/newdataplus/#:~:text=ICAO%20data%20is%20comprised%20of,information%20about%20commercial%20air%20carriers;
ICAO Staff estimates, International Civil Aviation Organization (ICAO), uri: https://data.icao.int/newdataplus/#:~:text=ICAO%20data%20is%20comprised%20of,information%20about%20commercial%20air%20carriers",1970,2023,54,Infrastructure
PA.NUS.ATLS,GB,DEC alternative conversion factor (LCU per US$),2,World Development Indicators,"The DEC alternative conversion factor is the underlying annual exchange rate (the price of one country’s currency in relation to another country's currency) used for the World Bank Atlas method. As a rule, it is the official exchange rate reported in the IMF's International Financial Statistics. Exceptions arise where further refinements are made by World Bank staff. It is expressed in local currency units per U.S. dollar.","International Financial Statistics database, International Monetary Fund (IMF);
Staff estimates, World Bank (WB)",1960,2024,65,Economy & Growth;Financial Sector
GE.PER.RNK,SE,Government Effectiveness: Percentile Rank,2,World Development Indicators,"The Worldwide Governance Indicators (WGI) are a research dataset summarizing the views on the quality of governance provided by a large number of enterprise, citizen and expert survey respondents in industrial and developing countries. Governance consists of the traditions and institutions by which authority in a country is exercised. This includes the process by which governments are selected, monitored and replaced; the capacity of the government to effectively formulate and implement sound policies; and the respect of citizens and the state for the institutions that govern economic and social interactions among them.

Government Effectiveness captures perceptions of the quality of public services, the quality of the civil service and the degree of its independence from political pressures, the quality of policy formulation and implementation, and the credibility of the government's commitment to such policies. 

Percentile rank indicates the country's rank among all countries covered by the aggregate indicator, with 0 corresponding to lowest rank, and 100 to highest rank.  Percentile ranks have been adjusted to correct for changes over time in the composition of the countries covered by the WGI.","Worldwide Governance Indicators, World Bank (WB), uri: www.govindicators.org, note: The Worldwide Governance Indicators (WGI) are a product of the staff of the World Bank with external contributions.",1996,2023,25,Public Sector
CM.MKT.TRAD.CD,DK,"Stocks traded, total value (current US$)",2,World Development Indicators,"The value of shares traded is the total number of shares traded, both domestic and foreign, multiplied by their respective matching prices. Figures are single counted (only one side of the transaction is considered). Companies admitted to listing and admitted to trading are included in the data. Data are end of year values converted to U.S. dollars using corresponding year-end foreign exchange rates.","World Federation of Exchanges database, World Federation of Exchanges (WFE)",1975,2004,30,Financial Sector
DC.ODA.TLDC.CD,US,"Net ODA provided, to the least developed countries (current US$)",2,World Development Indicators,"Net Official development assistance (ODA) comprises grants or loans to developing countries and territories on the OECD/DAC list of aid recipients that are undertaken by the official sector with promotion of economic development and welfare as the main objective and at concessional financial terms. The list of least developed countries (LDCs) has been agreed by the General Assembly, on the recommendation of the Committee for Development Policy, Economic and Social Council.","Development Assistance Committee, Organisation for Economic Co-operation and Development (OECD), uri: www.oecd.org/dac/stats/idsonline;
Geographical Distribution of Financial Flows to Developing Countries, Organisation for Economic Co-operation and Development (OECD), uri: www.oecd.org/dac/stats/idsonline;
Development Co-operation Report, Organisation for Economic Co-operation and Development (OECD), uri: www.oecd.org/dac/stats/idsonline;
International Development Statistics database, Organisation for Economic Co-operation and Development (OECD), uri: www.oecd.org/dac/stats/idsonline",1960,2023,64,Millenium development goals
AG.PRD.LVSK.XD,NO,Livestock production index (2014-2016 = 100),2,World Development Indicators,"Livestock production index includes meat and milk from all sources, dairy products such as cheese, and eggs, honey, raw silk, wool, and hides and skins.","FAO electronic files and web site, Food and Agriculture Organization of the United Nations (FAO), publisher: Food and Agriculture Organization of the United Nations (FAO)",1961,2022,62,Agriculture & Rural Development
SE.SEC.ENRR.FE,DK,"School enrollment, secondary, female (% gross)",2,World Development Indicators,"Gross enrollment ratio is the ratio of total enrollment, regardless of age, to the population of the age group that officially corresponds to the level of education shown. Secondary education completes the provision of basic education that began at the primary level, and aims at laying the foundations for lifelong learning and human development, by offering more subject- or skill-oriented instruction using more specialized teachers.","Data API, UN Educational, Scientific and Cultural Organization (UNESCO), uri: https://databrowser.uis.unesco.org/resources, note: The data are obtained through the UIS API.  Detailed documentation is available at: https://api.uis.unesco.org/api/public/documentation/, publisher: UNESCO Institute for Statistics (UIS), type: Bulk file (csv), date accessed: 2025-09-22, date published: 2025-09",2000,2023,24,Education;Gender
NE.RSB.GNFS.KN,SE,External balance on goods and services (constant LCU),2,World Development Indicators,"The balance of international trade in goods and services is the difference between the exports and imports of goods and services. This indicator is expressed in constant prices, meaning the series has been adjusted to account for price changes over time. The reference year for this adjustment varies by country. This series is expressed in local currency units.","Country official statistics, National Statistical Organizations and/or Central Banks;
National Accounts data files, Organisation for Economic Co-operation and Development (OECD);
Staff estimates, World Bank (WB)",1960,2024,65,Economy & Growth
NV.AGR.TOTL.CD,GB,"Agriculture, forestry, and fishing, value added (current US$)",2,World Development Indicators,"Agriculture, forestry, and fishing corresponds to ISIC (Rev. 4) divisions 01-03 and includes the exploitation of vegetal and animal natural resources, comprising the activities of growing of crops, raising and breeding of animals, harvesting of timber and other plants, animals or animal products from a farm or their natural habitats.Value added is the contribution to the economy by a producer or an industry or an institutional sector, which is estimated by the total value of output produced and deducting the total value of intermediate consumption of goods and services used to produce that output. This indicator is expressed in current prices, meaning no adjustment has been made to account for price changes over time. This indicator is expressed in United States dollars.","Country official statistics, National Statistical Organizations and/or Central Banks;
National Accounts data files, Organisation for Economic Co-operation and Development (OECD);
Staff estimates, World Bank (WB)",1990,2024,35,Agriculture & Rural Development;Economy & Growth
BM.GSR.INSF.ZS,GB,"Insurance and financial services (% of service imports, BoP)",2,World Development Indicators,"Insurance and financial services cover various types of insurance provided to nonresidents by resident insurance enterprises and vice versa, and financial intermediary and auxiliary services (except those of insurance enterprises and pension funds) exchanged between residents and nonresidents. This indicator is expressed as a percentage of service imports which are services provided by non-residents to residents.","Balance of Payments Statistics Yearbook and data files, International Monetary Fund (IMF)",1986,2024,39,Economy & Growth;Private Sector;Trade
IC.FRM.METG.ZS,FI,Firms visited or required meetings with tax officials (% of firms),2,World Development Indicators,Percentage of firms that were visited or inspected by tax officials or were required to meet with them over the last year.,"Enterprise Surveys, World Bank (WB), uri: https://www.enterprisesurveys.org/en/data",2020,2020,1,Private Sector
BX.PEF.TOTL.CD.WD,DK,"Portfolio equity, net inflows (BoP, current US$)",2,World Development Indicators,"Portfolio equity includes net inflows from equity securities other than those recorded as direct investment and including shares, stocks, depository receipts (American or global), and direct purchases of shares in local stock markets by foreign investors. Data are in current U.S. dollars.","Balance of Payments database, International Monetary Fund (IMF);
International Debt Statistics, World Bank (WB)",1977,2024,30,Economy & Growth;External Debt;Financial Sector
EN.GHG.CH4.BU.MT.CE.AR5,US,Methane (CH4) emissions from Building (Energy) (Mt CO2e),2,World Development Indicators,"A measure of annual emissions of methane (CH4), one of the six Kyoto greenhouse gases (GHG), from the building sector (subsector of the energy sector) including IPCC 2006 codes 1.A.4 Residential and other sectors, 1.A.5 Non-Specified. The measure is standardized to carbon dioxide equivalent values using the Global Warming Potential (GWP) factors of IPCC's 5th Assessment Report (AR5).","EDGAR (Emissions Database for Global Atmospheric Research) Community GHG Database, Joint Research Centre (JRC) - European Commission, uri: https://edgar.jrc.ec.europa.eu/dataset_ghg2024, publisher: JRC European Commission, date published: 2024;
International Energy Agency (IEA), uri: https://edgar.jrc.ec.europa.eu/dataset_ghg2024, publisher: JRC European Commission, date published: 2024",1970,2024,55,Environment
GC.TAX.GSRV.CN,GB,Taxes on goods and services (current LCU),2,World Development Indicators,"General taxes on goods and services are taxes levied on the production, leasing, delivery, sale, purchase or other change of ownership of a wide range of goods and the provision of a wide range of services. This indicator is expressed in current prices, meaning no adjustment has been made to account for price changes over time. This series is expressed in local currency units.","Government Finance Statistics Yearbook and data files, International Monetary Fund (IMF)",1972,2024,53,Public Sector
NE.CON.TOTL.KD.ZG,SE,Final consumption expenditure (annual % growth),2,World Development Indicators,"Final consumption expenditure is expenditure on goods and services by resident institutional units for the direct satisfaction of human needs or wants, whether individual or collective. Final consumption expenditure can be measured for households, general government, the central bank and non-profit institutions serving households. This indicator denotes the percentage change over each previous year of the constant price (base year 2015) series in United States dollars.","Country official statistics, National Statistical Organizations and/or Central Banks;
National Accounts data files, Organisation for Economic Co-operation and Development (OECD);
Staff estimates, World Bank (WB)",1971,2024,54,Economy & Growth
NY.ADJ.DKAP.GN.ZS,SE,Adjusted savings: consumption of fixed capital (% of GNI),2,World Development Indicators,Consumption of fixed capital represents the replacement value of capital used up in the process of production. This indicator is expressed as a percentage of Gross National Income (GNI) which is the total income earned by all residents within an economic territory during an accounting period. It is equal to gross domestic product plus earned income receivable from abroad minus earned income payable abroad.,"Staff estimates, World Bank (WB);
National Accounts Statistics, United Nations (UN), publisher: UN Statistics Division",1970,2021,52,Economy & Growth;Environment
EG.USE.COMM.GD.PP.KD,GB,"Energy use (kg of oil equivalent) per $1,000 GDP (constant 2021 PPP)",2,World Development Indicators,"Energy use per PPP GDP is the kilogram of oil equivalent of energy use per constant PPP GDP. Energy use refers to use of primary energy before transformation to other end-use fuels, which is equal to indigenous production plus imports and stock changes, minus exports and fuels supplied to ships and aircraft engaged in international transport. PPP GDP is gross domestic product converted to 2021 constant international dollars using purchasing power parity rates. An international dollar has the same purchasing power over GDP as a U.S. dollar has in the United States.","IEA Energy Statistics Data Browser, International Energy Agency (IEA), uri: https://www.iea.org/data-and-statistics/data-tools/energy-statistics-data-browser, publisher: International Energy Agency (IEA), date accessed: 2025-03-25",1990,2023,34,Climate Change;Energy & Mining
SE.PRM.NINT.MA.ZS,SE,"Net intake rate in grade 1, male (% of official school-age population)",2,World Development Indicators,"Net intake rate in grade 1 is the number of new entrants in the first grade of primary education who are of official primary school entrance age, expressed as a percentage of the population of the corresponding age.","Stat Bulk Data Download Service, UN Educational, Scientific and Cultural Organization (UNESCO), uri: https://uis.unesco.org/bdds, publisher: UNESCO Institute for Statistics (UIS)",2002,2015,12,Education;Gender
IC.BUS.NREG,NO,New businesses registered (number),2,World Development Indicators,New businesses registered are the number of new limited liability corporations (or its equivalent) registered in the calendar year.,"Entrepreneurship Database, World Bank (WB), uri: https://www.worldbank.org/en/programs/entrepreneurship",2006,2022,17,Private Sector
EG.ELC.FOSL.ZS,NO,"Electricity production from oil, gas and coal sources (% of total)",2,World Development Indicators,"The share of electricity production from oil. gas and coal sources of total electricity production. Sources of electricity refer to the inputs used to generate electricity. Oil refers to crude oil and petroleum products. Gas refers to natural gas but excludes natural gas liquids. Coal refers to all coal and brown coal, both primary (including hard coal and lignite-brown coal) and derived fuels (including patent fuel, coke oven coke, gas coke, coke oven gas, and blast furnace gas). Peat is also included in this category.","IEA Energy Statistics Data Browser, International Energy Agency (IEA), uri: https://www.iea.org/data-and-statistics/data-tools/energy-statistics-data-browser, publisher: International Energy Agency (IEA), date accessed: 2025-03-25",1990,2023,34,Energy & Mining;Environment
