embedded_id_indicator_id,embedded_id_country_id,indicator_name,source_id,source_value,source_note,source_organization,start_year,end_year,data_point,topics
SE.PRM.UNER.MA.ZS,DK,"Children out of school, male (% of male primary school age)",2,World Development Indicators,Children out of school are the percentage of primary-school-age children who are not enrolled in primary or secondary school. Children in the official primary age group that are in preprimary education should be considered out of school.,"Data API, UN Educational, Scientific and Cultural Organization (UNESCO), uri: https://databrowser.uis.unesco.org/resources, note: The data are obtained through the UIS API.  Detailed documentation is available at: https://api.uis.unesco.org/api/public/documentation/, publisher: UNESCO Institute for Statistics (UIS), type: Bulk file (csv), date accessed: 2025-09-22, date published: 2025-09",2000,2023,22,Education
IS.RRS.PASG.KM,GB,"Railways, passengers carried (million passenger-km)",2,World Development Indicators,Passengers carried by railway are the number of passengers transported by rail multiplied by kilometers traveled.,"Railisa Database (UIC), International Union of Railways (UIC), uri: https://uic-stats.uic.org/select/;
OECD Statistics, Organisation for Economic Co-operation and Development (OECD)",1995,2020,26,Infrastructure
SE.SEC.CUAT.UP.FE.ZS,DK,"Educational attainment, at least completed upper secondary, population 25+, female (%) (cumulative)",2,World Development Indicators,The percentage of population ages 25 and over that attained or completed upper secondary education.,"Data API, UN Educational, Scientific and Cultural Organization (UNESCO), uri: https://databrowser.uis.unesco.org/resources, note: The data are obtained through the UIS API.  Detailed documentation is available at: https://api.uis.unesco.org/api/public/documentation/, publisher: UNESCO Institute for Statistics (UIS), type: Bulk file (csv), date accessed: 2025-09-22, date published: 2025-09",1991,2023,26,Education;Gender
GC.TAX.YPKG.CN,NO,"Taxes on income, profits and capital gains (current LCU)",2,World Development Indicators,"Taxes on income, profits, and capital gains are taxes payable on the actual or presumed incomes, profits and capital gains. This indicator is expressed in current prices, meaning no adjustment has been made to account for price changes over time. This series is expressed in local currency units.","Government Finance Statistics Yearbook and data files, International Monetary Fund (IMF)",1972,2023,52,Public Sector
SE.PRM.ENRR.MA,SE,"School enrollment, primary, male (% gross)",2,World Development Indicators,"Gross enrollment ratio is the ratio of total enrollment, regardless of age, to the population of the age group that officially corresponds to the level of education shown. Primary education provides children with basic reading, writing, and mathematics skills along with an elementary understanding of such subjects as history, geography, natural science, social science, art, and music.","Data API, UN Educational, Scientific and Cultural Organization (UNESCO), uri: https://databrowser.uis.unesco.org/resources, note: The data are obtained through the UIS API.  Detailed documentation is available at: https://api.uis.unesco.org/api/public/documentation/, publisher: UNESCO Institute for Statistics (UIS), type: Bulk file (csv), date accessed: 2025-09-22, date published: 2025-09",2000,2023,24,Education;Gender
SE.SEC.TCAQ.UP.MA.ZS,US,"Trained teachers in upper secondary education, male (% of male teachers)",2,World Development Indicators,Trained teachers in upper secondary education are the percentage of upper secondary school teachers who have received the minimum organized teacher training (pre-service or in-service) required for teaching in a given country.,"Data API, UN Educational, Scientific and Cultural Organization (UNESCO), uri: https://databrowser.uis.unesco.org/resources, note: The data are obtained through the UIS API.  Detailed documentation is available at: https://api.uis.unesco.org/api/public/documentation/, publisher: UNESCO Institute for Statistics (UIS), type: Bulk file, date accessed: 2025-09-22, date published: 2025-09",2014,2023,10,Education
SE.SEC.ENRL.TC.ZS,US,"Pupil-teacher ratio, secondary",2,World Development Indicators,Secondary school pupil-teacher ratio is the average number of pupils per teacher in secondary school.,"Stat Bulk Data Download Service, UN Educational, Scientific and Cultural Organization (UNESCO), uri: https://uis.unesco.org/bdds, publisher: UNESCO Institute for Statistics (UIS)",2014,2017,3,Education
GC.TAX.IMPT.ZS,SE,Customs and other import duties (% of tax revenue),2,World Development Indicators,"Taxes and duties on imports are taxes on goods and services that become payable at the moment when goods enter the economic territory or when services are delivered by non-resident producers to residents. This indicator is expressed as a percentage of tax revenue which includes compulsory, unrequited payments, in cash or in kind, made by institutional units to government units.","Government Finance Statistics Yearbook and data files, International Monetary Fund (IMF)",1972,1994,23,Public Sector;Trade
EN.GHG.FGAS.IP.MT.CE.AR5,NO,F-gases emissions from Industrial Processes (Mt CO2e),2,World Development Indicators,"A measure of annual emissions of fluorinated gases (hydrofluorocarbons (HFCs), perfluorocarbons (PFCs), and sulphurhexafluoride (SF6)), from industrial processes including IPCC 2006 codes 2.B Chemical Industry, 2.C Metal Industry, 2.E Electronics Industry, 2.F Product Uses as Substitutes for Ozone Depleting Substances, 2.G Other Product Manufacture and Use The measure is standardized to carbon dioxide equivalent values using the Global Warming Potential (GWP) factors of IPCC's 5th Assessment Report (AR5).","EDGAR (Emissions Database for Global Atmospheric Research) Community GHG Database, Joint Research Centre (JRC) - European Commission, uri: https://edgar.jrc.ec.europa.eu/dataset_ghg2024, publisher: JRC European Commission, date published: 2024;
International Energy Agency (IEA), uri: https://edgar.jrc.ec.europa.eu/dataset_ghg2024, publisher: JRC European Commission, date published: 2024",1990,2024,35,Environment
GE.PER.RNK.UPPER,GB,"Government Effectiveness: Percentile Rank, Upper Bound of 90% Confidence Interval",2,World Development Indicators,"Good governance is essential for development. It helps countries improve economic growth, build human capital, and strengthen social cohesion. Empirical evidence shows a strong causal relationship between better governance and better development outcomes. The Worldwide Governance Indicators (WGI) are designed to help researchers and analysts assess broad patterns in perceptions of governance across countries and over time. The WGI cover over 200 countries and territories, measuring six dimensions of governance starting in 1996: Voice and Accountability, Political Stability and Absence of Violence/Terrorism, Government Effectiveness, Regulatory Quality, Rule of Law, and Control of Corruption. The aggregate indicators are based on several hundred individual underlying variables, taken from a wide variety of existing data sources. The data reflect the views on governance of survey respondents and public, private, and NGO sector experts worldwide

Government Effectiveness captures perceptions of the quality of public services, the quality of the civil service and the degree of its independence from political pressures, the quality of policy formulation and implementation, and the credibility of the government's commitment to such policies. 

Percentile rank indicates the country's rank among all countries covered by the aggregate indicator, with 0 corresponding to lowest rank, and 100 to highest rank.  Percentile ranks have been adjusted to correct for changes over time in the composition of the countries covered by the WGI.  

Percentile Rank Upper refers to upper bound of 90 percent confidence interval for governance, expressed in percentile rank terms.","Worldwide Governance Indicators, World Bank (WB), uri: www.govindicators.org, note: The Worldwide Governance Indicators (WGI) are a product of the staff of the World Bank with external contributions.",1996,2023,25,Public Sector
SE.PRM.CUAT.ZS,US,"Educational attainment, at least completed primary, population 25+ years, total (%) (cumulative)",2,World Development Indicators,The percentage of population ages 25 and over that attained or completed primary education.,"Data API, UN Educational, Scientific and Cultural Organization (UNESCO), uri: https://databrowser.uis.unesco.org/resources, note: The data are obtained through the UIS API.  Detailed documentation is available at: https://api.uis.unesco.org/api/public/documentation/, publisher: UNESCO Institute for Statistics (UIS), type: Bulk file (csv), date accessed: 2025-09-22, date published: 2025-09",1970,2024,32,Education;Gender
SE.SEC.NENR,US,"School enrollment, secondary (% net)",2,World Development Indicators,"Net enrollment rate is the ratio of children of official school age who are enrolled in school to the population of the corresponding official school age. Secondary education completes the provision of basic education that began at the primary level, and aims at laying the foundations for lifelong learning and human development, by offering more subject- or skill-oriented instruction using more specialized teachers.","Stat Bulk Data Download Service, UN Educational, Scientific and Cultural Organization (UNESCO), uri: https://uis.unesco.org/bdds, publisher: UNESCO Institute for Statistics (UIS)",2005,2017,9,Education
NE.CON.GOVT.KD,GB,General government final consumption expenditure (constant 2015 US$),2,World Development Indicators,"Final consumption expenditure is expenditure on goods and services by resident institutional units for the direct satisfaction of human needs or wants, whether individual or collective. General government FCE includes all government current expenditures for purchases of goods and services (including compensation of employees), and most expenditures on national defense and security, but excludes government military expenditures that are part of government capital formation. This indicator is expressed in constant prices, meaning the series has been adjusted to account for price changes over time. The reference year for this adjustment is 2015. This indicator is expressed in United States dollars.","Country official statistics, National Statistical Organizations and/or Central Banks;
National Accounts data files, Organisation for Economic Co-operation and Development (OECD);
Staff estimates, World Bank (WB)",1970,2023,54,Economy & Growth
BX.KLT.DINV.CD.WD,DK,"Foreign direct investment, net inflows (BoP, current US$)",2,World Development Indicators,"Foreign direct investment refers to direct investment equity flows in the reporting economy. It is the sum of equity capital, reinvestment of earnings, and other capital. Direct investment is a category of cross-border investment associated with a resident in one economy having control or a significant degree of influence on the management of an enterprise that is resident in another economy. Ownership of 10 percent or more of the ordinary shares of voting stock is the criterion for determining the existence of a direct investment relationship. Data are in current U.S. dollars.","Balance of Payments database, International Monetary Fund (IMF), note: International Monetary Fund, Balance of Payments database, supplemented by data from the United Nations Conference on Trade and Development and official national sources.;
UN Conference on Trade and Development (UNCTAD);
Official national sources",1970,2024,55,Economy & Growth;External Debt;Financial Sector
EG.CFT.ACCS.RU.ZS,US,"Access to clean fuels and technologies for cooking, rural (% of rural population)",2,World Development Indicators,"Access to clean fuels and technologies for cooking, rural is the proportion of rural population primarily using clean cooking fuels and technologies for cooking. Under WHO guidelines, kerosene is excluded from clean cooking fuels.","Tracking SDG 7: The Energy Progress Report, International Energy Agency (IEA), note: License: Creative Commons Attribution—NonCommercial 3.0 IGO (CC BY-NC 3.0 IGO);
International Renewable Energy Agency (IRENA), note: Tracking SDG 7: The Energy Progress Report;
United Nations (UN), note: Tracking SDG 7: The Energy Progress Report, publisher: UN Statistics Division;
World Bank (WB), note: Tracking SDG 7: The Energy Progress Report;
World Health Organization (WHO), note: Tracking SDG 7: The Energy Progress Report",2000,2023,24,Environment
DC.ODA.TOTL.KD,SE,"Net ODA provided, total (constant 2023 US$)",2,World Development Indicators,Net Official development assistance (ODA) comprises grants or loans to developing countries and territories on the OECD/DAC list of aid recipients that are undertaken by the official sector with promotion of economic development and welfare as the main objective and at concessional financial terms. Data are in constant 2023 U.S. dollars.,"Development Assistance Committee, Organisation for Economic Co-operation and Development (OECD), uri: www.oecd.org/dac/stats/idsonline;
Geographical Distribution of Financial Flows to Developing Countries, Organisation for Economic Co-operation and Development (OECD), uri: www.oecd.org/dac/stats/idsonline;
Development Co-operation Report, Organisation for Economic Co-operation and Development (OECD), uri: www.oecd.org/dac/stats/idsonline;
International Development Statistics database, Organisation for Economic Co-operation and Development (OECD), uri: www.oecd.org/dac/stats/idsonline",1960,2024,65,Millenium development goals
NV.MNF.CHEM.ZS.UN,SE,Chemicals (% of value added in manufacturing),2,World Development Indicators,"Manufacturing of chemicals and chemical prodcuts includes industries classified in ISIC (Rev. 3) division 24. Value added is the contribution to the economy by a producer or an industry or an institutional sector, which is estimated by the total value of output produced and deducting the total value of intermediate consumption of goods and services used to produce that output. This indicator is expressed as a percentage of value added in manufacturing which is the contribution to the economy by the manufacturing sector (ISIC Rev. 3 major division D).","International Yearbook of Industrial Statistics, UN Industrial Development Organization (UNIDO)",1963,2022,59,Economy & Growth
SE.ENR.PRSC.FM.ZS,US,"School enrollment, primary and secondary (gross), gender parity index (GPI)",2,World Development Indicators,Gender parity index for gross enrollment ratio in primary and secondary education is the ratio of girls to boys enrolled at primary and secondary levels in public and private schools.,"Stat Bulk Data Download Service, UN Educational, Scientific and Cultural Organization (UNESCO), uri: https://uis.unesco.org/bdds, publisher: UNESCO Institute for Statistics (UIS)",1981,2020,23,Aid Effectiveness;Climate Change;Education;Gender;Social Development
IT.MLT.MAIN.P2,SE,Fixed telephone subscriptions (per 100 people),2,World Development Indicators,"Fixed telephone subscriptions refers to the sum of active number of analogue fixed telephone lines, voice-over-IP (VoIP) subscriptions, fixed wireless local loop (WLL) subscriptions, ISDN voice-channel equivalents and fixed public payphones.","World Telecommunication/ICT Indicators Database, International Telecommunication Union (ITU)",1960,2023,64,Infrastructure
GC.TAX.IMPT.ZS,FI,Customs and other import duties (% of tax revenue),2,World Development Indicators,"Taxes and duties on imports are taxes on goods and services that become payable at the moment when goods enter the economic territory or when services are delivered by non-resident producers to residents. This indicator is expressed as a percentage of tax revenue which includes compulsory, unrequited payments, in cash or in kind, made by institutional units to government units.","Government Finance Statistics Yearbook and data files, International Monetary Fund (IMF)",1972,2013,34,Public Sector;Trade
EN.GHG.CH4.TR.MT.CE.AR5,GB,Methane (CH4) emissions from Transport (Energy) (Mt CO2e),2,World Development Indicators,"A measure of annual emissions of methane (CH4), one of the six Kyoto greenhouse gases (GHG), from the transportation sector (subsector of the energy sector) including IPCC 2006 codes 1.A.3.a Civil Aviation, 1.A.3.b_noRES Road Transportation no resuspension, 1.A.3.c Railways, 1.A.3.d Water-borne Navigation, 1.A.3.e Other Transportation. The measure is standardized to carbon dioxide equivalent values using the Global Warming Potential (GWP) factors of IPCC's 5th Assessment Report (AR5).","EDGAR (Emissions Database for Global Atmospheric Research) Community GHG Database, Joint Research Centre (JRC) - European Commission, uri: https://edgar.jrc.ec.europa.eu/dataset_ghg2024, publisher: JRC European Commission, date published: 2024;
International Energy Agency (IEA), uri: https://edgar.jrc.ec.europa.eu/dataset_ghg2024, publisher: JRC European Commission, date published: 2024",1970,2024,55,Environment
IC.FRM.BKWC.ZS,US,Firms using banks to finance working capital (% of firms) ,2,World Development Indicators,Percentage of firms using bank loans to finance working capital.,"Enterprise Surveys, World Bank (WB), uri: https://www.enterprisesurveys.org/en/data",2024,2024,1,Private Sector
NE.EXP.GNFS.KD.ZG,FI,Exports of goods and services (annual % growth),2,World Development Indicators,"Exports of goods includes changes in the economic ownership of goods from residents of the compiling economy to non-residents, irrespective of physical movement of goods across national borders. Exports of services includes services provided by residents to non-residents. This indicator denotes the percentage change over each previous year of the constant price (base year 2015) series in United States dollars.","Country official statistics, National Statistical Organizations and/or Central Banks;
National Accounts data files, Organisation for Economic Co-operation and Development (OECD);
Staff estimates, World Bank (WB)",1971,2024,54,Economy & Growth;Trade
FM.LBL.BMNY.GD.ZS,US,Broad money (% of GDP),2,World Development Indicators,"Broad money is the sum of all liquid financial instruments held by money-holding sectors that are widely accepted in an economy as a medium of exchange, plus those that can be converted into a medium of exchange at short notice at, or close to, their full nominal value. This indicator is expressed as a percentage of Gross Domestic Product (GDP) which is the total income earned through the production of goods and services in an economic territory during an accounting period.","International Financial Statistics database, International Monetary Fund (IMF);
World Development Indicators Database, World Bank (WB);
National Accounts data files, Organisation for Economic Co-operation and Development (OECD)",1960,2024,65,Financial Sector
FR.INR.LEND,GB,Lending interest rate (%),2,World Development Indicators,"Lending rate is the bank rate that usually meets the short- and medium-term financing needs of the private sector. This rate is normally differentiated according to creditworthiness of borrowers and objectives of financing. The terms and conditions attached to these rates differ by country, however, limiting their comparability. This indicator is expressed as a percentage (a÷b)*100.","International Financial Statistics database, International Monetary Fund (IMF)",1967,2014,48,Financial Sector
NY.GDP.TOTL.RT.ZS,NO,Total natural resources rents (% of GDP),2,World Development Indicators,"Total natural resources rents are the sum of oil rents, natural gas rents, coal rents (hard and soft), mineral rents, and forest rents.","The Changing Wealth of Nations, World Bank (WB), uri: https://www.worldbank.org/en/publication/changing-wealth-of-nations/data, note: World Bank staff estimates based on sources and methods described in the World Bank's The Changing Wealth of Nations., publisher: World Bank (WB);
Staff estimates, World Bank (WB), note: World Bank staff estimates based on sources and methods described in the World Bank's The Changing Wealth of Nations.",1970,2021,52,Energy & Mining;Environment
NY.GNP.PCAP.PP.CD,NO,"GNI per capita, PPP (current international $)",2,World Development Indicators,"This indicator provides values for gross national income (GNI) per person expressed in current international dollars, converted by purchasing power parities (PPPs). PPPs account for the different price levels across countries and thus PPP-based comparisons of economic output are more appropriate for comparing the output of economies and the average material well-being of their inhabitants than exchange-rate based comparisons. 

Gross national income is the total income earned by all residents within an economic territory during an accounting period. It is equal to gross domestic product plus earned income receivable from abroad minus earned income payable abroad. The core indicator has been divided by the general population to achieve a per capita estimate. This series has been linked to produce a consistent time series to counteract breaks in series over time due to changes in base years, source data and methodologies. Thus, it may not be comparable with other national accounts series in the database for historical years. This indicator is expressed in current prices, meaning no adjustment has been made to account for price changes over time. The PPP conversion factor is a currency conversion factor and a spatial price deflator. PPPs convert different currencies to a common currency and, in the process of conversion, equalize their purchasing power by eliminating the differences in price levels between countries, thereby allowing volume or output comparisons of GDP and its expenditure components.","International Comparison Program (ICP), World Bank (WB), uri: https://www.worldbank.org/en/programs/icp/data, note: This information is for ICP’s PPPs utilized in WDI, publisher: International Comparison Program (ICP), date accessed: May 30, 2024, date published: May 30, 2024;
The Eurostat PPP Programme, Eurostat (ESTAT), uri: https://ec.europa.eu/eurostat/databrowser/explore/all/all_themes, publisher: Eurostat;
The OECD PPP Programme, Organisation for Economic Co-operation and Development (OECD), uri: https://data-explorer.oecd.org/, publisher: OECD;
Staff estimates, World Bank (WB);
National Accounts data files, Organisation for Economic Co-operation and Development (OECD);
World Economic Outlook database, International Monetary Fund (IMF)",1990,2024,35,Economy & Growth
GC.XPN.INTP.CN,NO,Interest payments (current LCU),2,World Development Indicators,"Interest payments include interest payments on government debt (including long-term bonds, long-term loans, and other debt instruments) to domestic and foreign residents. This indicator is expressed in current prices, meaning no adjustment has been made to account for price changes over time. This series is expressed in local currency units.","Government Finance Statistics Yearbook and data files, International Monetary Fund (IMF)",1972,2023,52,Public Sector
SE.PRM.OENR.FE.ZS,FI,"Over-age students, primary, female (% of female enrollment)",2,World Development Indicators,Over-age students are the percentage of those enrolled who are older than the official school-age range for primary education.,"Stat Bulk Data Download Service, UN Educational, Scientific and Cultural Organization (UNESCO), uri: https://uis.unesco.org/bdds, publisher: UNESCO Institute for Statistics (UIS)",1993,2017,25,Education
EG.USE.COMM.FO.ZS,SE,Fossil fuel energy consumption (% of total),2,World Development Indicators,"Fossil fuel comprises coal, oil, petroleum, and natural gas products.","IEA Energy Statistics Data Browser, International Energy Agency (IEA), uri: https://www.iea.org/data-and-statistics/data-tools/energy-statistics-data-browser, publisher: International Energy Agency (IEA), date accessed: 2025-03-25",1990,2015,26,Energy & Mining
NV.IND.MANF.CN,US,"Manufacturing, value added (current LCU)",2,World Development Indicators,"Manufacturing includes industries classified in ISIC (Rev. 3) major division C and is defined as the physical or chemical tranformation of materials or components into new products. Value added is the contribution to the economy by a producer or an industry or an institutional sector, which is estimated by the total value of output produced and deducting the total value of intermediate consumption of goods and services used to produce that output. This indicator is expressed in current prices, meaning no adjustment has been made to account for price changes over time. This series is expressed in local currency units.","Country official statistics, National Statistical Organizations and/or Central Banks;
National Accounts data files, Organisation for Economic Co-operation and Development (OECD);
Staff estimates, World Bank (WB)",1997,2021,25,Economy & Growth
